common/gfx906_60.HIP.2_1_0.ufdb.txt
3-224-224-7x7-64-112-112-128-3x3-2x2-1x1-0-NCHW-FP32-F=miopenConvolutionFwdAlgoDirect:ConvAsm7x7c3h224w224k64u2v2p3q3f1,4.04159,0,miopenConvolutionFwdAlgoDirect,3x224x224x7x7x64x112x112x128xNCHWxFP32x3x3x2x2x1x1x1x1;miopenConvolutionFwdAlgoGEMM:gemm,9.78944,7375872,rocBlas,<unused>;miopenConvolutionFwdAlgoWinograd:ConvBinWinogradRxS,5.19471,0,miopenConvolutionFwdAlgoWinograd,3x224x224x7x7x64x112x112x128xNCHWxFP32x3x3x2x2x1x1x1x1
64-56-56-1x1-64-56-56-128-0x0-1x1-1x1-0-NCHW-FP32-F=miopenConvolutionFwdAlgoDirect:ConvAsm1x1U,0.40848,0,miopenConvolutionFwdAlgoDirect,64x56x56x1x1x64x56x56x128xNCHWxFP32x0x0x1x1x1x1x1x1;miopenConvolutionFwdAlgoGEMM:gemm,0.34416,0,rocBlas,<unused>;miopenConvolutionFwdAlgoStaticCompiledGEMM:ConvSCGemmFwd<SCGemmOpFGemm>,0.5512,3211264,miopenConvolutionFwdAlgoStaticCompiledGEMM,64x56x56x1x1x64x56x56x128xNCHWxFP32x0x0x1x1x1x1x1x1;miopenConvolutionFwdAlgoImplicitGEMM:ConvHipImplicitGemmV4Fwd,0.518879,0,miopenConvolutionFwdAlgoImplicitGEMM,64x56x56x1x1x64x56x56x128xNCHWxFP32x0x0x1x1x1x1x1x1;miopenConvolutionFwdAlgoWinograd:ConvBinWinogradRxSf3x2,0.803999,0,miopenConvolutionFwdAlgoWinograd,64x56x56x1x1x64x56x56x128xNCHWxFP32x0x0x1x1x1x1x1x1
64-56-56-3x3-64-56-56-128-1x1-1x1-1x1-0-NCHW-FP32-F=miopenConvolutionFwdAlgoWinograd:ConvBinWinograd3x3U,1.63936,0,miopenConvolutionFwdAlgoWinograd,64x56x56x3x3x64x56x56x128xNCHWxFP32x1x1x1x1x1x1x1x1
64-56-56-1x1-256-56-56-128-0x0-1x1-1x1-0-NCHW-FP32-F=miopenConvolutionFwdAlgoDirect:ConvAsm1x1U,1.62048,0,miopenConvolutionFwdAlgoDirect,64x56x56x1x1x256x56x56x128xNCHWxFP32x0x0x1x1x1x1x1x1;miopenConvolutionFwdAlgoGEMM:gemm,1.38336,0,rocBlas,<unused>;miopenConvolutionFwdAlgoStaticCompiledGEMM:ConvSCGemmFwd<SCGemmOpFGemm>,1.64688,3211264,miopenConvolutionFwdAlgoStaticCompiledGEMM,64x56x56x1x1x256x56x56x128xNCHWxFP32x0x0x1x1x1x1x1x1;miopenConvolutionFwdAlgoImplicitGEMM:ConvHipImplicitGemmV4_1x1,1.77968,0,miopenConvolutionFwdAlgoImplicitGEMM,64x56x56x1x1x256x56x56x128xNCHWxFP32x0x0x1x1x1x1x1x1;miopenConvolutionFwdAlgoWinograd:ConvBinWinogradRxSf3x2,3.09935,0,miopenConvolutionFwdAlgoWinograd,64x56x56x1x1x256x56x56x128xNCHWxFP32x0x0x1x1x1x1x1x1
256-56-56-1x1-64-56-56-128-0x0-1x1-1x1-0-NCHW-FP32-F=miopenConvolutionFwdAlgoDirect:ConvAsm1x1U,1.48208,0,miopenConvolutionFwdAlgoDirect,256x56x56x1x1x64x56x56x128xNCHWxFP32x0x0x1x1x1x1x1x1;miopenConvolutionFwdAlgoGEMM:gemm,1.20096,0,rocBlas,<unused>;miopenConvolutionFwdAlgoStaticCompiledGEMM:ConvSCGemmFwd<SCGemmOpFGemm>,1.54512,3211264,miopenConvolutionFwdAlgoStaticCompiledGEMM,256x56x56x1x1x64x56x56x128xNCHWxFP32x0x0x1x1x1x1x1x1;miopenConvolutionFwdAlgoImplicitGEMM:ConvHipImplicitGemmV4Fwd,1.67952,0,miopenConvolutionFwdAlgoImplicitGEMM,256x56x56x1x1x64x56x56x128xNCHWxFP32x0x0x1x1x1x1x1x1;miopenConvolutionFwdAlgoWinograd:ConvBinWinogradRxSf3x2,2.57488,0,miopenConvolutionFwdAlgoWinograd,256x56x56x1x1x64x56x56x128xNCHWxFP32x0x0x1x1x1x1x1x1
256-56-56-1x1-128-56-56-128-0x0-1x1-1x1-0-NCHW-FP32-F=miopenConvolutionFwdAlgoDirect:ConvAsm1x1U,3.03983,0,miopenConvolutionFwdAlgoDirect,256x56x56x1x1x128x56x56x128xNCHWxFP32x0x0x1x1x1x1x1x1;miopenConvolutionFwdAlgoGEMM:gemm,2.40431,0,rocBlas,<unused>;miopenConvolutionFwdAlgoStaticCompiledGEMM:ConvSCGemmFwd<SCGemmOpFGemm>,2.9304,3211264,miopenConvolutionFwdAlgoStaticCompiledGEMM,256x56x56x1x1x128x56x56x128xNCHWxFP32x0x0x1x1x1x1x1x1;miopenConvolutionFwdAlgoImplicitGEMM:ConvHipImplicitGemmV4Fwd,2.91263,0,miopenConvolutionFwdAlgoImplicitGEMM,256x56x56x1x1x128x56x56x128xNCHWxFP32x0x0x1x1x1x1x1x1;miopenConvolutionFwdAlgoWinograd:ConvBinWinogradRxSf3x2,5.30639,0,miopenConvolutionFwdAlgoWinograd,256x56x56x1x1x128x56x56x128xNCHWxFP32x0x0x1x1x1x1x1x1
128-56-56-3x3-128-28-28-128-1x1-2x2-1x1-0-NCHW-FP32-F=miopenConvolutionFwdAlgoDirect:ConvOclDirectFwd,16.3275,0,miopenConvolutionFwdAlgoDirect,128x56x56x3x3x128x28x28x128xNCHWxFP32x1x1x2x2x1x1x1x1;miopenConvolutionFwdAlgoGEMM:gemm,14.1517,3612672,rocBlas,<unused>;miopenConvolutionFwdAlgoWinograd:ConvBinWinogradRxS,6.06223,0,miopenConvolutionFwdAlgoWinograd,128x56x56x3x3x128x28x28x128xNCHWxFP32x1x1x2x2x1x1x1x1
128-28-28-1x1-512-28-28-128-0x0-1x1-1x1-0-NCHW-FP32-F=miopenConvolutionFwdAlgoDirect:ConvAsm1x1U,1.66784,0,miopenConvolutionFwdAlgoDirect,128x28x28x1x1x512x28x28x128xNCHWxFP32x0x0x1x1x1x1x1x1;miopenConvolutionFwdAlgoGEMM:gemm,1.22384,0,rocBlas,<unused>;miopenConvolutionFwdAlgoStaticCompiledGEMM:ConvSCGemmFwd<SCGemmOpFGemm>,1.49664,802816,miopenConvolutionFwdAlgoStaticCompiledGEMM,128x28x28x1x1x512x28x28x128xNCHWxFP32x0x0x1x1x1x1x1x1;miopenConvolutionFwdAlgoImplicitGEMM:ConvHipImplicitGemmV4Fwd,1.51008,0,miopenConvolutionFwdAlgoImplicitGEMM,128x28x28x1x1x512x28x28x128xNCHWxFP32x0x0x1x1x1x1x1x1;miopenConvolutionFwdAlgoWinograd:ConvBinWinogradRxSf3x2,3.08784,0,miopenConvolutionFwdAlgoWinograd,128x28x28x1x1x512x28x28x128xNCHWxFP32x0x0x1x1x1x1x1x1
256-56-56-1x1-512-28-28-128-0x0-2x2-1x1-0-NCHW-FP32-F=miopenConvolutionFwdAlgoDirect:ConvAsm1x1U,3.10576,102760448,miopenConvolutionFwdAlgoDirect,256x56x56x1x1x512x28x28x128xNCHWxFP32x0x0x2x2x1x1x1x1;miopenConvolutionFwdAlgoGEMM:gemm,3.61536,308281344,rocBlas,<unused>;miopenConvolutionFwdAlgoImplicitGEMM:ConvHipImplicitGemmV4_1x1,2.81776,0,miopenConvolutionFwdAlgoImplicitGEMM,256x56x56x1x1x512x28x28x128xNCHWxFP32x0x0x2x2x1x1x1x1;miopenConvolutionFwdAlgoWinograd:ConvBinWinogradRxS,21.6417,0,miopenConvolutionFwdAlgoWinograd,256x56x56x1x1x512x28x28x128xNCHWxFP32x0x0x2x2x1x1x1x1
512-28-28-1x1-128-28-28-128-0x0-1x1-1x1-0-NCHW-FP32-F=miopenConvolutionFwdAlgoDirect:ConvAsm1x1U,1.68464,0,miopenConvolutionFwdAlgoDirect,512x28x28x1x1x128x28x28x128xNCHWxFP32x0x0x1x1x1x1x1x1;miopenConvolutionFwdAlgoGEMM:gemm,1.4832,0,rocBlas,<unused>;miopenConvolutionFwdAlgoStaticCompiledGEMM:ConvSCGemmFwd<SCGemmOpFGemm>,1.41424,802816,miopenConvolutionFwdAlgoStaticCompiledGEMM,512x28x28x1x1x128x28x28x128xNCHWxFP32x0x0x1x1x1x1x1x1;miopenConvolutionFwdAlgoImplicitGEMM:ConvHipImplicitGemmV4Fwd,1.52224,0,miopenConvolutionFwdAlgoImplicitGEMM,512x28x28x1x1x128x28x28x128xNCHWxFP32x0x0x1x1x1x1x1x1;miopenConvolutionFwdAlgoWinograd:ConvBinWinogradRxSf3x2,3.12208,0,miopenConvolutionFwdAlgoWinograd,512x28x28x1x1x128x28x28x128xNCHWxFP32x0x0x1x1x1x1x1x1
128-28-28-3x3-128-28-28-128-1x1-1x1-1x1-0-NCHW-FP32-F=miopenConvolutionFwdAlgoWinograd:ConvBinWinogradRxS,1.53984,0,miopenConvolutionFwdAlgoWinograd,128x28x28x3x3x128x28x28x128xNCHWxFP32x1x1x1x1x1x1x1x1
512-28-28-1x1-256-28-28-128-0x0-1x1-1x1-0-NCHW-FP32-F=miopenConvolutionFwdAlgoDirect:ConvAsm1x1U,3.0992,0,miopenConvolutionFwdAlgoDirect,512x28x28x1x1x256x28x28x128xNCHWxFP32x0x0x1x1x1x1x1x1;miopenConvolutionFwdAlgoGEMM:gemm,2.63696,0,rocBlas,<unused>;miopenConvolutionFwdAlgoStaticCompiledGEMM:ConvSCGemmFwd<SCGemmOpFGemm>,2.77264,802816,miopenConvolutionFwdAlgoStaticCompiledGEMM,512x28x28x1x1x256x28x28x128xNCHWxFP32x0x0x1x1x1x1x1x1;miopenConvolutionFwdAlgoImplicitGEMM:ConvHipImplicitGemmV4Fwd,2.86192,0,miopenConvolutionFwdAlgoImplicitGEMM,512x28x28x1x1x256x28x28x128xNCHWxFP32x0x0x1x1x1x1x1x1;miopenConvolutionFwdAlgoWinograd:ConvBinWinogradRxSf3x2,5.86623,0,miopenConvolutionFwdAlgoWinograd,512x28x28x1x1x256x28x28x128xNCHWxFP32x0x0x1x1x1x1x1x1
256-28-28-3x3-256-14-14-128-1x1-2x2-1x1-0-NCHW-FP32-F=miopenConvolutionFwdAlgoDirect:ConvOclDirectFwd,13.8409,0,miopenConvolutionFwdAlgoDirect,256x28x28x3x3x256x14x14x128xNCHWxFP32x1x1x2x2x1x1x1x1;miopenConvolutionFwdAlgoGEMM:gemm,13.8445,1806336,rocBlas,<unused>;miopenConvolutionFwdAlgoWinograd:ConvBinWinogradRxS,6.07135,0,miopenConvolutionFwdAlgoWinograd,256x28x28x3x3x256x14x14x128xNCHWxFP32x1x1x2x2x1x1x1x1
256-14-14-1x1-1024-14-14-128-0x0-1x1-1x1-0-NCHW-FP32-F=miopenConvolutionFwdAlgoDirect:ConvAsm1x1U,2.07136,0,miopenConvolutionFwdAlgoDirect,256x14x14x1x1x1024x14x14x128xNCHWxFP32x0x0x1x1x1x1x1x1;miopenConvolutionFwdAlgoGEMM:gemm,1.62,128450560,rocBlas,<unused>;miopenConvolutionFwdAlgoStaticCompiledGEMM:ConvSCGemmFwd<SCGemmOpFGemm>,1.42656,200704,miopenConvolutionFwdAlgoStaticCompiledGEMM,256x14x14x1x1x1024x14x14x128xNCHWxFP32x0x0x1x1x1x1x1x1;miopenConvolutionFwdAlgoImplicitGEMM:ConvHipImplicitGemmV4Fwd,1.48736,0,miopenConvolutionFwdAlgoImplicitGEMM,256x14x14x1x1x1024x14x14x128xNCHWxFP32x0x0x1x1x1x1x1x1;miopenConvolutionFwdAlgoWinograd:ConvBinWinogradRxSf3x2,2.95152,0,miopenConvolutionFwdAlgoWinograd,256x14x14x1x1x1024x14x14x128xNCHWxFP32x0x0x1x1x1x1x1x1
512-28-28-1x1-1024-14-14-128-0x0-2x2-1x1-0-NCHW-FP32-F=miopenConvolutionFwdAlgoDirect:ConvAsm1x1U,4.16,51380224,miopenConvolutionFwdAlgoDirect,512x28x28x1x1x1024x14x14x128xNCHWxFP32x0x0x2x2x1x1x1x1;miopenConvolutionFwdAlgoGEMM:gemm,3.11744,154140672,rocBlas,<unused>;miopenConvolutionFwdAlgoImplicitGEMM:ConvHipImplicitGemmV4_1x1,3.42848,0,miopenConvolutionFwdAlgoImplicitGEMM,512x28x28x1x1x1024x14x14x128xNCHWxFP32x0x0x2x2x1x1x1x1;miopenConvolutionFwdAlgoWinograd:ConvBinWinogradRxS,21.6123,0,miopenConvolutionFwdAlgoWinograd,512x28x28x1x1x1024x14x14x128xNCHWxFP32x0x0x2x2x1x1x1x1
1024-14-14-1x1-256-14-14-128-0x0-1x1-1x1-0-NCHW-FP32-F=miopenConvolutionFwdAlgoDirect:ConvAsm1x1U,1.59008,0,miopenConvolutionFwdAlgoDirect,1024x14x14x1x1x256x14x14x128xNCHWxFP32x0x0x1x1x1x1x1x1;miopenConvolutionFwdAlgoGEMM:gemm,1.79456,128450560,rocBlas,<unused>;miopenConvolutionFwdAlgoStaticCompiledGEMM:ConvSCGemmFwd<SCGemmOpFGemm>,1.37664,200704,miopenConvolutionFwdAlgoStaticCompiledGEMM,1024x14x14x1x1x256x14x14x128xNCHWxFP32x0x0x1x1x1x1x1x1;miopenConvolutionFwdAlgoImplicitGEMM:ConvHipImplicitGemmV4Fwd,1.69712,0,miopenConvolutionFwdAlgoImplicitGEMM,1024x14x14x1x1x256x14x14x128xNCHWxFP32x0x0x1x1x1x1x1x1;miopenConvolutionFwdAlgoWinograd:ConvBinWinogradRxSf3x2,3.18192,0,miopenConvolutionFwdAlgoWinograd,1024x14x14x1x1x256x14x14x128xNCHWxFP32x0x0x1x1x1x1x1x1
256-14-14-3x3-256-14-14-128-1x1-1x1-1x1-0-NCHW-FP32-F=miopenConvolutionFwdAlgoWinograd:ConvBinWinograd3x3U,1.30176,0,miopenConvolutionFwdAlgoWinograd,256x14x14x3x3x256x14x14x128xNCHWxFP32x1x1x1x1x1x1x1x1
1024-14-14-1x1-512-14-14-128-0x0-1x1-1x1-0-NCHW-FP32-F=miopenConvolutionFwdAlgoDirect:ConvAsm1x1U,3.76175,0,miopenConvolutionFwdAlgoDirect,1024x14x14x1x1x512x14x14x128xNCHWxFP32x0x0x1x1x1x1x1x1;miopenConvolutionFwdAlgoGEMM:gemm,2.95424,154140672,rocBlas,<unused>;miopenConvolutionFwdAlgoStaticCompiledGEMM:ConvSCGemmFwd<SCGemmOpFGemm>,2.88272,200704,miopenConvolutionFwdAlgoStaticCompiledGEMM,1024x14x14x1x1x512x14x14x128xNCHWxFP32x0x0x1x1x1x1x1x1;miopenConvolutionFwdAlgoImplicitGEMM:ConvHipImplicitGemmV4Fwd,3.21216,0,miopenConvolutionFwdAlgoImplicitGEMM,1024x14x14x1x1x512x14x14x128xNCHWxFP32x0x0x1x1x1x1x1x1;miopenConvolutionFwdAlgoWinograd:ConvBinWinogradRxSf3x2,5.88271,0,miopenConvolutionFwdAlgoWinograd,1024x14x14x1x1x512x14x14x128xNCHWxFP32x0x0x1x1x1x1x1x1
512-14-14-3x3-512-7-7-128-1x1-2x2-1x1-0-NCHW-FP32-F=miopenConvolutionFwdAlgoDirect:ConvOclDirectFwd,19.6379,0,miopenConvolutionFwdAlgoDirect,512x14x14x3x3x512x7x7x128xNCHWxFP32x1x1x2x2x1x1x1x1;miopenConvolutionFwdAlgoGEMM:gemm,48.3328,903168,rocBlas,<unused>;miopenConvolutionFwdAlgoWinograd:ConvBinWinogradRxS,7.86303,0,miopenConvolutionFwdAlgoWinograd,512x14x14x3x3x512x7x7x128xNCHWxFP32x1x1x2x2x1x1x1x1
512-7-7-1x1-2048-7-7-128-0x0-1x1-1x1-0-NCHW-FP32-F=miopenConvolutionFwdAlgoDirect:ConvAsm1x1U,2.22064,0,miopenConvolutionFwdAlgoDirect,512x7x7x1x1x2048x7x7x128xNCHWxFP32x0x0x1x1x1x1x1x1;miopenConvolutionFwdAlgoGEMM:gemm,1.47552,64225280,rocBlas,<unused>;miopenConvolutionFwdAlgoStaticCompiledGEMM:ConvSCGemmFwd<SCGemmOpFGemm>,1.74256,51200,miopenConvolutionFwdAlgoStaticCompiledGEMM,512x7x7x1x1x2048x7x7x128xNCHWxFP32x0x0x1x1x1x1x1x1;miopenConvolutionFwdAlgoImplicitGEMM:ConvHipImplicitGemmV4_1x1,1.59952,0,miopenConvolutionFwdAlgoImplicitGEMM,512x7x7x1x1x2048x7x7x128xNCHWxFP32x0x0x1x1x1x1x1x1;miopenConvolutionFwdAlgoWinograd:ConvBinWinogradRxSf3x2,4.03296,0,miopenConvolutionFwdAlgoWinograd,512x7x7x1x1x2048x7x7x128xNCHWxFP32x0x0x1x1x1x1x1x1
1024-14-14-1x1-2048-7-7-128-0x0-2x2-1x1-0-NCHW-FP32-F=miopenConvolutionFwdAlgoDirect:ConvAsm1x1U,4.78399,25690112,miopenConvolutionFwdAlgoDirect,1024x14x14x1x1x2048x7x7x128xNCHWxFP32x0x0x2x2x1x1x1x1;miopenConvolutionFwdAlgoGEMM:gemm,2.96528,77070336,rocBlas,<unused>;miopenConvolutionFwdAlgoImplicitGEMM:ConvHipImplicitGemmV4_1x1,3.92144,0,miopenConvolutionFwdAlgoImplicitGEMM,1024x14x14x1x1x2048x7x7x128xNCHWxFP32x0x0x2x2x1x1x1x1;miopenConvolutionFwdAlgoWinograd:ConvBinWinogradRxS,28.0035,0,miopenConvolutionFwdAlgoWinograd,1024x14x14x1x1x2048x7x7x128xNCHWxFP32x0x0x2x2x1x1x1x1
2048-7-7-1x1-512-7-7-128-0x0-1x1-1x1-0-NCHW-FP32-F=miopenConvolutionFwdAlgoDirect:ConvOclDirectFwd1x1,2.19168,0,miopenConvolutionFwdAlgoDirect,2048x7x7x1x1x512x7x7x128xNCHWxFP32x0x0x1x1x1x1x1x1;miopenConvolutionFwdAlgoGEMM:gemm,2.48,64225280,rocBlas,<unused>;miopenConvolutionFwdAlgoStaticCompiledGEMM:ConvSCGemmFwd<SCGemmOpFGemm>,1.696,51200,miopenConvolutionFwdAlgoStaticCompiledGEMM,2048x7x7x1x1x512x7x7x128xNCHWxFP32x0x0x1x1x1x1x1x1;miopenConvolutionFwdAlgoImplicitGEMM:ConvHipImplicitGemmV4Fwd,2.12192,0,miopenConvolutionFwdAlgoImplicitGEMM,2048x7x7x1x1x512x7x7x128xNCHWxFP32x0x0x1x1x1x1x1x1;miopenConvolutionFwdAlgoWinograd:ConvBinWinogradRxSf3x2,4.46799,0,miopenConvolutionFwdAlgoWinograd,2048x7x7x1x1x512x7x7x128xNCHWxFP32x0x0x1x1x1x1x1x1
512-7-7-3x3-512-7-7-128-1x1-1x1-1x1-0-NCHW-FP32-F=miopenConvolutionFwdAlgoWinograd:ConvBinWinogradRxS,1.8752,0,miopenConvolutionFwdAlgoWinograd,512x7x7x3x3x512x7x7x128xNCHWxFP32x1x1x1x1x1x1x1x1
2048-7-7-1x1-512-7-7-128-0x0-1x1-1x1-0-NCHW-FP32-B=miopenConvolutionBwdDataAlgoGEMM:gemm,1.83584,0,rocBlas,<unused>;miopenConvolutionBwdDataAlgoImplicitGEMM:ConvHipImplicitGemmV4_1x1,1.7528,0,miopenConvolutionBwdDataAlgoImplicitGEMM,2048x7x7x1x1x512x7x7x128xNCHWxFP32x0x0x1x1x1x1x1x0;miopenConvolutionBwdDataAlgoWinograd:ConvBinWinogradRxSf3x2,4.45823,0,miopenConvolutionBwdDataAlgoWinograd,2048x7x7x1x1x512x7x7x128xNCHWxFP32x0x0x1x1x1x1x1x0;miopenConvolutionBwdDataAlgoDirect:ConvAsm1x1U,1.7056,0,miopenConvolutionBwdDataAlgoDirect,2048x7x7x1x1x512x7x7x128xNCHWxFP32x0x0x1x1x1x1x1x0
2048-7-7-1x1-512-7-7-128-0x0-1x1-1x1-0-NCHW-FP32-W=miopenConvolutionBwdWeightsAlgoWinograd:ConvBinWinogradRxS,7.40543,0,miopenConvolutionBwdWeightsAlgoWinograd,2048x7x7x1x1x512x7x7x128xNCHWxFP32x0x0x1x1x1x1x1x0;miopenConvolutionBwdWeightsAlgoGEMM:gemm,4.28863,0,rocBlas,<unused>;miopenConvolutionBwdWeightsAlgoDirect:ConvAsmBwdWrW1x1,1.94544,0,miopenConvolutionBwdWeightsAlgoDirect,2048x7x7x1x1x512x7x7x128xNCHWxFP32x0x0x1x1x1x1x1x0
512-7-7-3x3-512-7-7-128-1x1-1x1-1x1-0-NCHW-FP32-B=miopenConvolutionBwdDataAlgoWinograd:ConvBinWinogradRxS,1.74896,0,miopenConvolutionBwdDataAlgoWinograd,512x7x7x3x3x512x7x7x128xNCHWxFP32x1x1x1x1x1x1x1x0
512-7-7-3x3-512-7-7-128-1x1-1x1-1x1-0-NCHW-FP32-W=miopenConvolutionBwdWeightsAlgoWinograd:ConvWinograd3x3MultipassWrW<3-4>,1.75136,113246208,miopenConvolutionBwdWeightsAlgoWinograd,512x7x7x3x3x512x7x7x128xNCHWxFP32x1x1x1x1x1x1x1x0;miopenConvolutionBwdWeightsAlgoGEMM:gemm,10.9158,903168,rocBlas,<unused>;miopenConvolutionBwdWeightsAlgoDirect:ConvAsmBwdWrW3x3,3.25599,0,miopenConvolutionBwdWeightsAlgoDirect,512x7x7x3x3x512x7x7x128xNCHWxFP32x1x1x1x1x1x1x1x0
512-7-7-1x1-2048-7-7-128-0x0-1x1-1x1-0-NCHW-FP32-B=miopenConvolutionBwdDataAlgoGEMM:gemm,1.85328,0,rocBlas,<unused>;miopenConvolutionBwdDataAlgoImplicitGEMM:ConvHipImplicitGemmV4_1x1,1.53792,0,miopenConvolutionBwdDataAlgoImplicitGEMM,512x7x7x1x1x2048x7x7x128xNCHWxFP32x0x0x1x1x1x1x1x0;miopenConvolutionBwdDataAlgoWinograd:ConvBinWinogradRxSf3x2,4.40479,0,miopenConvolutionBwdDataAlgoWinograd,512x7x7x1x1x2048x7x7x128xNCHWxFP32x0x0x1x1x1x1x1x0;miopenConvolutionBwdDataAlgoDirect:ConvAsm1x1U,1.62688,0,miopenConvolutionBwdDataAlgoDirect,512x7x7x1x1x2048x7x7x128xNCHWxFP32x0x0x1x1x1x1x1x0
512-7-7-1x1-2048-7-7-128-0x0-1x1-1x1-0-NCHW-FP32-W=miopenConvolutionBwdWeightsAlgoWinograd:ConvBinWinogradRxS,7.78142,0,miopenConvolutionBwdWeightsAlgoWinograd,512x7x7x1x1x2048x7x7x128xNCHWxFP32x0x0x1x1x1x1x1x0;miopenConvolutionBwdWeightsAlgoGEMM:gemm,4.81727,0,rocBlas,<unused>;miopenConvolutionBwdWeightsAlgoDirect:ConvAsmBwdWrW1x1,2.13232,0,miopenConvolutionBwdWeightsAlgoDirect,512x7x7x1x1x2048x7x7x128xNCHWxFP32x0x0x1x1x1x1x1x0
2048-7-7-1x1-1024-14-14-128-0x0-2x2-1x1-0-NCHW-FP32-B=miopenConvolutionBwdDataAlgoDirect:ConvAsm1x1UV2,3.54959,0,miopenConvolutionBwdDataAlgoDirect,2048x7x7x1x1x1024x14x14x128xNCHWxFP32x0x0x2x2x1x1x1x0;miopenConvolutionBwdDataAlgoGEMM:gemm,3.69184,77070336,rocBlas,<unused>;miopenConvolutionBwdDataAlgoImplicitGEMM:ConvHipImplicitGemmV4_1x1,3.40303,0,miopenConvolutionBwdDataAlgoImplicitGEMM,2048x7x7x1x1x1024x14x14x128xNCHWxFP32x0x0x2x2x1x1x1x0
2048-7-7-1x1-1024-14-14-128-0x0-2x2-1x1-0-NCHW-FP32-W=miopenConvolutionBwdWeightsAlgoDirect:ConvAsmBwdWrW1x1,3.93263,25690112,miopenConvolutionBwdWeightsAlgoDirect,2048x7x7x1x1x1024x14x14x128xNCHWxFP32x0x0x2x2x1x1x1x0;miopenConvolutionBwdWeightsAlgoGEMM:gemm,11.223,200704,rocBlas,<unused>
512-7-7-3x3-512-14-14-128-1x1-2x2-1x1-0-NCHW-FP32-B=miopenConvolutionBwdDataAlgoGEMM:gemm,12.8614,903168,rocBlas,<unused>;miopenConvolutionBwdDataAlgoWinograd:ConvBinWinogradRxS,6.85343,0,miopenConvolutionBwdDataAlgoWinograd,512x7x7x3x3x512x14x14x128xNCHWxFP32x1x1x2x2x1x1x1x0;miopenConvolutionBwdDataAlgoDirect:ConvOclDirectFwd,11.1184,0,miopenConvolutionBwdDataAlgoDirect,512x7x7x3x3x512x14x14x128xNCHWxFP32x1x1x2x2x1x1x1x0
512-7-7-3x3-512-14-14-128-1x1-2x2-1x1-0-NCHW-FP32-W=miopenConvolutionBwdWeightsAlgoWinograd:ConvWinograd3x3MultipassWrW<3-3>,6.23039,282591232,miopenConvolutionBwdWeightsAlgoWinograd,512x7x7x3x3x512x14x14x128xNCHWxFP32x1x1x2x2x1x1x1x0;miopenConvolutionBwdWeightsAlgoGEMM:gemm,10.6086,903168,rocBlas,<unused>;miopenConvolutionBwdWeightsAlgoDirect:ConvAsmBwdWrW3x3,5.03583,0,miopenConvolutionBwdWeightsAlgoDirect,512x7x7x3x3x512x14x14x128xNCHWxFP32x1x1x2x2x1x1x1x0
512-14-14-1x1-1024-14-14-128-0x0-1x1-1x1-0-NCHW-FP32-B=miopenConvolutionBwdDataAlgoGEMM:gemm,3.05199,0,rocBlas,<unused>;miopenConvolutionBwdDataAlgoImplicitGEMM:ConvHipImplicitGemmV4_1x1,2.59488,0,miopenConvolutionBwdDataAlgoImplicitGEMM,512x14x14x1x1x1024x14x14x128xNCHWxFP32x0x0x1x1x1x1x1x0;miopenConvolutionBwdDataAlgoWinograd:ConvBinWinogradRxSf3x2,5.52223,0,miopenConvolutionBwdDataAlgoWinograd,512x14x14x1x1x1024x14x14x128xNCHWxFP32x0x0x1x1x1x1x1x0;miopenConvolutionBwdDataAlgoDirect:ConvAsm1x1U,2.53135,0,miopenConvolutionBwdDataAlgoDirect,512x14x14x1x1x1024x14x14x128xNCHWxFP32x0x0x1x1x1x1x1x0
512-14-14-1x1-1024-14-14-128-0x0-1x1-1x1-0-NCHW-FP32-W=miopenConvolutionBwdWeightsAlgoWinograd:ConvBinWinogradRxS,22.6902,0,miopenConvolutionBwdWeightsAlgoWinograd,512x14x14x1x1x1024x14x14x128xNCHWxFP32x0x0x1x1x1x1x1x0;miopenConvolutionBwdWeightsAlgoGEMM:gemm,6.45631,0,rocBlas,<unused>;miopenConvolutionBwdWeightsAlgoDirect:ConvAsmBwdWrW1x1,3.55967,0,miopenConvolutionBwdWeightsAlgoDirect,512x14x14x1x1x1024x14x14x128xNCHWxFP32x0x0x1x1x1x1x1x0
1024-14-14-1x1-256-14-14-128-0x0-1x1-1x1-0-NCHW-FP32-B=miopenConvolutionBwdDataAlgoGEMM:gemm,1.57872,0,rocBlas,<unused>;miopenConvolutionBwdDataAlgoImplicitGEMM:ConvHipImplicitGemmV4_1x1,1.5384,0,miopenConvolutionBwdDataAlgoImplicitGEMM,1024x14x14x1x1x256x14x14x128xNCHWxFP32x0x0x1x1x1x1x1x0;miopenConvolutionBwdDataAlgoWinograd:ConvBinWinogradRxSf3x2,2.96399,0,miopenConvolutionBwdDataAlgoWinograd,1024x14x14x1x1x256x14x14x128xNCHWxFP32x0x0x1x1x1x1x1x0;miopenConvolutionBwdDataAlgoDirect:ConvAsm1x1U,1.45472,0,miopenConvolutionBwdDataAlgoDirect,1024x14x14x1x1x256x14x14x128xNCHWxFP32x0x0x1x1x1x1x1x0
1024-14-14-1x1-256-14-14-128-0x0-1x1-1x1-0-NCHW-FP32-W=miopenConvolutionBwdWeightsAlgoWinograd:ConvBinWinogradRxS,9.36174,0,miopenConvolutionBwdWeightsAlgoWinograd,1024x14x14x1x1x256x14x14x128xNCHWxFP32x0x0x1x1x1x1x1x0;miopenConvolutionBwdWeightsAlgoGEMM:gemm,3.99151,0,rocBlas,<unused>;miopenConvolutionBwdWeightsAlgoDirect:ConvAsmBwdWrW1x1,2.56511,0,miopenConvolutionBwdWeightsAlgoDirect,1024x14x14x1x1x256x14x14x128xNCHWxFP32x0x0x1x1x1x1x1x0
256-14-14-3x3-256-14-14-128-1x1-1x1-1x1-0-NCHW-FP32-B=miopenConvolutionBwdDataAlgoWinograd:ConvBinWinograd3x3U,2.52976,0,miopenConvolutionBwdDataAlgoWinograd,256x14x14x3x3x256x14x14x128xNCHWxFP32x1x1x1x1x1x1x1x0
256-14-14-3x3-256-14-14-128-1x1-1x1-1x1-0-NCHW-FP32-W=miopenConvolutionBwdWeightsAlgoWinograd:ConvWinograd3x3MultipassWrW<3-5>,2.46944,128450560,miopenConvolutionBwdWeightsAlgoWinograd,256x14x14x3x3x256x14x14x128xNCHWxFP32x1x1x1x1x1x1x1x0;miopenConvolutionBwdWeightsAlgoGEMM:gemm,9.4208,1806336,rocBlas,<unused>;miopenConvolutionBwdWeightsAlgoDirect:ConvAsmBwdWrW3x3,3.33071,0,miopenConvolutionBwdWeightsAlgoDirect,256x14x14x3x3x256x14x14x128xNCHWxFP32x1x1x1x1x1x1x1x0
256-14-14-1x1-1024-14-14-128-0x0-1x1-1x1-0-NCHW-FP32-B=miopenConvolutionBwdDataAlgoGEMM:gemm,1.52352,0,rocBlas,<unused>;miopenConvolutionBwdDataAlgoImplicitGEMM:ConvHipImplicitGemmV4_1x1,1.54768,0,miopenConvolutionBwdDataAlgoImplicitGEMM,256x14x14x1x1x1024x14x14x128xNCHWxFP32x0x0x1x1x1x1x1x0;miopenConvolutionBwdDataAlgoWinograd:ConvBinWinogradRxSf3x2,2.8928,0,miopenConvolutionBwdDataAlgoWinograd,256x14x14x1x1x1024x14x14x128xNCHWxFP32x0x0x1x1x1x1x1x0;miopenConvolutionBwdDataAlgoDirect:ConvAsm1x1U,1.48288,0,miopenConvolutionBwdDataAlgoDirect,256x14x14x1x1x1024x14x14x128xNCHWxFP32x0x0x1x1x1x1x1x0
256-14-14-1x1-1024-14-14-128-0x0-1x1-1x1-0-NCHW-FP32-W=miopenConvolutionBwdWeightsAlgoWinograd:ConvBinWinogradRxS,12.2062,0,miopenConvolutionBwdWeightsAlgoWinograd,256x14x14x1x1x1024x14x14x128xNCHWxFP32x0x0x1x1x1x1x1x0;miopenConvolutionBwdWeightsAlgoGEMM:gemm,4.51151,0,rocBlas,<unused>;miopenConvolutionBwdWeightsAlgoDirect:ConvAsmBwdWrW1x1,2.21456,0,miopenConvolutionBwdWeightsAlgoDirect,256x14x14x1x1x1024x14x14x128xNCHWxFP32x0x0x1x1x1x1x1x0
1024-14-14-1x1-512-28-28-128-0x0-2x2-1x1-0-NCHW-FP32-B=miopenConvolutionBwdDataAlgoDirect:ConvAsm1x1UV2,3.14815,0,miopenConvolutionBwdDataAlgoDirect,1024x14x14x1x1x512x28x28x128xNCHWxFP32x0x0x2x2x1x1x1x0;miopenConvolutionBwdDataAlgoGEMM:gemm,3.92128,154140672,rocBlas,<unused>;miopenConvolutionBwdDataAlgoImplicitGEMM:ConvHipImplicitGemmV4_1x1,3.23103,0,miopenConvolutionBwdDataAlgoImplicitGEMM,1024x14x14x1x1x512x28x28x128xNCHWxFP32x0x0x2x2x1x1x1x0
1024-14-14-1x1-512-28-28-128-0x0-2x2-1x1-0-NCHW-FP32-W=miopenConvolutionBwdWeightsAlgoDirect:ConvAsmBwdWrW1x1,4.10207,51380224,miopenConvolutionBwdWeightsAlgoDirect,1024x14x14x1x1x512x28x28x128xNCHWxFP32x0x0x2x2x1x1x1x0;miopenConvolutionBwdWeightsAlgoGEMM:gemm,9.46176,401408,rocBlas,<unused>
256-14-14-3x3-256-28-28-128-1x1-2x2-1x1-0-NCHW-FP32-B=miopenConvolutionBwdDataAlgoGEMM:gemm,11.6736,1806336,rocBlas,<unused>;miopenConvolutionBwdDataAlgoWinograd:ConvBinWinogradRxS,6.05183,0,miopenConvolutionBwdDataAlgoWinograd,256x14x14x3x3x256x28x28x128xNCHWxFP32x1x1x2x2x1x1x1x0;miopenConvolutionBwdDataAlgoDirect:ConvOclDirectFwd,9.77102,0,miopenConvolutionBwdDataAlgoDirect,256x14x14x3x3x256x28x28x128xNCHWxFP32x1x1x2x2x1x1x1x0
256-14-14-3x3-256-28-28-128-1x1-2x2-1x1-0-NCHW-FP32-W=miopenConvolutionBwdWeightsAlgoWinograd:ConvWinograd3x3MultipassWrW<3-2>,4.80416,327680000,miopenConvolutionBwdWeightsAlgoWinograd,256x14x14x3x3x256x28x28x128xNCHWxFP32x1x1x2x2x1x1x1x0;miopenConvolutionBwdWeightsAlgoGEMM:gemm,8.4992,1806336,rocBlas,<unused>;miopenConvolutionBwdWeightsAlgoDirect:ConvAsmBwdWrW3x3,4.96688,0,miopenConvolutionBwdWeightsAlgoDirect,256x14x14x3x3x256x28x28x128xNCHWxFP32x1x1x2x2x1x1x1x0
256-28-28-1x1-512-28-28-128-0x0-1x1-1x1-0-NCHW-FP32-B=miopenConvolutionBwdDataAlgoGEMM:gemm,2.6808,0,rocBlas,<unused>;miopenConvolutionBwdDataAlgoImplicitGEMM:ConvHipImplicitGemmV4_1x1,2.90256,0,miopenConvolutionBwdDataAlgoImplicitGEMM,256x28x28x1x1x512x28x28x128xNCHWxFP32x0x0x1x1x1x1x1x0;miopenConvolutionBwdDataAlgoWinograd:ConvBinWinogradRxSf3x2,5.84608,0,miopenConvolutionBwdDataAlgoWinograd,256x28x28x1x1x512x28x28x128xNCHWxFP32x0x0x1x1x1x1x1x0;miopenConvolutionBwdDataAlgoDirect:ConvAsm1x1U,2.53728,0,miopenConvolutionBwdDataAlgoDirect,256x28x28x1x1x512x28x28x128xNCHWxFP32x0x0x1x1x1x1x1x0
256-28-28-1x1-512-28-28-128-0x0-1x1-1x1-0-NCHW-FP32-W=miopenConvolutionBwdWeightsAlgoWinograd:ConvBinWinogradRxS,23.2741,0,miopenConvolutionBwdWeightsAlgoWinograd,256x28x28x1x1x512x28x28x128xNCHWxFP32x0x0x1x1x1x1x1x0;miopenConvolutionBwdWeightsAlgoGEMM:gemm,8.50047,0,rocBlas,<unused>;miopenConvolutionBwdWeightsAlgoDirect:ConvAsmBwdWrW1x1,4.15088,0,miopenConvolutionBwdWeightsAlgoDirect,256x28x28x1x1x512x28x28x128xNCHWxFP32x0x0x1x1x1x1x1x0
512-28-28-1x1-128-28-28-128-0x0-1x1-1x1-0-NCHW-FP32-B=miopenConvolutionBwdDataAlgoGEMM:gemm,1.39472,0,rocBlas,<unused>;miopenConvolutionBwdDataAlgoImplicitGEMM:ConvHipImplicitGemmV4_1x1,1.50912,0,miopenConvolutionBwdDataAlgoImplicitGEMM,512x28x28x1x1x128x28x28x128xNCHWxFP32x0x0x1x1x1x1x1x0;miopenConvolutionBwdDataAlgoWinograd:ConvBinWinogradRxSf3x2,2.84864,0,miopenConvolutionBwdDataAlgoWinograd,512x28x28x1x1x128x28x28x128xNCHWxFP32x0x0x1x1x1x1x1x0;miopenConvolutionBwdDataAlgoDirect:ConvAsm1x1U,1.31904,0,miopenConvolutionBwdDataAlgoDirect,512x28x28x1x1x128x28x28x128xNCHWxFP32x0x0x1x1x1x1x1x0
512-28-28-1x1-128-28-28-128-0x0-1x1-1x1-0-NCHW-FP32-W=miopenConvolutionBwdWeightsAlgoWinograd:ConvBinWinogradRxS,12.3051,0,miopenConvolutionBwdWeightsAlgoWinograd,512x28x28x1x1x128x28x28x128xNCHWxFP32x0x0x1x1x1x1x1x0;miopenConvolutionBwdWeightsAlgoGEMM:gemm,6.0472,0,rocBlas,<unused>;miopenConvolutionBwdWeightsAlgoDirect:ConvAsmBwdWrW1x1,2.39104,0,miopenConvolutionBwdWeightsAlgoDirect,512x28x28x1x1x128x28x28x128xNCHWxFP32x0x0x1x1x1x1x1x0
128-28-28-3x3-128-28-28-128-1x1-1x1-1x1-0-NCHW-FP32-B=miopenConvolutionBwdDataAlgoWinograd:ConvBinWinograd3x3U,1.32752,0,miopenConvolutionBwdDataAlgoWinograd,128x28x28x3x3x128x28x28x128xNCHWxFP32x1x1x1x1x1x1x1x0
128-28-28-3x3-128-28-28-128-1x1-1x1-1x1-0-NCHW-FP32-W=miopenConvolutionBwdWeightsAlgoWinograd:ConvWinograd3x3MultipassWrW<3-4>,2.37312,233570304,miopenConvolutionBwdWeightsAlgoWinograd,128x28x28x3x3x128x28x28x128xNCHWxFP32x1x1x1x1x1x1x1x0;miopenConvolutionBwdWeightsAlgoGEMM:gemm,10.5882,3612672,rocBlas,<unused>;miopenConvolutionBwdWeightsAlgoDirect:ConvAsmBwdWrW3x3,3.46448,0,miopenConvolutionBwdWeightsAlgoDirect,128x28x28x3x3x128x28x28x128xNCHWxFP32x1x1x1x1x1x1x1x0
128-28-28-1x1-512-28-28-128-0x0-1x1-1x1-0-NCHW-FP32-B=miopenConvolutionBwdDataAlgoGEMM:gemm,1.3808,0,rocBlas,<unused>;miopenConvolutionBwdDataAlgoImplicitGEMM:ConvHipImplicitGemmV4_1x1,1.8976,0,miopenConvolutionBwdDataAlgoImplicitGEMM,128x28x28x1x1x512x28x28x128xNCHWxFP32x0x0x1x1x1x1x1x0;miopenConvolutionBwdDataAlgoWinograd:ConvBinWinogradRxSf3x2,3.47583,0,miopenConvolutionBwdDataAlgoWinograd,128x28x28x1x1x512x28x28x128xNCHWxFP32x0x0x1x1x1x1x1x0;miopenConvolutionBwdDataAlgoDirect:ConvAsm1x1U,1.29584,0,miopenConvolutionBwdDataAlgoDirect,128x28x28x1x1x512x28x28x128xNCHWxFP32x0x0x1x1x1x1x1x0
128-28-28-1x1-512-28-28-128-0x0-1x1-1x1-0-NCHW-FP32-W=miopenConvolutionBwdWeightsAlgoWinograd:ConvBinWinogradRxS,13.3886,0,miopenConvolutionBwdWeightsAlgoWinograd,128x28x28x1x1x512x28x28x128xNCHWxFP32x0x0x1x1x1x1x1x0;miopenConvolutionBwdWeightsAlgoGEMM:gemm,5.53103,0,rocBlas,<unused>;miopenConvolutionBwdWeightsAlgoDirect:ConvAsmBwdWrW1x1,2.32608,0,miopenConvolutionBwdWeightsAlgoDirect,128x28x28x1x1x512x28x28x128xNCHWxFP32x0x0x1x1x1x1x1x0
512-28-28-1x1-256-56-56-128-0x0-2x2-1x1-0-NCHW-FP32-B=miopenConvolutionBwdDataAlgoDirect:ConvAsm1x1UV2,3.09247,0,miopenConvolutionBwdDataAlgoDirect,512x28x28x1x1x256x56x56x128xNCHWxFP32x0x0x2x2x1x1x1x0;miopenConvolutionBwdDataAlgoGEMM:gemm,4.57039,308281344,rocBlas,<unused>;miopenConvolutionBwdDataAlgoImplicitGEMM:ConvHipImplicitGemmV4_1x1,3.88111,0,miopenConvolutionBwdDataAlgoImplicitGEMM,512x28x28x1x1x256x56x56x128xNCHWxFP32x0x0x2x2x1x1x1x0
512-28-28-1x1-256-56-56-128-0x0-2x2-1x1-0-NCHW-FP32-W=miopenConvolutionBwdWeightsAlgoDirect:ConvAsmBwdWrW1x1,4.68271,102760448,miopenConvolutionBwdWeightsAlgoDirect,512x28x28x1x1x256x56x56x128xNCHWxFP32x0x0x2x2x1x1x1x0;miopenConvolutionBwdWeightsAlgoGEMM:gemm,12.2061,802816,rocBlas,<unused>
128-28-28-3x3-128-56-56-128-1x1-2x2-1x1-0-NCHW-FP32-B=miopenConvolutionBwdDataAlgoGEMM:gemm,13.0867,3612672,rocBlas,<unused>;miopenConvolutionBwdDataAlgoWinograd:ConvBinWinogradRxS,5.83407,0,miopenConvolutionBwdDataAlgoWinograd,128x28x28x3x3x128x56x56x128xNCHWxFP32x1x1x2x2x1x1x1x0;miopenConvolutionBwdDataAlgoDirect:ConvOclDirectFwd,11.9008,0,miopenConvolutionBwdDataAlgoDirect,128x28x28x3x3x128x56x56x128xNCHWxFP32x1x1x2x2x1x1x1x0
128-28-28-3x3-128-56-56-128-1x1-2x2-1x1-0-NCHW-FP32-W=miopenConvolutionBwdWeightsAlgoWinograd:ConvWinograd3x3MultipassWrW<3-4>,9.16302,525533184,miopenConvolutionBwdWeightsAlgoWinograd,128x28x28x3x3x128x56x56x128xNCHWxFP32x1x1x2x2x1x1x1x0;miopenConvolutionBwdWeightsAlgoGEMM:gemm,10.4038,3612672,rocBlas,<unused>;miopenConvolutionBwdWeightsAlgoDirect:ConvAsmBwdWrW3x3,8.24606,0,miopenConvolutionBwdWeightsAlgoDirect,128x28x28x3x3x128x56x56x128xNCHWxFP32x1x1x2x2x1x1x1x0
128-56-56-1x1-256-56-56-128-0x0-1x1-1x1-0-NCHW-FP32-B=miopenConvolutionBwdDataAlgoGEMM:gemm,2.68319,0,rocBlas,<unused>;miopenConvolutionBwdDataAlgoImplicitGEMM:ConvHipImplicitGemmV4_1x1,3.94175,0,miopenConvolutionBwdDataAlgoImplicitGEMM,128x56x56x1x1x256x56x56x128xNCHWxFP32x0x0x1x1x1x1x1x0;miopenConvolutionBwdDataAlgoWinograd:ConvBinWinogradRxSf3x2,5.52207,0,miopenConvolutionBwdDataAlgoWinograd,128x56x56x1x1x256x56x56x128xNCHWxFP32x0x0x1x1x1x1x1x0;miopenConvolutionBwdDataAlgoDirect:ConvAsm1x1U,2.60287,0,miopenConvolutionBwdDataAlgoDirect,128x56x56x1x1x256x56x56x128xNCHWxFP32x0x0x1x1x1x1x1x0
128-56-56-1x1-256-56-56-128-0x0-1x1-1x1-0-NCHW-FP32-W=miopenConvolutionBwdWeightsAlgoWinograd:ConvBinWinogradRxS,28.9308,0,miopenConvolutionBwdWeightsAlgoWinograd,128x56x56x1x1x256x56x56x128xNCHWxFP32x0x0x1x1x1x1x1x0;miopenConvolutionBwdWeightsAlgoGEMM:gemm,10.1918,0,rocBlas,<unused>;miopenConvolutionBwdWeightsAlgoDirect:ConvAsmBwdWrW1x1,6.53647,0,miopenConvolutionBwdWeightsAlgoDirect,128x56x56x1x1x256x56x56x128xNCHWxFP32x0x0x1x1x1x1x1x0
256-56-56-1x1-64-56-56-128-0x0-1x1-1x1-0-NCHW-FP32-B=miopenConvolutionBwdDataAlgoGEMM:gemm,1.30768,0,rocBlas,<unused>;miopenConvolutionBwdDataAlgoWinograd:ConvBinWinogradRxSf3x2,2.63359,0,miopenConvolutionBwdDataAlgoWinograd,256x56x56x1x1x64x56x56x128xNCHWxFP32x0x0x1x1x1x1x1x0;miopenConvolutionBwdDataAlgoDirect:ConvAsm1x1U,1.49728,0,miopenConvolutionBwdDataAlgoDirect,256x56x56x1x1x64x56x56x128xNCHWxFP32x0x0x1x1x1x1x1x0
256-56-56-1x1-64-56-56-128-0x0-1x1-1x1-0-NCHW-FP32-W=miopenConvolutionBwdWeightsAlgoWinograd:ConvBinWinogradRxS,25.7062,0,miopenConvolutionBwdWeightsAlgoWinograd,256x56x56x1x1x64x56x56x128xNCHWxFP32x0x0x1x1x1x1x1x0;miopenConvolutionBwdWeightsAlgoGEMM:gemm,7.42958,0,rocBlas,<unused>;miopenConvolutionBwdWeightsAlgoDirect:ConvAsmBwdWrW1x1,2.76863,0,miopenConvolutionBwdWeightsAlgoDirect,256x56x56x1x1x64x56x56x128xNCHWxFP32x0x0x1x1x1x1x1x0
64-56-56-3x3-64-56-56-128-1x1-1x1-1x1-0-NCHW-FP32-B=miopenConvolutionBwdDataAlgoWinograd:ConvBinWinograd3x3U,1.41728,0,miopenConvolutionBwdDataAlgoWinograd,64x56x56x3x3x64x56x56x128xNCHWxFP32x1x1x1x1x1x1x1x0
64-56-56-3x3-64-56-56-128-1x1-1x1-1x1-0-NCHW-FP32-W=miopenConvolutionBwdWeightsAlgoWinograd:ConvWinograd3x3MultipassWrW<3-6>,3.59439,420478976,miopenConvolutionBwdWeightsAlgoWinograd,64x56x56x3x3x64x56x56x128xNCHWxFP32x1x1x1x1x1x1x1x0;miopenConvolutionBwdWeightsAlgoGEMM:gemm,15.2166,7225344,rocBlas,<unused>;miopenConvolutionBwdWeightsAlgoDirect:ConvAsmBwdWrW3x3,4.07295,0,miopenConvolutionBwdWeightsAlgoDirect,64x56x56x3x3x64x56x56x128xNCHWxFP32x1x1x1x1x1x1x1x0
64-56-56-1x1-256-56-56-128-0x0-1x1-1x1-0-NCHW-FP32-B=miopenConvolutionBwdDataAlgoGEMM:gemm,1.3768,0,rocBlas,<unused>;miopenConvolutionBwdDataAlgoImplicitGEMM:ConvHipImplicitGemmV4_1x1,1.76032,0,miopenConvolutionBwdDataAlgoImplicitGEMM,64x56x56x1x1x256x56x56x128xNCHWxFP32x0x0x1x1x1x1x1x0;miopenConvolutionBwdDataAlgoWinograd:ConvBinWinogradRxSf3x2,3.46,0,miopenConvolutionBwdDataAlgoWinograd,64x56x56x1x1x256x56x56x128xNCHWxFP32x0x0x1x1x1x1x1x0;miopenConvolutionBwdDataAlgoDirect:ConvAsm1x1U,1.3648,0,miopenConvolutionBwdDataAlgoDirect,64x56x56x1x1x256x56x56x128xNCHWxFP32x0x0x1x1x1x1x1x0
64-56-56-1x1-256-56-56-128-0x0-1x1-1x1-0-NCHW-FP32-W=miopenConvolutionBwdWeightsAlgoWinograd:ConvBinWinogradRxS,26.332,0,miopenConvolutionBwdWeightsAlgoWinograd,64x56x56x1x1x256x56x56x128xNCHWxFP32x0x0x1x1x1x1x1x0;miopenConvolutionBwdWeightsAlgoGEMM:gemm,7.42975,0,rocBlas,<unused>;miopenConvolutionBwdWeightsAlgoDirect:ConvAsmBwdWrW1x1,2.69824,0,miopenConvolutionBwdWeightsAlgoDirect,64x56x56x1x1x256x56x56x128xNCHWxFP32x0x0x1x1x1x1x1x0
64-56-56-1x1-64-56-56-128-0x0-1x1-1x1-0-NCHW-FP32-B=miopenConvolutionBwdDataAlgoGEMM:gemm,0.42288,0,rocBlas,<unused>;miopenConvolutionBwdDataAlgoWinograd:ConvBinWinogradRxSf3x2,0.801599,0,miopenConvolutionBwdDataAlgoWinograd,64x56x56x1x1x64x56x56x128xNCHWxFP32x0x0x1x1x1x1x1x0;miopenConvolutionBwdDataAlgoDirect:ConvAsm1x1U,0.6448,0,miopenConvolutionBwdDataAlgoDirect,64x56x56x1x1x64x56x56x128xNCHWxFP32x0x0x1x1x1x1x1x0
64-56-56-1x1-64-56-56-128-0x0-1x1-1x1-0-NCHW-FP32-W=miopenConvolutionBwdWeightsAlgoWinograd:ConvBinWinogradRxS,25.7512,0,miopenConvolutionBwdWeightsAlgoWinograd,64x56x56x1x1x64x56x56x128xNCHWxFP32x0x0x1x1x1x1x1x0;miopenConvolutionBwdWeightsAlgoGEMM:gemm,5.22239,0,rocBlas,<unused>;miopenConvolutionBwdWeightsAlgoDirect:ConvAsmBwdWrW1x1,1.01312,0,miopenConvolutionBwdWeightsAlgoDirect,64x56x56x1x1x64x56x56x128xNCHWxFP32x0x0x1x1x1x1x1x0
64-112-112-7x7-3-224-224-128-3x3-2x2-1x1-0-NCHW-FP32-W=miopenConvolutionBwdWeightsAlgoDirect:ConvOclBwdWrW2<4>,7.80031,1204224,miopenConvolutionBwdWeightsAlgoDirect,64x112x112x7x7x3x224x224x128xNCHWxFP32x3x3x2x2x1x1x1x0;miopenConvolutionBwdWeightsAlgoGEMM:gemm,13.4758,7375872,rocBlas,<unused>
3-224-224-7x7-64-112-112-128-3x3-2x2-1x1-0-NCHW-FP16-F=miopenConvolutionFwdAlgoDirect:ConvOclDirectFwdGen,6.46001,0,miopenConvolutionFwdAlgoDirect,3x224x224x7x7x64x112x112x128xNCHWxFP16x3x3x2x2x1x1x1x1;miopenConvolutionFwdAlgoGEMM:gemm,16.1178,3687936,rocBlas,<unused>
64-56-56-1x1-64-56-56-128-0x0-1x1-1x1-0-NCHW-FP16-F=miopenConvolutionFwdAlgoDirect:ConvAsm1x1U,0.27664,0,miopenConvolutionFwdAlgoDirect,64x56x56x1x1x64x56x56x128xNCHWxFP16x0x0x1x1x1x1x1x1;miopenConvolutionFwdAlgoGEMM:gemm,0.21136,0,rocBlas,<unused>;miopenConvolutionFwdAlgoWinograd:ConvBinWinogradRxS,1.23344,0,miopenConvolutionFwdAlgoWinograd,64x56x56x1x1x64x56x56x128xNCHWxFP16x0x0x1x1x1x1x1x1
64-56-56-3x3-64-56-56-128-1x1-1x1-1x1-0-NCHW-FP16-F=miopenConvolutionFwdAlgoDirect:ConvOclDirectFwd,5.84081,0,miopenConvolutionFwdAlgoDirect,64x56x56x3x3x64x56x56x128xNCHWxFP16x1x1x1x1x1x1x1x1;miopenConvolutionFwdAlgoGEMM:gemm,27.8733,3612672,rocBlas,<unused>;miopenConvolutionFwdAlgoWinograd:ConvBinWinogradRxS,1.04912,0,miopenConvolutionFwdAlgoWinograd,64x56x56x3x3x64x56x56x128xNCHWxFP16x1x1x1x1x1x1x1x1
64-56-56-1x1-256-56-56-128-0x0-1x1-1x1-0-NCHW-FP16-F=miopenConvolutionFwdAlgoDirect:ConvAsm1x1U,1.29664,0,miopenConvolutionFwdAlgoDirect,64x56x56x1x1x256x56x56x128xNCHWxFP16x0x0x1x1x1x1x1x1;miopenConvolutionFwdAlgoGEMM:gemm,0.863361,0,rocBlas,<unused>;miopenConvolutionFwdAlgoWinograd:ConvBinWinogradRxS,4.02545,0,miopenConvolutionFwdAlgoWinograd,64x56x56x1x1x256x56x56x128xNCHWxFP16x0x0x1x1x1x1x1x1
256-56-56-1x1-64-56-56-128-0x0-1x1-1x1-0-NCHW-FP16-F=miopenConvolutionFwdAlgoDirect:ConvAsm1x1U,0.959201,0,miopenConvolutionFwdAlgoDirect,256x56x56x1x1x64x56x56x128xNCHWxFP16x0x0x1x1x1x1x1x1;miopenConvolutionFwdAlgoGEMM:gemm,0.672001,0,rocBlas,<unused>;miopenConvolutionFwdAlgoWinograd:ConvBinWinogradRxS,3.11792,0,miopenConvolutionFwdAlgoWinograd,256x56x56x1x1x64x56x56x128xNCHWxFP16x0x0x1x1x1x1x1x1
256-56-56-1x1-128-56-56-128-0x0-1x1-1x1-0-NCHW-FP16-F=miopenConvolutionFwdAlgoDirect:ConvAsm1x1U,1.87536,0,miopenConvolutionFwdAlgoDirect,256x56x56x1x1x128x56x56x128xNCHWxFP16x0x0x1x1x1x1x1x1;miopenConvolutionFwdAlgoGEMM:gemm,1.27728,0,rocBlas,<unused>;miopenConvolutionFwdAlgoWinograd:ConvBinWinogradRxS,6.30785,0,miopenConvolutionFwdAlgoWinograd,256x56x56x1x1x128x56x56x128xNCHWxFP16x0x0x1x1x1x1x1x1
128-56-56-3x3-128-28-28-128-1x1-2x2-1x1-0-NCHW-FP16-F=miopenConvolutionFwdAlgoDirect:ConvOclDirectFwdGen,10.8103,0,miopenConvolutionFwdAlgoDirect,128x56x56x3x3x128x28x28x128xNCHWxFP16x1x1x2x2x1x1x1x1;miopenConvolutionFwdAlgoGEMM:gemm,12.9638,1806336,rocBlas,<unused>;miopenConvolutionFwdAlgoWinograd:ConvBinWinogradRxS,3.94577,0,miopenConvolutionFwdAlgoWinograd,128x56x56x3x3x128x28x28x128xNCHWxFP16x1x1x2x2x1x1x1x1
128-28-28-1x1-512-28-28-128-0x0-1x1-1x1-0-NCHW-FP16-F=miopenConvolutionFwdAlgoDirect:ConvAsm1x1U,1.12496,0,miopenConvolutionFwdAlgoDirect,128x28x28x1x1x512x28x28x128xNCHWxFP16x0x0x1x1x1x1x1x1;miopenConvolutionFwdAlgoGEMM:gemm,0.825441,0,rocBlas,<unused>;miopenConvolutionFwdAlgoWinograd:ConvBinWinogradRxS,3.7824,0,miopenConvolutionFwdAlgoWinograd,128x28x28x1x1x512x28x28x128xNCHWxFP16x0x0x1x1x1x1x1x1
256-56-56-1x1-512-28-28-128-0x0-2x2-1x1-0-NCHW-FP16-F=miopenConvolutionFwdAlgoDirect:ConvAsm1x1U,2.58304,51380224,miopenConvolutionFwdAlgoDirect,256x56x56x1x1x512x28x28x128xNCHWxFP16x0x0x2x2x1x1x1x1;miopenConvolutionFwdAlgoGEMM:gemm,2.24608,154140672,rocBlas,<unused>;miopenConvolutionFwdAlgoWinograd:ConvBinWinogradRxS,13.5552,0,miopenConvolutionFwdAlgoWinograd,256x56x56x1x1x512x28x28x128xNCHWxFP16x0x0x2x2x1x1x1x1
512-28-28-1x1-128-28-28-128-0x0-1x1-1x1-0-NCHW-FP16-F=miopenConvolutionFwdAlgoDirect:ConvAsm1x1U,1.4136,0,miopenConvolutionFwdAlgoDirect,512x28x28x1x1x128x28x28x128xNCHWxFP16x0x0x1x1x1x1x1x1;miopenConvolutionFwdAlgoGEMM:gemm,0.829921,0,rocBlas,<unused>;miopenConvolutionFwdAlgoWinograd:ConvBinWinogradRxS,3.2152,0,miopenConvolutionFwdAlgoWinograd,512x28x28x1x1x128x28x28x128xNCHWxFP16x0x0x1x1x1x1x1x1
128-28-28-3x3-128-28-28-128-1x1-1x1-1x1-0-NCHW-FP16-F=miopenConvolutionFwdAlgoDirect:ConvOclDirectFwd,4.68145,0,miopenConvolutionFwdAlgoDirect,128x28x28x3x3x128x28x28x128xNCHWxFP16x1x1x1x1x1x1x1x1;miopenConvolutionFwdAlgoGEMM:gemm,12.3085,1806336,rocBlas,<unused>;miopenConvolutionFwdAlgoWinograd:ConvBinWinogradRxS,0.965761,0,miopenConvolutionFwdAlgoWinograd,128x28x28x3x3x128x28x28x128xNCHWxFP16x1x1x1x1x1x1x1x1
512-28-28-1x1-256-28-28-128-0x0-1x1-1x1-0-NCHW-FP16-F=miopenConvolutionFwdAlgoDirect:ConvAsm1x1U,2.2976,0,miopenConvolutionFwdAlgoDirect,512x28x28x1x1x256x28x28x128xNCHWxFP16x0x0x1x1x1x1x1x1;miopenConvolutionFwdAlgoGEMM:gemm,1.46784,0,rocBlas,<unused>;miopenConvolutionFwdAlgoWinograd:ConvBinWinogradRxS,6.31377,0,miopenConvolutionFwdAlgoWinograd,512x28x28x1x1x256x28x28x128xNCHWxFP16x0x0x1x1x1x1x1x1
256-28-28-3x3-256-14-14-128-1x1-2x2-1x1-0-NCHW-FP16-F=miopenConvolutionFwdAlgoDirect:ConvOclDirectFwdGen,12.7635,0,miopenConvolutionFwdAlgoDirect,256x28x28x3x3x256x14x14x128xNCHWxFP16x1x1x2x2x1x1x1x1;miopenConvolutionFwdAlgoGEMM:gemm,20.2752,903168,rocBlas,<unused>;miopenConvolutionFwdAlgoWinograd:ConvBinWinogradRxS,4.69809,0,miopenConvolutionFwdAlgoWinograd,256x28x28x3x3x256x14x14x128xNCHWxFP16x1x1x2x2x1x1x1x1
256-14-14-1x1-1024-14-14-128-0x0-1x1-1x1-0-NCHW-FP16-F=miopenConvolutionFwdAlgoDirect:ConvAsm1x1U,1.31408,0,miopenConvolutionFwdAlgoDirect,256x14x14x1x1x1024x14x14x128xNCHWxFP16x0x0x1x1x1x1x1x1;miopenConvolutionFwdAlgoGEMM:gemm,1.2456,64225280,rocBlas,<unused>;miopenConvolutionFwdAlgoWinograd:ConvBinWinogradRxS,3.97345,0,miopenConvolutionFwdAlgoWinograd,256x14x14x1x1x1024x14x14x128xNCHWxFP16x0x0x1x1x1x1x1x1
512-28-28-1x1-1024-14-14-128-0x0-2x2-1x1-0-NCHW-FP16-F=miopenConvolutionFwdAlgoDirect:ConvAsm1x1U,2.72464,25690112,miopenConvolutionFwdAlgoDirect,512x28x28x1x1x1024x14x14x128xNCHWxFP16x0x0x2x2x1x1x1x1;miopenConvolutionFwdAlgoGEMM:gemm,1.872,77070336,rocBlas,<unused>;miopenConvolutionFwdAlgoWinograd:ConvBinWinogradRxS,13.7544,0,miopenConvolutionFwdAlgoWinograd,512x28x28x1x1x1024x14x14x128xNCHWxFP16x0x0x2x2x1x1x1x1
1024-14-14-1x1-256-14-14-128-0x0-1x1-1x1-0-NCHW-FP16-F=miopenConvolutionFwdAlgoDirect:ConvAsm1x1U,1.19408,0,miopenConvolutionFwdAlgoDirect,1024x14x14x1x1x256x14x14x128xNCHWxFP16x0x0x1x1x1x1x1x1;miopenConvolutionFwdAlgoGEMM:gemm,1.24,64225280,rocBlas,<unused>;miopenConvolutionFwdAlgoWinograd:ConvBinWinogradRxS,3.93601,0,miopenConvolutionFwdAlgoWinograd,1024x14x14x1x1x256x14x14x128xNCHWxFP16x0x0x1x1x1x1x1x1
256-14-14-3x3-256-14-14-128-1x1-1x1-1x1-0-NCHW-FP16-F=miopenConvolutionFwdAlgoDirect:ConvOclDirectFwd,5.81345,0,miopenConvolutionFwdAlgoDirect,256x14x14x3x3x256x14x14x128xNCHWxFP16x1x1x1x1x1x1x1x1;miopenConvolutionFwdAlgoGEMM:gemm,19.6608,903168,rocBlas,<unused>;miopenConvolutionFwdAlgoWinograd:ConvBinWinogradRxS,0.940001,0,miopenConvolutionFwdAlgoWinograd,256x14x14x3x3x256x14x14x128xNCHWxFP16x1x1x1x1x1x1x1x1
1024-14-14-1x1-512-14-14-128-0x0-1x1-1x1-0-NCHW-FP16-F=miopenConvolutionFwdAlgoDirect:ConvAsm1x1U,2.51056,0,miopenConvolutionFwdAlgoDirect,1024x14x14x1x1x512x14x14x128xNCHWxFP16x0x0x1x1x1x1x1x1;miopenConvolutionFwdAlgoGEMM:gemm,1.81936,77070336,rocBlas,<unused>;miopenConvolutionFwdAlgoWinograd:ConvBinWinogradRxS,7.19553,0,miopenConvolutionFwdAlgoWinograd,1024x14x14x1x1x512x14x14x128xNCHWxFP16x0x0x1x1x1x1x1x1
512-14-14-3x3-512-7-7-128-1x1-2x2-1x1-0-NCHW-FP16-F=miopenConvolutionFwdAlgoDirect:ConvOclDirectFwdGen,23.5372,0,miopenConvolutionFwdAlgoDirect,512x14x14x3x3x512x7x7x128xNCHWxFP16x1x1x2x2x1x1x1x1;miopenConvolutionFwdAlgoGEMM:gemm,100.168,451584,rocBlas,<unused>;miopenConvolutionFwdAlgoWinograd:ConvBinWinogradRxS,6.84081,0,miopenConvolutionFwdAlgoWinograd,512x14x14x3x3x512x7x7x128xNCHWxFP16x1x1x2x2x1x1x1x1
512-7-7-1x1-2048-7-7-128-0x0-1x1-1x1-0-NCHW-FP16-F=miopenConvolutionFwdAlgoDirect:ConvAsm1x1U,1.75536,0,miopenConvolutionFwdAlgoDirect,512x7x7x1x1x2048x7x7x128xNCHWxFP16x0x0x1x1x1x1x1x1;miopenConvolutionFwdAlgoGEMM:gemm,1.44384,32112640,rocBlas,<unused>;miopenConvolutionFwdAlgoWinograd:ConvBinWinogradRxS,5.83649,0,miopenConvolutionFwdAlgoWinograd,512x7x7x1x1x2048x7x7x128xNCHWxFP16x0x0x1x1x1x1x1x1
1024-14-14-1x1-2048-7-7-128-0x0-2x2-1x1-0-NCHW-FP16-F=miopenConvolutionFwdAlgoDirect:ConvAsm1x1U,3.87344,12845056,miopenConvolutionFwdAlgoDirect,1024x14x14x1x1x2048x7x7x128xNCHWxFP16x0x0x2x2x1x1x1x1;miopenConvolutionFwdAlgoGEMM:gemm,2.84288,38535168,rocBlas,<unused>;miopenConvolutionFwdAlgoWinograd:ConvBinWinogradRxS,18.4797,0,miopenConvolutionFwdAlgoWinograd,1024x14x14x1x1x2048x7x7x128xNCHWxFP16x0x0x2x2x1x1x1x1
2048-7-7-1x1-512-7-7-128-0x0-1x1-1x1-0-NCHW-FP16-F=miopenConvolutionFwdAlgoDirect:ConvAsm1x1U,2.04336,0,miopenConvolutionFwdAlgoDirect,2048x7x7x1x1x512x7x7x128xNCHWxFP16x0x0x1x1x1x1x1x1;miopenConvolutionFwdAlgoGEMM:gemm,1.37616,32112640,rocBlas,<unused>;miopenConvolutionFwdAlgoWinograd:ConvBinWinogradRxS,6.52625,0,miopenConvolutionFwdAlgoWinograd,2048x7x7x1x1x512x7x7x128xNCHWxFP16x0x0x1x1x1x1x1x1
512-7-7-3x3-512-7-7-128-1x1-1x1-1x1-0-NCHW-FP16-F=miopenConvolutionFwdAlgoDirect:ConvOclDirectFwd,9.67297,0,miopenConvolutionFwdAlgoDirect,512x7x7x3x3x512x7x7x128xNCHWxFP16x1x1x1x1x1x1x1x1;miopenConvolutionFwdAlgoGEMM:gemm,105.575,451584,rocBlas,<unused>;miopenConvolutionFwdAlgoWinograd:ConvBinWinogradRxS,1.5384,0,miopenConvolutionFwdAlgoWinograd,512x7x7x3x3x512x7x7x128xNCHWxFP16x1x1x1x1x1x1x1x1
2048-7-7-1x1-512-7-7-128-0x0-1x1-1x1-0-NCHW-FP16-B=miopenConvolutionBwdDataAlgoGEMM:gemm,3.33632,0,rocBlas,<unused>;miopenConvolutionBwdDataAlgoWinograd:ConvBinWinogradRxS,5.9616,0,miopenConvolutionBwdDataAlgoWinograd,2048x7x7x1x1x512x7x7x128xNCHWxFP16x0x0x1x1x1x1x1x0;miopenConvolutionBwdDataAlgoDirect:ConvAsm1x1U,1.54992,0,miopenConvolutionBwdDataAlgoDirect,2048x7x7x1x1x512x7x7x128xNCHWxFP16x0x0x1x1x1x1x1x0
2048-7-7-1x1-512-7-7-128-0x0-1x1-1x1-0-NCHW-FP16-W=miopenConvolutionBwdWeightsAlgoDirect:ConvAsmBwdWrW1x1,1.52096,0,miopenConvolutionBwdWeightsAlgoDirect,2048x7x7x1x1x512x7x7x128xNCHWxFP16x0x0x1x1x1x1x1x0;miopenConvolutionBwdWeightsAlgoGEMM:gemm,6.13184,0,rocBlas,<unused>
512-7-7-3x3-512-7-7-128-1x1-1x1-1x1-0-NCHW-FP16-B=miopenConvolutionBwdDataAlgoGEMM:gemm,22.2413,451584,rocBlas,<unused>;miopenConvolutionBwdDataAlgoWinograd:ConvBinWinogradRxS,1.21248,0,miopenConvolutionBwdDataAlgoWinograd,512x7x7x3x3x512x7x7x128xNCHWxFP16x1x1x1x1x1x1x1x0;miopenConvolutionBwdDataAlgoDirect:ConvOclDirectFwd,11.0453,0,miopenConvolutionBwdDataAlgoDirect,512x7x7x3x3x512x7x7x128xNCHWxFP16x1x1x1x1x1x1x1x0
512-7-7-3x3-512-7-7-128-1x1-1x1-1x1-0-NCHW-FP16-W=miopenConvolutionBwdWeightsAlgoWinograd:ConvWinograd3x3MultipassWrW<3-4>,1.63952,56623104,miopenConvolutionBwdWeightsAlgoWinograd,512x7x7x3x3x512x7x7x128xNCHWxFP16x1x1x1x1x1x1x1x0;miopenConvolutionBwdWeightsAlgoGEMM:gemm,19.968,451584,rocBlas,<unused>;miopenConvolutionBwdWeightsAlgoDirect:ConvAsmBwdWrW3x3,4.47872,0,miopenConvolutionBwdWeightsAlgoDirect,512x7x7x3x3x512x7x7x128xNCHWxFP16x1x1x1x1x1x1x1x0
512-7-7-1x1-2048-7-7-128-0x0-1x1-1x1-0-NCHW-FP16-B=miopenConvolutionBwdDataAlgoGEMM:gemm,3.02448,0,rocBlas,<unused>;miopenConvolutionBwdDataAlgoWinograd:ConvBinWinogradRxS,5.81648,0,miopenConvolutionBwdDataAlgoWinograd,512x7x7x1x1x2048x7x7x128xNCHWxFP16x0x0x1x1x1x1x1x0;miopenConvolutionBwdDataAlgoDirect:ConvAsm1x1U,1.52448,0,miopenConvolutionBwdDataAlgoDirect,512x7x7x1x1x2048x7x7x128xNCHWxFP16x0x0x1x1x1x1x1x0
512-7-7-1x1-2048-7-7-128-0x0-1x1-1x1-0-NCHW-FP16-W=miopenConvolutionBwdWeightsAlgoDirect:ConvAsmBwdWrW1x1,1.97248,0,miopenConvolutionBwdWeightsAlgoDirect,512x7x7x1x1x2048x7x7x128xNCHWxFP16x0x0x1x1x1x1x1x0;miopenConvolutionBwdWeightsAlgoGEMM:gemm,6.8208,0,rocBlas,<unused>
2048-7-7-1x1-1024-14-14-128-0x0-2x2-1x1-0-NCHW-FP16-B=miopenConvolutionBwdDataAlgoGEMM:gemm,4.47104,38535168,rocBlas,<unused>;miopenConvolutionBwdDataAlgoWinograd:ConvBinWinogradRxS,19.815,0,miopenConvolutionBwdDataAlgoWinograd,2048x7x7x1x1x1024x14x14x128xNCHWxFP16x0x0x2x2x1x1x1x0;miopenConvolutionBwdDataAlgoDirect:ConvAsm1x1U,3.20832,12845056,miopenConvolutionBwdDataAlgoDirect,2048x7x7x1x1x1024x14x14x128xNCHWxFP16x0x0x2x2x1x1x1x0
2048-7-7-1x1-1024-14-14-128-0x0-2x2-1x1-0-NCHW-FP16-W=miopenConvolutionBwdWeightsAlgoDirect:ConvAsmBwdWrW1x1,3.608,12845056,miopenConvolutionBwdWeightsAlgoDirect,2048x7x7x1x1x1024x14x14x128xNCHWxFP16x0x0x2x2x1x1x1x0;miopenConvolutionBwdWeightsAlgoGEMM:gemm,15.913,100352,rocBlas,<unused>
512-7-7-3x3-512-14-14-128-1x1-2x2-1x1-0-NCHW-FP16-B=miopenConvolutionBwdDataAlgoGEMM:gemm,19.9475,451584,rocBlas,<unused>;miopenConvolutionBwdDataAlgoWinograd:ConvBinWinogradRxS,6.03664,0,miopenConvolutionBwdDataAlgoWinograd,512x7x7x3x3x512x14x14x128xNCHWxFP16x1x1x2x2x1x1x1x0;miopenConvolutionBwdDataAlgoDirect:ConvOclDirectFwd,12.6398,0,miopenConvolutionBwdDataAlgoDirect,512x7x7x3x3x512x14x14x128xNCHWxFP16x1x1x2x2x1x1x1x0
512-7-7-3x3-512-14-14-128-1x1-2x2-1x1-0-NCHW-FP16-W=miopenConvolutionBwdWeightsAlgoWinograd:ConvWinograd3x3MultipassWrW<3-4>,4.17152,127401984,miopenConvolutionBwdWeightsAlgoWinograd,512x7x7x3x3x512x14x14x128xNCHWxFP16x1x1x2x2x1x1x1x0;miopenConvolutionBwdWeightsAlgoGEMM:gemm,17.2032,451584,rocBlas,<unused>;miopenConvolutionBwdWeightsAlgoDirect:ConvAsmBwdWrW3x3,5.4264,0,miopenConvolutionBwdWeightsAlgoDirect,512x7x7x3x3x512x14x14x128xNCHWxFP16x1x1x2x2x1x1x1x0
512-14-14-1x1-1024-14-14-128-0x0-1x1-1x1-0-NCHW-FP16-B=miopenConvolutionBwdDataAlgoGEMM:gemm,1.98352,0,rocBlas,<unused>;miopenConvolutionBwdDataAlgoWinograd:ConvBinWinogradRxS,7.57152,0,miopenConvolutionBwdDataAlgoWinograd,512x14x14x1x1x1024x14x14x128xNCHWxFP16x0x0x1x1x1x1x1x0;miopenConvolutionBwdDataAlgoDirect:ConvAsm1x1U,2.07664,0,miopenConvolutionBwdDataAlgoDirect,512x14x14x1x1x1024x14x14x128xNCHWxFP16x0x0x1x1x1x1x1x0
512-14-14-1x1-1024-14-14-128-0x0-1x1-1x1-0-NCHW-FP16-W=miopenConvolutionBwdWeightsAlgoDirect:ConvAsmBwdWrW1x1,2.6744,0,miopenConvolutionBwdWeightsAlgoDirect,512x14x14x1x1x1024x14x14x128xNCHWxFP16x0x0x1x1x1x1x1x0;miopenConvolutionBwdWeightsAlgoGEMM:gemm,5.93888,0,rocBlas,<unused>
1024-14-14-1x1-256-14-14-128-0x0-1x1-1x1-0-NCHW-FP16-B=miopenConvolutionBwdDataAlgoGEMM:gemm,1.0344,0,rocBlas,<unused>;miopenConvolutionBwdDataAlgoWinograd:ConvBinWinogradRxS,3.8984,0,miopenConvolutionBwdDataAlgoWinograd,1024x14x14x1x1x256x14x14x128xNCHWxFP16x0x0x1x1x1x1x1x0;miopenConvolutionBwdDataAlgoDirect:ConvAsm1x1U,1.14896,0,miopenConvolutionBwdDataAlgoDirect,1024x14x14x1x1x256x14x14x128xNCHWxFP16x0x0x1x1x1x1x1x0
1024-14-14-1x1-256-14-14-128-0x0-1x1-1x1-0-NCHW-FP16-W=miopenConvolutionBwdWeightsAlgoDirect:ConvAsmBwdWrW1x1,1.68592,0,miopenConvolutionBwdWeightsAlgoDirect,1024x14x14x1x1x256x14x14x128xNCHWxFP16x0x0x1x1x1x1x1x0;miopenConvolutionBwdWeightsAlgoGEMM:gemm,4.25152,0,rocBlas,<unused>
256-14-14-3x3-256-14-14-128-1x1-1x1-1x1-0-NCHW-FP16-B=miopenConvolutionBwdDataAlgoGEMM:gemm,11.305,903168,rocBlas,<unused>;miopenConvolutionBwdDataAlgoWinograd:ConvBinWinogradRxS,0.99952,0,miopenConvolutionBwdDataAlgoWinograd,256x14x14x3x3x256x14x14x128xNCHWxFP16x1x1x1x1x1x1x1x0;miopenConvolutionBwdDataAlgoDirect:ConvOclDirectFwd,5.87712,0,miopenConvolutionBwdDataAlgoDirect,256x14x14x3x3x256x14x14x128xNCHWxFP16x1x1x1x1x1x1x1x0
256-14-14-3x3-256-14-14-128-1x1-1x1-1x1-0-NCHW-FP16-W=miopenConvolutionBwdWeightsAlgoWinograd:ConvWinograd3x3MultipassWrW<3-5>,2.02496,64225280,miopenConvolutionBwdWeightsAlgoWinograd,256x14x14x3x3x256x14x14x128xNCHWxFP16x1x1x1x1x1x1x1x0;miopenConvolutionBwdWeightsAlgoGEMM:gemm,10.3629,903168,rocBlas,<unused>;miopenConvolutionBwdWeightsAlgoDirect:ConvAsmBwdWrW3x3,2.37984,0,miopenConvolutionBwdWeightsAlgoDirect,256x14x14x3x3x256x14x14x128xNCHWxFP16x1x1x1x1x1x1x1x0
256-14-14-1x1-1024-14-14-128-0x0-1x1-1x1-0-NCHW-FP16-B=miopenConvolutionBwdDataAlgoGEMM:gemm,1.0456,0,rocBlas,<unused>;miopenConvolutionBwdDataAlgoWinograd:ConvBinWinogradRxS,3.88288,0,miopenConvolutionBwdDataAlgoWinograd,256x14x14x1x1x1024x14x14x128xNCHWxFP16x0x0x1x1x1x1x1x0;miopenConvolutionBwdDataAlgoDirect:ConvAsm1x1U,1.04496,0,miopenConvolutionBwdDataAlgoDirect,256x14x14x1x1x1024x14x14x128xNCHWxFP16x0x0x1x1x1x1x1x0
256-14-14-1x1-1024-14-14-128-0x0-1x1-1x1-0-NCHW-FP16-W=miopenConvolutionBwdWeightsAlgoDirect:ConvAsmBwdWrW1x1,1.5496,0,miopenConvolutionBwdWeightsAlgoDirect,256x14x14x1x1x1024x14x14x128xNCHWxFP16x0x0x1x1x1x1x1x0;miopenConvolutionBwdWeightsAlgoGEMM:gemm,3.87712,0,rocBlas,<unused>
1024-14-14-1x1-512-28-28-128-0x0-2x2-1x1-0-NCHW-FP16-B=miopenConvolutionBwdDataAlgoGEMM:gemm,3.18256,77070336,rocBlas,<unused>;miopenConvolutionBwdDataAlgoWinograd:ConvBinWinogradRxS,15.2293,0,miopenConvolutionBwdDataAlgoWinograd,1024x14x14x1x1x512x28x28x128xNCHWxFP16x0x0x2x2x1x1x1x0;miopenConvolutionBwdDataAlgoDirect:ConvAsm1x1U,2.91136,25690112,miopenConvolutionBwdDataAlgoDirect,1024x14x14x1x1x512x28x28x128xNCHWxFP16x0x0x2x2x1x1x1x0
1024-14-14-1x1-512-28-28-128-0x0-2x2-1x1-0-NCHW-FP16-W=miopenConvolutionBwdWeightsAlgoDirect:ConvAsmBwdWrW1x1,3.11616,25690112,miopenConvolutionBwdWeightsAlgoDirect,1024x14x14x1x1x512x28x28x128xNCHWxFP16x0x0x2x2x1x1x1x0;miopenConvolutionBwdWeightsAlgoGEMM:gemm,10.5062,200704,rocBlas,<unused>
256-14-14-3x3-256-28-28-128-1x1-2x2-1x1-0-NCHW-FP16-B=miopenConvolutionBwdDataAlgoGEMM:gemm,10.6496,903168,rocBlas,<unused>;miopenConvolutionBwdDataAlgoWinograd:ConvBinWinogradRxS,4.41632,0,miopenConvolutionBwdDataAlgoWinograd,256x14x14x3x3x256x28x28x128xNCHWxFP16x1x1x2x2x1x1x1x0;miopenConvolutionBwdDataAlgoDirect:ConvOclDirectFwd,10.5885,0,miopenConvolutionBwdDataAlgoDirect,256x14x14x3x3x256x28x28x128xNCHWxFP16x1x1x2x2x1x1x1x0
256-14-14-3x3-256-28-28-128-1x1-2x2-1x1-0-NCHW-FP16-W=miopenConvolutionBwdWeightsAlgoWinograd:ConvWinograd3x3MultipassWrW<3-5>,6.50848,158597120,miopenConvolutionBwdWeightsAlgoWinograd,256x14x14x3x3x256x28x28x128xNCHWxFP16x1x1x2x2x1x1x1x0;miopenConvolutionBwdWeightsAlgoGEMM:gemm,8.97024,903168,rocBlas,<unused>;miopenConvolutionBwdWeightsAlgoDirect:ConvAsmBwdWrW3x3,3.03312,0,miopenConvolutionBwdWeightsAlgoDirect,256x14x14x3x3x256x28x28x128xNCHWxFP16x1x1x2x2x1x1x1x0
256-28-28-1x1-512-28-28-128-0x0-1x1-1x1-0-NCHW-FP16-B=miopenConvolutionBwdDataAlgoGEMM:gemm,1.52864,0,rocBlas,<unused>;miopenConvolutionBwdDataAlgoWinograd:ConvBinWinogradRxS,7.27152,0,miopenConvolutionBwdDataAlgoWinograd,256x28x28x1x1x512x28x28x128xNCHWxFP16x0x0x1x1x1x1x1x0;miopenConvolutionBwdDataAlgoDirect:ConvAsm1x1U,1.83488,0,miopenConvolutionBwdDataAlgoDirect,256x28x28x1x1x512x28x28x128xNCHWxFP16x0x0x1x1x1x1x1x0
256-28-28-1x1-512-28-28-128-0x0-1x1-1x1-0-NCHW-FP16-W=miopenConvolutionBwdWeightsAlgoDirect:ConvAsmBwdWrW1x1,3.0896,0,miopenConvolutionBwdWeightsAlgoDirect,256x28x28x1x1x512x28x28x128xNCHWxFP16x0x0x1x1x1x1x1x0;miopenConvolutionBwdWeightsAlgoGEMM:gemm,7.37488,0,rocBlas,<unused>
512-28-28-1x1-128-28-28-128-0x0-1x1-1x1-0-NCHW-FP16-B=miopenConvolutionBwdDataAlgoGEMM:gemm,0.81024,0,rocBlas,<unused>;miopenConvolutionBwdDataAlgoWinograd:ConvBinWinogradRxS,3.6216,0,miopenConvolutionBwdDataAlgoWinograd,512x28x28x1x1x128x28x28x128xNCHWxFP16x0x0x1x1x1x1x1x0;miopenConvolutionBwdDataAlgoDirect:ConvAsm1x1U,1.1984,0,miopenConvolutionBwdDataAlgoDirect,512x28x28x1x1x128x28x28x128xNCHWxFP16x0x0x1x1x1x1x1x0
512-28-28-1x1-128-28-28-128-0x0-1x1-1x1-0-NCHW-FP16-W=miopenConvolutionBwdWeightsAlgoDirect:ConvAsmBwdWrW1x1,1.83824,0,miopenConvolutionBwdWeightsAlgoDirect,512x28x28x1x1x128x28x28x128xNCHWxFP16x0x0x1x1x1x1x1x0;miopenConvolutionBwdWeightsAlgoGEMM:gemm,6.1112,0,rocBlas,<unused>
128-28-28-3x3-128-28-28-128-1x1-1x1-1x1-0-NCHW-FP16-B=miopenConvolutionBwdDataAlgoGEMM:gemm,20.2957,1806336,rocBlas,<unused>;miopenConvolutionBwdDataAlgoWinograd:ConvBinWinogradRxS,0.96688,0,miopenConvolutionBwdDataAlgoWinograd,128x28x28x3x3x128x28x28x128xNCHWxFP16x1x1x1x1x1x1x1x0;miopenConvolutionBwdDataAlgoDirect:ConvOclDirectFwd,5.11536,0,miopenConvolutionBwdDataAlgoDirect,128x28x28x3x3x128x28x28x128xNCHWxFP16x1x1x1x1x1x1x1x0
128-28-28-3x3-128-28-28-128-1x1-1x1-1x1-0-NCHW-FP16-W=miopenConvolutionBwdWeightsAlgoWinograd:ConvWinograd3x3MultipassWrW<3-6>,1.65136,106954752,miopenConvolutionBwdWeightsAlgoWinograd,128x28x28x3x3x128x28x28x128xNCHWxFP16x1x1x1x1x1x1x1x0;miopenConvolutionBwdWeightsAlgoGEMM:gemm,11.4688,1806336,rocBlas,<unused>;miopenConvolutionBwdWeightsAlgoDirect:ConvAsmBwdWrW3x3,2.3136,0,miopenConvolutionBwdWeightsAlgoDirect,128x28x28x3x3x128x28x28x128xNCHWxFP16x1x1x1x1x1x1x1x0
128-28-28-1x1-512-28-28-128-0x0-1x1-1x1-0-NCHW-FP16-B=miopenConvolutionBwdDataAlgoGEMM:gemm,0.84416,0,rocBlas,<unused>;miopenConvolutionBwdDataAlgoWinograd:ConvBinWinogradRxS,3.78368,0,miopenConvolutionBwdDataAlgoWinograd,128x28x28x1x1x512x28x28x128xNCHWxFP16x0x0x1x1x1x1x1x0;miopenConvolutionBwdDataAlgoDirect:ConvAsm1x1U,1.01136,0,miopenConvolutionBwdDataAlgoDirect,128x28x28x1x1x512x28x28x128xNCHWxFP16x0x0x1x1x1x1x1x0
128-28-28-1x1-512-28-28-128-0x0-1x1-1x1-0-NCHW-FP16-W=miopenConvolutionBwdWeightsAlgoDirect:ConvAsmBwdWrW1x1,1.71312,0,miopenConvolutionBwdWeightsAlgoDirect,128x28x28x1x1x512x28x28x128xNCHWxFP16x0x0x1x1x1x1x1x0;miopenConvolutionBwdWeightsAlgoGEMM:gemm,5.9792,0,rocBlas,<unused>
512-28-28-1x1-256-56-56-128-0x0-2x2-1x1-0-NCHW-FP16-B=miopenConvolutionBwdDataAlgoGEMM:gemm,3.88496,154140672,rocBlas,<unused>;miopenConvolutionBwdDataAlgoWinograd:ConvBinWinogradRxS,14.2032,0,miopenConvolutionBwdDataAlgoWinograd,512x28x28x1x1x256x56x56x128xNCHWxFP16x0x0x2x2x1x1x1x0;miopenConvolutionBwdDataAlgoDirect:ConvAsm1x1U,3.20992,51380224,miopenConvolutionBwdDataAlgoDirect,512x28x28x1x1x256x56x56x128xNCHWxFP16x0x0x2x2x1x1x1x0
512-28-28-1x1-256-56-56-128-0x0-2x2-1x1-0-NCHW-FP16-W=miopenConvolutionBwdWeightsAlgoDirect:ConvAsmBwdWrW1x1,3.65264,51380224,miopenConvolutionBwdWeightsAlgoDirect,512x28x28x1x1x256x56x56x128xNCHWxFP16x0x0x2x2x1x1x1x0;miopenConvolutionBwdWeightsAlgoGEMM:gemm,12.3699,401408,rocBlas,<unused>
128-28-28-3x3-128-56-56-128-1x1-2x2-1x1-0-NCHW-FP16-B=miopenConvolutionBwdDataAlgoGEMM:gemm,11.4278,1806336,rocBlas,<unused>;miopenConvolutionBwdDataAlgoWinograd:ConvBinWinogradRxS,3.83328,0,miopenConvolutionBwdDataAlgoWinograd,128x28x28x3x3x128x56x56x128xNCHWxFP16x1x1x2x2x1x1x1x0;miopenConvolutionBwdDataAlgoDirect:ConvOclDirectFwd,13.6018,0,miopenConvolutionBwdDataAlgoDirect,128x28x28x3x3x128x56x56x128xNCHWxFP16x1x1x2x2x1x1x1x0
128-28-28-3x3-128-56-56-128-1x1-2x2-1x1-0-NCHW-FP16-W=miopenConvolutionBwdWeightsAlgoWinograd:ConvWinograd3x3MultipassWrW<3-2>,8.26432,321945600,miopenConvolutionBwdWeightsAlgoWinograd,128x28x28x3x3x128x56x56x128xNCHWxFP16x1x1x2x2x1x1x1x0;miopenConvolutionBwdWeightsAlgoGEMM:gemm,10.793,1806336,rocBlas,<unused>;miopenConvolutionBwdWeightsAlgoDirect:ConvAsmBwdWrW3x3,4.924,0,miopenConvolutionBwdWeightsAlgoDirect,128x28x28x3x3x128x56x56x128xNCHWxFP16x1x1x2x2x1x1x1x0
128-56-56-1x1-256-56-56-128-0x0-1x1-1x1-0-NCHW-FP16-B=miopenConvolutionBwdDataAlgoGEMM:gemm,1.54976,0,rocBlas,<unused>;miopenConvolutionBwdDataAlgoWinograd:ConvBinWinogradRxS,7.37584,0,miopenConvolutionBwdDataAlgoWinograd,128x56x56x1x1x256x56x56x128xNCHWxFP16x0x0x1x1x1x1x1x0;miopenConvolutionBwdDataAlgoDirect:ConvAsm1x1U,2.1848,0,miopenConvolutionBwdDataAlgoDirect,128x56x56x1x1x256x56x56x128xNCHWxFP16x0x0x1x1x1x1x1x0
128-56-56-1x1-256-56-56-128-0x0-1x1-1x1-0-NCHW-FP16-W=miopenConvolutionBwdWeightsAlgoDirect:ConvAsmBwdWrW1x1,3.2496,0,miopenConvolutionBwdWeightsAlgoDirect,128x56x56x1x1x256x56x56x128xNCHWxFP16x0x0x1x1x1x1x1x0;miopenConvolutionBwdWeightsAlgoGEMM:gemm,18.6309,0,rocBlas,<unused>
256-56-56-1x1-64-56-56-128-0x0-1x1-1x1-0-NCHW-FP16-B=miopenConvolutionBwdDataAlgoGEMM:gemm,0.78768,0,rocBlas,<unused>;miopenConvolutionBwdDataAlgoWinograd:ConvBinWinogradRxS,3.11712,0,miopenConvolutionBwdDataAlgoWinograd,256x56x56x1x1x64x56x56x128xNCHWxFP16x0x0x1x1x1x1x1x0;miopenConvolutionBwdDataAlgoDirect:ConvAsm1x1U,1.14032,0,miopenConvolutionBwdDataAlgoDirect,256x56x56x1x1x64x56x56x128xNCHWxFP16x0x0x1x1x1x1x1x0
256-56-56-1x1-64-56-56-128-0x0-1x1-1x1-0-NCHW-FP16-W=miopenConvolutionBwdWeightsAlgoDirect:ConvAsmBwdWrW1x1,2.21392,0,miopenConvolutionBwdWeightsAlgoDirect,256x56x56x1x1x64x56x56x128xNCHWxFP16x0x0x1x1x1x1x1x0;miopenConvolutionBwdWeightsAlgoGEMM:gemm,18.711,0,rocBlas,<unused>
64-56-56-3x3-64-56-56-128-1x1-1x1-1x1-0-NCHW-FP16-B=miopenConvolutionBwdDataAlgoGEMM:gemm,11.3254,3612672,rocBlas,<unused>;miopenConvolutionBwdDataAlgoWinograd:ConvBinWinogradRxS,1.05008,0,miopenConvolutionBwdDataAlgoWinograd,64x56x56x3x3x64x56x56x128xNCHWxFP16x1x1x1x1x1x1x1x0;miopenConvolutionBwdDataAlgoDirect:ConvOclDirectFwd,5.7072,0,miopenConvolutionBwdDataAlgoDirect,64x56x56x3x3x64x56x56x128xNCHWxFP16x1x1x1x1x1x1x1x0
64-56-56-3x3-64-56-56-128-1x1-1x1-1x1-0-NCHW-FP16-W=miopenConvolutionBwdWeightsAlgoWinograd:ConvWinograd3x3MultipassWrW<3-5>,4.65904,231612416,miopenConvolutionBwdWeightsAlgoWinograd,64x56x56x3x3x64x56x56x128xNCHWxFP16x1x1x1x1x1x1x1x0;miopenConvolutionBwdWeightsAlgoGEMM:gemm,22.3437,3612672,rocBlas,<unused>;miopenConvolutionBwdWeightsAlgoDirect:ConvAsmBwdWrW3x3,3.03312,0,miopenConvolutionBwdWeightsAlgoDirect,64x56x56x3x3x64x56x56x128xNCHWxFP16x1x1x1x1x1x1x1x0
64-56-56-1x1-256-56-56-128-0x0-1x1-1x1-0-NCHW-FP16-B=miopenConvolutionBwdDataAlgoGEMM:gemm,0.87152,0,rocBlas,<unused>;miopenConvolutionBwdDataAlgoWinograd:ConvBinWinogradRxS,4.05472,0,miopenConvolutionBwdDataAlgoWinograd,64x56x56x1x1x256x56x56x128xNCHWxFP16x0x0x1x1x1x1x1x0;miopenConvolutionBwdDataAlgoDirect:ConvAsm1x1U,1.4224,0,miopenConvolutionBwdDataAlgoDirect,64x56x56x1x1x256x56x56x128xNCHWxFP16x0x0x1x1x1x1x1x0
64-56-56-1x1-256-56-56-128-0x0-1x1-1x1-0-NCHW-FP16-W=miopenConvolutionBwdWeightsAlgoDirect:ConvAsmBwdWrW1x1,1.87264,0,miopenConvolutionBwdWeightsAlgoDirect,64x56x56x1x1x256x56x56x128xNCHWxFP16x0x0x1x1x1x1x1x0;miopenConvolutionBwdWeightsAlgoGEMM:gemm,19.5394,0,rocBlas,<unused>
64-56-56-1x1-64-56-56-128-0x0-1x1-1x1-0-NCHW-FP16-B=miopenConvolutionBwdDataAlgoGEMM:gemm,0.24704,0,rocBlas,<unused>;miopenConvolutionBwdDataAlgoWinograd:ConvBinWinogradRxS,0.89696,0,miopenConvolutionBwdDataAlgoWinograd,64x56x56x1x1x64x56x56x128xNCHWxFP16x0x0x1x1x1x1x1x0;miopenConvolutionBwdDataAlgoDirect:ConvAsm1x1U,0.28576,0,miopenConvolutionBwdDataAlgoDirect,64x56x56x1x1x64x56x56x128xNCHWxFP16x0x0x1x1x1x1x1x0
64-56-56-1x1-64-56-56-128-0x0-1x1-1x1-0-NCHW-FP16-W=miopenConvolutionBwdWeightsAlgoDirect:ConvAsmBwdWrW1x1,0.641281,0,miopenConvolutionBwdWeightsAlgoDirect,64x56x56x1x1x64x56x56x128xNCHWxFP16x0x0x1x1x1x1x1x0;miopenConvolutionBwdWeightsAlgoGEMM:gemm,18.8079,0,rocBlas,<unused>
64-112-112-7x7-3-224-224-128-3x3-2x2-1x1-0-NCHW-FP16-W=miopenConvolutionBwdWeightsAlgoDirect:ConvOclBwdWrW2<2>,6.54449,1204224,miopenConvolutionBwdWeightsAlgoDirect,64x112x112x7x7x3x224x224x128xNCHWxFP16x3x3x2x2x1x1x1x0;miopenConvolutionBwdWeightsAlgoGEMM:gemm,218.747,3687936,rocBlas,<unused>
1-128-128-5x5-64-128-128-64-2x2-1x1-1x1-0-NCHW-FP32-F=miopenConvolutionFwdAlgoDirect:ConvOclDirectFwd,1.93984,0,miopenConvolutionFwdAlgoDirect,1x128x128x5x5x64x128x128x64xNCHWxFP32x2x2x1x1x1x1x1x1;miopenConvolutionFwdAlgoGEMM:gemm,4.78208,1638400,rocBlas,<unused>
64-128-128-3x3-64-128-128-64-1x1-1x1-1x1-0-NCHW-FP32-F=miopenConvolutionFwdAlgoWinograd:ConvBinWinogradRxS,3.98207,0,miopenConvolutionFwdAlgoWinograd,64x128x128x3x3x64x128x128x64xNCHWxFP32x1x1x1x1x1x1x1x1
64-128-128-3x3-32-128-128-64-1x1-1x1-1x1-0-NCHW-FP32-F=miopenConvolutionFwdAlgoWinograd:ConvBinWinograd3x3U,1.93328,0,miopenConvolutionFwdAlgoWinograd,64x128x128x3x3x32x128x128x64xNCHWxFP32x1x1x1x1x1x1x1x1
32-128-128-3x3-4-128-128-64-1x1-1x1-1x1-0-NCHW-FP32-F=miopenConvolutionFwdAlgoDirect:ConvAsm3x3U,0.41792,0,miopenConvolutionFwdAlgoDirect,32x128x128x3x3x4x128x128x64xNCHWxFP32x1x1x1x1x1x1x1x1;miopenConvolutionFwdAlgoGEMM:gemm,8.86784,18874368,rocBlas,<unused>;miopenConvolutionFwdAlgoWinograd:ConvBinWinogradRxS,1.05856,0,miopenConvolutionFwdAlgoWinograd,32x128x128x3x3x4x128x128x64xNCHWxFP32x1x1x1x1x1x1x1x1
4-128-128-3x3-32-128-128-64-1x1-1x1-1x1-0-NCHW-FP32-B=miopenConvolutionBwdDataAlgoGEMM:gemm,11.6224,18874368,rocBlas,<unused>;miopenConvolutionBwdDataAlgoDirect:ConvAsm3x3U,0.46624,0,miopenConvolutionBwdDataAlgoDirect,4x128x128x3x3x32x128x128x64xNCHWxFP32x1x1x1x1x1x1x1x0
4-128-128-3x3-32-128-128-64-1x1-1x1-1x1-0-NCHW-FP32-W=miopenConvolutionBwdWeightsAlgoWinograd:ConvWinograd3x3MultipassWrW<3-5>,4.88175,305295872,miopenConvolutionBwdWeightsAlgoWinograd,4x128x128x3x3x32x128x128x64xNCHWxFP32x1x1x1x1x1x1x1x0;miopenConvolutionBwdWeightsAlgoGEMM:gemm,20.2138,18874368,rocBlas,<unused>;miopenConvolutionBwdWeightsAlgoDirect:ConvOclBwdWrW53,0.898719,294912,miopenConvolutionBwdWeightsAlgoDirect,4x128x128x3x3x32x128x128x64xNCHWxFP32x1x1x1x1x1x1x1x0
32-128-128-3x3-64-128-128-64-1x1-1x1-1x1-0-NCHW-FP32-B=miopenConvolutionBwdDataAlgoWinograd:ConvBinWinograd3x3U,2.2464,0,miopenConvolutionBwdDataAlgoWinograd,32x128x128x3x3x64x128x128x64xNCHWxFP32x1x1x1x1x1x1x1x0
32-128-128-3x3-64-128-128-64-1x1-1x1-1x1-0-NCHW-FP32-W=miopenConvolutionBwdWeightsAlgoWinograd:ConvWinograd3x3MultipassWrW<3-5>,10.4155,814456832,miopenConvolutionBwdWeightsAlgoWinograd,32x128x128x3x3x64x128x128x64xNCHWxFP32x1x1x1x1x1x1x1x0;miopenConvolutionBwdWeightsAlgoGEMM:gemm,52.4902,37748736,rocBlas,<unused>;miopenConvolutionBwdWeightsAlgoDirect:ConvOclBwdWrW53,6.65887,4718592,miopenConvolutionBwdWeightsAlgoDirect,32x128x128x3x3x64x128x128x64xNCHWxFP32x1x1x1x1x1x1x1x0
64-128-128-3x3-64-128-128-64-1x1-1x1-1x1-0-NCHW-FP32-B=miopenConvolutionBwdDataAlgoWinograd:ConvBinWinogradRxS,3.81935,0,miopenConvolutionBwdDataAlgoWinograd,64x128x128x3x3x64x128x128x64xNCHWxFP32x1x1x1x1x1x1x1x0
64-128-128-3x3-64-128-128-64-1x1-1x1-1x1-0-NCHW-FP32-W=miopenConvolutionBwdWeightsAlgoWinograd:ConvWinograd3x3MultipassWrW<3-5>,14.6809,1086210048,miopenConvolutionBwdWeightsAlgoWinograd,64x128x128x3x3x64x128x128x64xNCHWxFP32x1x1x1x1x1x1x1x0;miopenConvolutionBwdWeightsAlgoGEMM:gemm,57.8662,37748736,rocBlas,<unused>;miopenConvolutionBwdWeightsAlgoDirect:ConvOclBwdWrW53,13.2593,9437184,miopenConvolutionBwdWeightsAlgoDirect,64x128x128x3x3x64x128x128x64xNCHWxFP32x1x1x1x1x1x1x1x0
64-128-128-5x5-1-128-128-64-2x2-1x1-1x1-0-NCHW-FP32-W=miopenConvolutionBwdWeightsAlgoWinograd:ConvBinWinogradRxS,88.9044,0,miopenConvolutionBwdWeightsAlgoWinograd,64x128x128x5x5x1x128x128x64xNCHWxFP32x2x2x1x1x1x1x1x0;miopenConvolutionBwdWeightsAlgoGEMM:gemm,20.9306,1638400,rocBlas,<unused>;miopenConvolutionBwdWeightsAlgoDirect:ConvOclBwdWrW2<1>,1.62128,409600,miopenConvolutionBwdWeightsAlgoDirect,64x128x128x5x5x1x128x128x64xNCHWxFP32x2x2x1x1x1x1x1x0
1-128-128-5x5-64-128-128-8-2x2-1x1-1x1-0-NCHW-FP32-F=miopenConvolutionFwdAlgoDirect:ConvOclDirectFwd,0.2632,0,miopenConvolutionFwdAlgoDirect,1x128x128x5x5x64x128x128x8xNCHWxFP32x2x2x1x1x1x1x1x1;miopenConvolutionFwdAlgoGEMM:gemm,0.39552,1638400,rocBlas,<unused>
64-128-128-3x3-64-128-128-8-1x1-1x1-1x1-0-NCHW-FP32-F=miopenConvolutionFwdAlgoWinograd:ConvBinWinograd3x3U,0.573599,0,miopenConvolutionFwdAlgoWinograd,64x128x128x3x3x64x128x128x8xNCHWxFP32x1x1x1x1x1x1x1x1
64-128-128-3x3-32-128-128-8-1x1-1x1-1x1-0-NCHW-FP32-F=miopenConvolutionFwdAlgoWinograd:ConvBinWinograd3x3U,0.30032,0,miopenConvolutionFwdAlgoWinograd,64x128x128x3x3x32x128x128x8xNCHWxFP32x1x1x1x1x1x1x1x1
32-128-128-3x3-4-128-128-8-1x1-1x1-1x1-0-NCHW-FP32-F=miopenConvolutionFwdAlgoDirect:ConvAsm3x3U,0.06288,0,miopenConvolutionFwdAlgoDirect,32x128x128x3x3x4x128x128x8xNCHWxFP32x1x1x1x1x1x1x1x1;miopenConvolutionFwdAlgoGEMM:gemm,1.20576,18874368,rocBlas,<unused>;miopenConvolutionFwdAlgoWinograd:ConvBinWinograd3x3U,0.16736,0,miopenConvolutionFwdAlgoWinograd,32x128x128x3x3x4x128x128x8xNCHWxFP32x1x1x1x1x1x1x1x1
4-128-128-3x3-32-128-128-8-1x1-1x1-1x1-0-NCHW-FP32-B=miopenConvolutionBwdDataAlgoGEMM:gemm,1.41952,18874368,rocBlas,<unused>;miopenConvolutionBwdDataAlgoDirect:ConvAsm3x3U,0.06592,0,miopenConvolutionBwdDataAlgoDirect,4x128x128x3x3x32x128x128x8xNCHWxFP32x1x1x1x1x1x1x1x0
4-128-128-3x3-32-128-128-8-1x1-1x1-1x1-0-NCHW-FP32-W=miopenConvolutionBwdWeightsAlgoWinograd:ConvWinograd3x3MultipassWrW<3-5>,0.29456,38183936,miopenConvolutionBwdWeightsAlgoWinograd,4x128x128x3x3x32x128x128x8xNCHWxFP32x1x1x1x1x1x1x1x0;miopenConvolutionBwdWeightsAlgoGEMM:gemm,2.89536,18874368,rocBlas,<unused>;miopenConvolutionBwdWeightsAlgoDirect:ConvAsmBwdWrW3x3,0.13872,0,miopenConvolutionBwdWeightsAlgoDirect,4x128x128x3x3x32x128x128x8xNCHWxFP32x1x1x1x1x1x1x1x0
32-128-128-3x3-64-128-128-8-1x1-1x1-1x1-0-NCHW-FP32-B=miopenConvolutionBwdDataAlgoWinograd:ConvBinWinograd3x3U,0.34704,0,miopenConvolutionBwdDataAlgoWinograd,32x128x128x3x3x64x128x128x8xNCHWxFP32x1x1x1x1x1x1x1x0
32-128-128-3x3-64-128-128-8-1x1-1x1-1x1-0-NCHW-FP32-W=miopenConvolutionBwdWeightsAlgoWinograd:ConvWinograd3x3MultipassWrW<3-5>,0.824,102158336,miopenConvolutionBwdWeightsAlgoWinograd,32x128x128x3x3x64x128x128x8xNCHWxFP32x1x1x1x1x1x1x1x0;miopenConvolutionBwdWeightsAlgoGEMM:gemm,5.01375,37748736,rocBlas,<unused>;miopenConvolutionBwdWeightsAlgoDirect:ConvAsmBwdWrW3x3,0.848639,0,miopenConvolutionBwdWeightsAlgoDirect,32x128x128x3x3x64x128x128x8xNCHWxFP32x1x1x1x1x1x1x1x0
64-128-128-3x3-64-128-128-8-1x1-1x1-1x1-0-NCHW-FP32-B=miopenConvolutionBwdDataAlgoWinograd:ConvBinWinograd3x3U,0.531519,0,miopenConvolutionBwdDataAlgoWinograd,64x128x128x3x3x64x128x128x8xNCHWxFP32x1x1x1x1x1x1x1x0
64-128-128-3x3-64-128-128-8-1x1-1x1-1x1-0-NCHW-FP32-W=miopenConvolutionBwdWeightsAlgoWinograd:ConvWinograd3x3MultipassWrW<3-6>,1.10432,127926272,miopenConvolutionBwdWeightsAlgoWinograd,64x128x128x3x3x64x128x128x8xNCHWxFP32x1x1x1x1x1x1x1x0;miopenConvolutionBwdWeightsAlgoGEMM:gemm,3.2384,37748736,rocBlas,<unused>;miopenConvolutionBwdWeightsAlgoDirect:ConvAsmBwdWrW3x3,1.8984,0,miopenConvolutionBwdWeightsAlgoDirect,64x128x128x3x3x64x128x128x8xNCHWxFP32x1x1x1x1x1x1x1x0
64-128-128-5x5-1-128-128-8-2x2-1x1-1x1-0-NCHW-FP32-W=miopenConvolutionBwdWeightsAlgoWinograd:ConvBinWinogradRxS,9.96014,0,miopenConvolutionBwdWeightsAlgoWinograd,64x128x128x5x5x1x128x128x8xNCHWxFP32x2x2x1x1x1x1x1x0;miopenConvolutionBwdWeightsAlgoGEMM:gemm,2.66368,1638400,rocBlas,<unused>;miopenConvolutionBwdWeightsAlgoDirect:ConvOclBwdWrW53,0.32432,51200,miopenConvolutionBwdWeightsAlgoDirect,64x128x128x5x5x1x128x128x8xNCHWxFP32x2x2x1x1x1x1x1x0
4-84-84-8x8-32-20-20-16-0x0-4x4-1x1-0-NCHW-FP32-F=miopenConvolutionFwdAlgoImplicitGEMM:ConvHipImplicitGemmV4Fwd,0.11392,0,miopenConvolutionFwdAlgoImplicitGEMM,4x84x84x8x8x32x20x20x16xNCHWxFP32x0x0x4x4x1x1x1x1;miopenConvolutionFwdAlgoGEMM:gemm,1.18272,409600,rocBlas,<unused>
32-20-20-4x4-64-9-9-16-0x0-2x2-1x1-0-NCHW-FP32-F=miopenConvolutionFwdAlgoWinograd:ConvBinWinogradRxS,0.06192,0,miopenConvolutionFwdAlgoWinograd,32x20x20x4x4x64x9x9x16xNCHWxFP32x0x0x2x2x1x1x1x1;miopenConvolutionFwdAlgoGEMM:gemm,0.64256,165888,rocBlas,<unused>
64-9-9-3x3-32-7-7-16-0x0-1x1-1x1-0-NCHW-FP32-F=miopenConvolutionFwdAlgoDirect:ConvOclDirectFwd,0.24816,0,miopenConvolutionFwdAlgoDirect,64x9x9x3x3x32x7x7x16xNCHWxFP32x0x0x1x1x1x1x1x1;miopenConvolutionFwdAlgoGEMM:gemm,0.60672,112896,rocBlas,<unused>;miopenConvolutionFwdAlgoWinograd:ConvBinWinogradRxS,0.03408,0,miopenConvolutionFwdAlgoWinograd,64x9x9x3x3x32x7x7x16xNCHWxFP32x0x0x1x1x1x1x1x1
4-84-84-8x8-32-20-20-512-0x0-4x4-1x1-0-NCHW-FP32-F=miopenConvolutionFwdAlgoImplicitGEMM:ConvHipImplicitGemmV4Fwd,0.791522,0,miopenConvolutionFwdAlgoImplicitGEMM,4x84x84x8x8x32x20x20x512xNCHWxFP32x0x0x4x4x1x1x1x1;miopenConvolutionFwdAlgoGEMM:gemm,34.4883,409600,rocBlas,<unused>
32-20-20-4x4-64-9-9-512-0x0-2x2-1x1-0-NCHW-FP32-F=miopenConvolutionFwdAlgoGEMM:gemm,22.0365,165888,rocBlas,<unused>;miopenConvolutionFwdAlgoImplicitGEMM:ConvHipImplicitGemmV4Fwd,0.572641,0,miopenConvolutionFwdAlgoImplicitGEMM,32x20x20x4x4x64x9x9x512xNCHWxFP32x0x0x2x2x1x1x1x1;miopenConvolutionFwdAlgoWinograd:ConvBinWinogradRxS,0.415521,0,miopenConvolutionFwdAlgoWinograd,32x20x20x4x4x64x9x9x512xNCHWxFP32x0x0x2x2x1x1x1x1
64-9-9-3x3-32-7-7-512-0x0-1x1-1x1-0-NCHW-FP32-F=miopenConvolutionFwdAlgoDirect:ConvOclDirectFwd,0.960002,0,miopenConvolutionFwdAlgoDirect,64x9x9x3x3x32x7x7x512xNCHWxFP32x0x0x1x1x1x1x1x1;miopenConvolutionFwdAlgoGEMM:gemm,18.5958,112896,rocBlas,<unused>;miopenConvolutionFwdAlgoImplicitGEMM:ConvHipImplicitGemmV4Fwd,0.17984,0,miopenConvolutionFwdAlgoImplicitGEMM,64x9x9x3x3x32x7x7x512xNCHWxFP32x0x0x1x1x1x1x1x1;miopenConvolutionFwdAlgoWinograd:ConvBinWinogradRxS,0.08592,0,miopenConvolutionFwdAlgoWinograd,64x9x9x3x3x32x7x7x512xNCHWxFP32x0x0x1x1x1x1x1x1
32-7-7-3x3-64-9-9-512-0x0-1x1-1x1-0-NCHW-FP32-B=miopenConvolutionBwdDataAlgoGEMM:gemm,19.0874,112896,rocBlas,<unused>;miopenConvolutionBwdDataAlgoWinograd:ConvBinWinogradRxS,0.16208,0,miopenConvolutionBwdDataAlgoWinograd,32x7x7x3x3x64x9x9x512xNCHWxFP32x0x0x1x1x1x1x1x0;miopenConvolutionBwdDataAlgoDirect:ConvOclDirectFwd,1.57616,0,miopenConvolutionBwdDataAlgoDirect,32x7x7x3x3x64x9x9x512xNCHWxFP32x0x0x1x1x1x1x1x0
32-7-7-3x3-64-9-9-512-0x0-1x1-1x1-0-NCHW-FP32-W=miopenConvolutionBwdWeightsAlgoWinograd:ConvWinograd3x3MultipassWrW<3-4>,0.42896,28606464,miopenConvolutionBwdWeightsAlgoWinograd,32x7x7x3x3x64x9x9x512xNCHWxFP32x0x0x1x1x1x1x1x0;miopenConvolutionBwdWeightsAlgoGEMM:gemm,16.4659,112896,rocBlas,<unused>;miopenConvolutionBwdWeightsAlgoDirect:ConvOclBwdWrW53,0.532161,37748736,miopenConvolutionBwdWeightsAlgoDirect,32x7x7x3x3x64x9x9x512xNCHWxFP32x0x0x1x1x1x1x1x0
64-9-9-4x4-32-20-20-512-0x0-2x2-1x1-0-NCHW-FP32-B=miopenConvolutionBwdDataAlgoGEMM:gemm,18.432,165888,rocBlas,<unused>;miopenConvolutionBwdDataAlgoWinograd:ConvBinWinogradRxS,0.553761,0,miopenConvolutionBwdDataAlgoWinograd,64x9x9x4x4x32x20x20x512xNCHWxFP32x0x0x2x2x1x1x1x0
64-9-9-4x4-32-20-20-512-0x0-2x2-1x1-0-NCHW-FP32-W=miopenConvolutionBwdWeightsAlgoDirect:ConvOclBwdWrW2<16>,3.24081,4194304,miopenConvolutionBwdWeightsAlgoDirect,64x9x9x4x4x32x20x20x512xNCHWxFP32x0x0x2x2x1x1x1x0;miopenConvolutionBwdWeightsAlgoGEMM:gemm,19.1693,165888,rocBlas,<unused>
32-20-20-8x8-4-84-84-512-0x0-4x4-1x1-0-NCHW-FP32-W=miopenConvolutionBwdWeightsAlgoGEMM:gemm,35.3075,409600,rocBlas,<unused>
3-64-64-3x3-64-64-64-2-1x1-1x1-1x1-0-NCHW-FP32-F=miopenConvolutionFwdAlgoDirect:ConvOclDirectFwd3x3,0.02336,0,miopenConvolutionFwdAlgoDirect,3x64x64x3x3x64x64x64x2xNCHWxFP32x1x1x1x1x1x1x1x1;miopenConvolutionFwdAlgoGEMM:gemm,0.22912,442368,rocBlas,<unused>
64-64-64-3x3-64-64-64-2-1x1-1x1-1x1-0-NCHW-FP32-F=miopenConvolutionFwdAlgoWinograd:ConvBinWinograd3x3U,0.06768,0,miopenConvolutionFwdAlgoWinograd,64x64x64x3x3x64x64x64x2xNCHWxFP32x1x1x1x1x1x1x1x1
64-32-32-3x3-128-32-32-2-1x1-1x1-1x1-0-NCHW-FP32-F=miopenConvolutionFwdAlgoWinograd:ConvBinWinograd3x3U,0.044,0,miopenConvolutionFwdAlgoWinograd,64x32x32x3x3x128x32x32x2xNCHWxFP32x1x1x1x1x1x1x1x1
128-32-32-3x3-128-32-32-2-1x1-1x1-1x1-0-NCHW-FP32-F=miopenConvolutionFwdAlgoWinograd:ConvBinWinograd3x3U,0.07168,0,miopenConvolutionFwdAlgoWinograd,128x32x32x3x3x128x32x32x2xNCHWxFP32x1x1x1x1x1x1x1x1
128-16-16-3x3-256-16-16-2-1x1-1x1-1x1-0-NCHW-FP32-F=miopenConvolutionFwdAlgoWinograd:ConvBinWinograd3x3U,0.04576,0,miopenConvolutionFwdAlgoWinograd,128x16x16x3x3x256x16x16x2xNCHWxFP32x1x1x1x1x1x1x1x1
256-16-16-3x3-256-16-16-2-1x1-1x1-1x1-0-NCHW-FP32-F=miopenConvolutionFwdAlgoWinograd:ConvBinWinograd3x3U,0.07728,0,miopenConvolutionFwdAlgoWinograd,256x16x16x3x3x256x16x16x2xNCHWxFP32x1x1x1x1x1x1x1x1
256-8-8-3x3-512-8-8-2-1x1-1x1-1x1-0-NCHW-FP32-F=miopenConvolutionFwdAlgoWinograd:ConvBinWinograd3x3U,0.08352,0,miopenConvolutionFwdAlgoWinograd,256x8x8x3x3x512x8x8x2xNCHWxFP32x1x1x1x1x1x1x1x1
512-8-8-3x3-512-8-8-2-1x1-1x1-1x1-0-NCHW-FP32-F=miopenConvolutionFwdAlgoWinograd:ConvBinWinogradRxS,0.13728,0,miopenConvolutionFwdAlgoWinograd,512x8x8x3x3x512x8x8x2xNCHWxFP32x1x1x1x1x1x1x1x1
3-64-64-3x3-64-64-64-128-1x1-1x1-1x1-0-NCHW-FP32-F=miopenConvolutionFwdAlgoDirect:ConvOclDirectFwd3x3,0.518399,0,miopenConvolutionFwdAlgoDirect,3x64x64x3x3x64x64x64x128xNCHWxFP32x1x1x1x1x1x1x1x1;miopenConvolutionFwdAlgoGEMM:gemm,13.312,442368,rocBlas,<unused>
64-64-64-3x3-64-64-64-128-1x1-1x1-1x1-0-NCHW-FP32-F=miopenConvolutionFwdAlgoWinograd:ConvBinWinogradRxS,2.04607,0,miopenConvolutionFwdAlgoWinograd,64x64x64x3x3x64x64x64x128xNCHWxFP32x1x1x1x1x1x1x1x1
64-32-32-3x3-128-32-32-128-1x1-1x1-1x1-0-NCHW-FP32-F=miopenConvolutionFwdAlgoWinograd:ConvBinWinograd3x3U,0.938077,0,miopenConvolutionFwdAlgoWinograd,64x32x32x3x3x128x32x32x128xNCHWxFP32x1x1x1x1x1x1x1x1
128-32-32-3x3-128-32-32-128-1x1-1x1-1x1-0-NCHW-FP32-F=miopenConvolutionFwdAlgoWinograd:ConvBinWinograd3x3U,1.71264,0,miopenConvolutionFwdAlgoWinograd,128x32x32x3x3x128x32x32x128xNCHWxFP32x1x1x1x1x1x1x1x1
128-16-16-3x3-256-16-16-128-1x1-1x1-1x1-0-NCHW-FP32-F=miopenConvolutionFwdAlgoWinograd:ConvBinWinogradRxS,1.01696,0,miopenConvolutionFwdAlgoWinograd,128x16x16x3x3x256x16x16x128xNCHWxFP32x1x1x1x1x1x1x1x1
256-16-16-3x3-256-16-16-128-1x1-1x1-1x1-0-NCHW-FP32-F=miopenConvolutionFwdAlgoWinograd:ConvBinWinogradRxS,1.92063,0,miopenConvolutionFwdAlgoWinograd,256x16x16x3x3x256x16x16x128xNCHWxFP32x1x1x1x1x1x1x1x1
256-8-8-3x3-512-8-8-128-1x1-1x1-1x1-0-NCHW-FP32-F=miopenConvolutionFwdAlgoWinograd:ConvBinWinogradRxS,1.012,0,miopenConvolutionFwdAlgoWinograd,256x8x8x3x3x512x8x8x128xNCHWxFP32x1x1x1x1x1x1x1x1
512-8-8-3x3-512-8-8-128-1x1-1x1-1x1-0-NCHW-FP32-F=miopenConvolutionFwdAlgoWinograd:ConvBinWinogradRxS,1.97535,0,miopenConvolutionFwdAlgoWinograd,512x8x8x3x3x512x8x8x128xNCHWxFP32x1x1x1x1x1x1x1x1
3-72-72-9x9-32-64-64-128-0x0-1x1-1x1-0-NCHW-FP32-F=miopenConvolutionFwdAlgoDirect:ConvOclDirectFwd,1.46943,0,miopenConvolutionFwdAlgoDirect,3x72x72x9x9x32x64x64x128xNCHWxFP32x0x0x1x1x1x1x1x1;miopenConvolutionFwdAlgoGEMM:gemm,13.0458,3981312,rocBlas,<unused>;miopenConvolutionFwdAlgoWinograd:ConvBinWinogradRxS,0.881756,0,miopenConvolutionFwdAlgoWinograd,3x72x72x9x9x32x64x64x128xNCHWxFP32x0x0x1x1x1x1x1x1
32-66-66-3x3-64-32-32-128-0x0-2x2-1x1-0-NCHW-FP32-F=miopenConvolutionFwdAlgoDirect:ConvOclDirectFwdGen,3.17566,0,miopenConvolutionFwdAlgoDirect,32x66x66x3x3x64x32x32x128xNCHWxFP32x0x0x2x2x1x1x1x1;miopenConvolutionFwdAlgoGEMM:gemm,9.89184,1179648,rocBlas,<unused>;miopenConvolutionFwdAlgoImplicitGEMM:ConvHipImplicitGemmV4Fwd,0.771197,0,miopenConvolutionFwdAlgoImplicitGEMM,32x66x66x3x3x64x32x32x128xNCHWxFP32x0x0x2x2x1x1x1x1;miopenConvolutionFwdAlgoWinograd:ConvBinWinogradRxS,1.09632,0,miopenConvolutionFwdAlgoWinograd,32x66x66x3x3x64x32x32x128xNCHWxFP32x0x0x2x2x1x1x1x1
64-34-34-3x3-128-16-16-128-0x0-2x2-1x1-0-NCHW-FP32-F=miopenConvolutionFwdAlgoDirect:ConvOclDirectFwdGen,3.71503,0,miopenConvolutionFwdAlgoDirect,64x34x34x3x3x128x16x16x128xNCHWxFP32x0x0x2x2x1x1x1x1;miopenConvolutionFwdAlgoGEMM:gemm,6.61504,589824,rocBlas,<unused>;miopenConvolutionFwdAlgoImplicitGEMM:ConvHipImplicitGemmV4Fwd,0.625278,0,miopenConvolutionFwdAlgoImplicitGEMM,64x34x34x3x3x128x16x16x128xNCHWxFP32x0x0x2x2x1x1x1x1;miopenConvolutionFwdAlgoWinograd:ConvBinWinogradRxS,1.08144,0,miopenConvolutionFwdAlgoWinograd,64x34x34x3x3x128x16x16x128xNCHWxFP32x0x0x2x2x1x1x1x1
128-18-18-3x3-128-16-16-128-0x0-1x1-1x1-0-NCHW-FP32-F=miopenConvolutionFwdAlgoDirect:ConvOclDirectFwd,6.1979,0,miopenConvolutionFwdAlgoDirect,128x18x18x3x3x128x16x16x128xNCHWxFP32x0x0x1x1x1x1x1x1;miopenConvolutionFwdAlgoGEMM:gemm,7.74144,1179648,rocBlas,<unused>;miopenConvolutionFwdAlgoImplicitGEMM:ConvHipImplicitGemmV4Fwd,1.21504,0,miopenConvolutionFwdAlgoImplicitGEMM,128x18x18x3x3x128x16x16x128xNCHWxFP32x0x0x1x1x1x1x1x1;miopenConvolutionFwdAlgoWinograd:ConvBinWinogradRxS,0.533759,0,miopenConvolutionFwdAlgoWinograd,128x18x18x3x3x128x16x16x128xNCHWxFP32x0x0x1x1x1x1x1x1
128-34-34-3x3-64-32-32-128-0x0-1x1-1x1-0-NCHW-FP32-F=miopenConvolutionFwdAlgoDirect:ConvOclDirectFwd,4.34543,0,miopenConvolutionFwdAlgoDirect,128x34x34x3x3x64x32x32x128xNCHWxFP32x0x0x1x1x1x1x1x1;miopenConvolutionFwdAlgoGEMM:gemm,13.8854,4718592,rocBlas,<unused>;miopenConvolutionFwdAlgoImplicitGEMM:ConvHipImplicitGemmV4Fwd,2.76415,0,miopenConvolutionFwdAlgoImplicitGEMM,128x34x34x3x3x64x32x32x128xNCHWxFP32x0x0x1x1x1x1x1x1;miopenConvolutionFwdAlgoWinograd:ConvBinWinogradRxS,1.02992,0,miopenConvolutionFwdAlgoWinograd,128x34x34x3x3x64x32x32x128xNCHWxFP32x0x0x1x1x1x1x1x1
64-66-66-3x3-32-64-64-128-0x0-1x1-1x1-0-NCHW-FP32-F=miopenConvolutionFwdAlgoDirect:ConvOclDirectFwd,4.41487,0,miopenConvolutionFwdAlgoDirect,64x66x66x3x3x32x64x64x128xNCHWxFP32x0x0x1x1x1x1x1x1;miopenConvolutionFwdAlgoGEMM:gemm,19.2307,9437184,rocBlas,<unused>;miopenConvolutionFwdAlgoImplicitGEMM:ConvHipImplicitGemmV4Fwd,2.36223,0,miopenConvolutionFwdAlgoImplicitGEMM,64x66x66x3x3x32x64x64x128xNCHWxFP32x0x0x1x1x1x1x1x1;miopenConvolutionFwdAlgoWinograd:ConvBinWinogradRxS,1.13312,0,miopenConvolutionFwdAlgoWinograd,64x66x66x3x3x32x64x64x128xNCHWxFP32x0x0x1x1x1x1x1x1
32-72-72-9x9-3-64-64-128-0x0-1x1-1x1-0-NCHW-FP32-F=miopenConvolutionFwdAlgoDirect:ConvOclDirectFwd,1.38016,0,miopenConvolutionFwdAlgoDirect,32x72x72x9x9x3x64x64x128xNCHWxFP32x0x0x1x1x1x1x1x1;miopenConvolutionFwdAlgoGEMM:gemm,60.846,42467328,rocBlas,<unused>;miopenConvolutionFwdAlgoWinograd:ConvBinWinogradRxS,5.87294,0,miopenConvolutionFwdAlgoWinograd,32x72x72x9x9x3x64x64x128xNCHWxFP32x0x0x1x1x1x1x1x1
512-8-8-3x3-512-8-8-128-1x1-1x1-1x1-0-NCHW-FP32-B=miopenConvolutionBwdDataAlgoWinograd:ConvBinWinogradRxS,1.87776,0,miopenConvolutionBwdDataAlgoWinograd,512x8x8x3x3x512x8x8x128xNCHWxFP32x1x1x1x1x1x1x1x0
512-8-8-3x3-256-8-8-128-1x1-1x1-1x1-0-NCHW-FP32-B=miopenConvolutionBwdDataAlgoWinograd:ConvBinWinogradRxS,0.992477,0,miopenConvolutionBwdDataAlgoWinograd,512x8x8x3x3x256x8x8x128xNCHWxFP32x1x1x1x1x1x1x1x0
256-16-16-3x3-256-16-16-128-1x1-1x1-1x1-0-NCHW-FP32-B=miopenConvolutionBwdDataAlgoWinograd:ConvBinWinogradRxS,1.92479,0,miopenConvolutionBwdDataAlgoWinograd,256x16x16x3x3x256x16x16x128xNCHWxFP32x1x1x1x1x1x1x1x0
256-16-16-3x3-128-16-16-128-1x1-1x1-1x1-0-NCHW-FP32-B=miopenConvolutionBwdDataAlgoWinograd:ConvBinWinograd3x3U,0.999997,0,miopenConvolutionBwdDataAlgoWinograd,256x16x16x3x3x128x16x16x128xNCHWxFP32x1x1x1x1x1x1x1x0
128-32-32-3x3-128-32-32-128-1x1-1x1-1x1-0-NCHW-FP32-B=miopenConvolutionBwdDataAlgoWinograd:ConvBinWinogradRxS,1.7832,0,miopenConvolutionBwdDataAlgoWinograd,128x32x32x3x3x128x32x32x128xNCHWxFP32x1x1x1x1x1x1x1x0
128-32-32-3x3-64-32-32-128-1x1-1x1-1x1-0-NCHW-FP32-B=miopenConvolutionBwdDataAlgoWinograd:ConvBinWinograd3x3U,1.01312,0,miopenConvolutionBwdDataAlgoWinograd,128x32x32x3x3x64x32x32x128xNCHWxFP32x1x1x1x1x1x1x1x0
64-64-64-3x3-64-64-64-128-1x1-1x1-1x1-0-NCHW-FP32-B=miopenConvolutionBwdDataAlgoWinograd:ConvBinWinogradRxS,1.93679,0,miopenConvolutionBwdDataAlgoWinograd,64x64x64x3x3x64x64x64x128xNCHWxFP32x1x1x1x1x1x1x1x0
64-64-64-3x3-3-64-64-128-1x1-1x1-1x1-0-NCHW-FP32-B=miopenConvolutionBwdDataAlgoGEMM:gemm,5.4272,442368,rocBlas,<unused>;miopenConvolutionBwdDataAlgoWinograd:ConvBinWinograd3x3U,1.04528,0,miopenConvolutionBwdDataAlgoWinograd,64x64x64x3x3x3x64x64x128xNCHWxFP32x1x1x1x1x1x1x1x0;miopenConvolutionBwdDataAlgoDirect:ConvAsm3x3U,0.615518,0,miopenConvolutionBwdDataAlgoDirect,64x64x64x3x3x3x64x64x128xNCHWxFP32x1x1x1x1x1x1x1x0
3-64-64-9x9-32-72-72-128-0x0-1x1-1x1-0-NCHW-FP32-B=miopenConvolutionBwdDataAlgoGEMM:gemm,56.9343,42467328,rocBlas,<unused>;miopenConvolutionBwdDataAlgoWinograd:ConvBinWinogradRxS,1.07216,0,miopenConvolutionBwdDataAlgoWinograd,3x64x64x9x9x32x72x72x128xNCHWxFP32x0x0x1x1x1x1x1x0;miopenConvolutionBwdDataAlgoDirect:ConvOclDirectFwd,4.53918,0,miopenConvolutionBwdDataAlgoDirect,3x64x64x9x9x32x72x72x128xNCHWxFP32x0x0x1x1x1x1x1x0
3-64-64-9x9-32-72-72-128-0x0-1x1-1x1-0-NCHW-FP32-W=miopenConvolutionBwdWeightsAlgoWinograd:ConvBinWinogradRxS,24.3319,0,miopenConvolutionBwdWeightsAlgoWinograd,3x64x64x9x9x32x72x72x128xNCHWxFP32x0x0x1x1x1x1x1x0;miopenConvolutionBwdWeightsAlgoGEMM:gemm,63.2626,42467328,rocBlas,<unused>;miopenConvolutionBwdWeightsAlgoDirect:ConvOclBwdWrW2<1>,1.8296,3981312,miopenConvolutionBwdWeightsAlgoDirect,3x64x64x9x9x32x72x72x128xNCHWxFP32x0x0x1x1x1x1x1x0
32-64-64-3x3-64-66-66-128-0x0-1x1-1x1-0-NCHW-FP32-B=miopenConvolutionBwdDataAlgoGEMM:gemm,18.1658,9437184,rocBlas,<unused>;miopenConvolutionBwdDataAlgoWinograd:ConvBinWinogradRxS,1.39264,0,miopenConvolutionBwdDataAlgoWinograd,32x64x64x3x3x64x66x66x128xNCHWxFP32x0x0x1x1x1x1x1x0;miopenConvolutionBwdDataAlgoDirect:ConvOclDirectFwd,9.37469,0,miopenConvolutionBwdDataAlgoDirect,32x64x64x3x3x64x66x66x128xNCHWxFP32x0x0x1x1x1x1x1x0
32-64-64-3x3-64-66-66-128-0x0-1x1-1x1-0-NCHW-FP32-W=miopenConvolutionBwdWeightsAlgoWinograd:ConvWinograd3x3MultipassWrW<3-6>,3.70047,381157376,miopenConvolutionBwdWeightsAlgoWinograd,32x64x64x3x3x64x66x66x128xNCHWxFP32x0x0x1x1x1x1x1x0;miopenConvolutionBwdWeightsAlgoGEMM:gemm,43.9704,9437184,rocBlas,<unused>;miopenConvolutionBwdWeightsAlgoDirect:ConvOclBwdWrW53,4.20767,9437184,miopenConvolutionBwdWeightsAlgoDirect,32x64x64x3x3x64x66x66x128xNCHWxFP32x0x0x1x1x1x1x1x0
64-32-32-3x3-128-34-34-128-0x0-1x1-1x1-0-NCHW-FP32-B=miopenConvolutionBwdDataAlgoGEMM:gemm,9.74848,4718592,rocBlas,<unused>;miopenConvolutionBwdDataAlgoWinograd:ConvBinWinogradRxS,1.22464,0,miopenConvolutionBwdDataAlgoWinograd,64x32x32x3x3x128x34x34x128xNCHWxFP32x0x0x1x1x1x1x1x0;miopenConvolutionBwdDataAlgoDirect:ConvOclDirectFwd,16.7343,0,miopenConvolutionBwdDataAlgoDirect,64x32x32x3x3x128x34x34x128xNCHWxFP32x0x0x1x1x1x1x1x0
64-32-32-3x3-128-34-34-128-0x0-1x1-1x1-0-NCHW-FP32-W=miopenConvolutionBwdWeightsAlgoWinograd:ConvWinograd3x3MultipassWrW<3-6>,2.23359,228589568,miopenConvolutionBwdWeightsAlgoWinograd,64x32x32x3x3x128x34x34x128xNCHWxFP32x0x0x1x1x1x1x1x0;miopenConvolutionBwdWeightsAlgoGEMM:gemm,14.6022,4718592,rocBlas,<unused>;miopenConvolutionBwdWeightsAlgoDirect:ConvOclBwdWrW53,2.43007,37748736,miopenConvolutionBwdWeightsAlgoDirect,64x32x32x3x3x128x34x34x128xNCHWxFP32x0x0x1x1x1x1x1x0
128-16-16-3x3-128-18-18-128-0x0-1x1-1x1-0-NCHW-FP32-B=miopenConvolutionBwdDataAlgoGEMM:gemm,6.73792,1179648,rocBlas,<unused>;miopenConvolutionBwdDataAlgoWinograd:ConvBinWinogradRxS,0.651518,0,miopenConvolutionBwdDataAlgoWinograd,128x16x16x3x3x128x18x18x128xNCHWxFP32x0x0x1x1x1x1x1x0;miopenConvolutionBwdDataAlgoDirect:ConvOclDirectFwd,10.5856,0,miopenConvolutionBwdDataAlgoDirect,128x16x16x3x3x128x18x18x128xNCHWxFP32x0x0x1x1x1x1x1x0
128-16-16-3x3-128-18-18-128-0x0-1x1-1x1-0-NCHW-FP32-W=miopenConvolutionBwdWeightsAlgoWinograd:ConvWinograd3x3MultipassWrW<3-6>,0.944959,79691776,miopenConvolutionBwdWeightsAlgoWinograd,128x16x16x3x3x128x18x18x128xNCHWxFP32x0x0x1x1x1x1x1x0;miopenConvolutionBwdWeightsAlgoGEMM:gemm,7.43424,1179648,rocBlas,<unused>;miopenConvolutionBwdWeightsAlgoDirect:ConvOclBwdWrW53,2.27391,0,miopenConvolutionBwdWeightsAlgoDirect,128x16x16x3x3x128x18x18x128xNCHWxFP32x0x0x1x1x1x1x1x0
128-16-16-3x3-64-34-34-128-0x0-2x2-1x1-0-NCHW-FP32-B=miopenConvolutionBwdDataAlgoGEMM:gemm,6.51264,589824,rocBlas,<unused>;miopenConvolutionBwdDataAlgoWinograd:ConvBinWinogradRxS,1.36159,0,miopenConvolutionBwdDataAlgoWinograd,128x16x16x3x3x64x34x34x128xNCHWxFP32x0x0x2x2x1x1x1x0;miopenConvolutionBwdDataAlgoDirect:ConvOclDirectFwd,4.34302,0,miopenConvolutionBwdDataAlgoDirect,128x16x16x3x3x64x34x34x128xNCHWxFP32x0x0x2x2x1x1x1x0
128-16-16-3x3-64-34-34-128-0x0-2x2-1x1-0-NCHW-FP32-W=miopenConvolutionBwdWeightsAlgoWinograd:ConvWinograd3x3MultipassWrW<3-2>,2.53279,158105600,miopenConvolutionBwdWeightsAlgoWinograd,128x16x16x3x3x64x34x34x128xNCHWxFP32x0x0x2x2x1x1x1x0;miopenConvolutionBwdWeightsAlgoGEMM:gemm,12.9843,589824,rocBlas,<unused>;miopenConvolutionBwdWeightsAlgoDirect:ConvOclBwdWrW2NonTunable,5.97021,37748736,miopenConvolutionBwdWeightsAlgoDirect,128x16x16x3x3x64x34x34x128xNCHWxFP32x0x0x2x2x1x1x1x0
64-32-32-3x3-32-66-66-128-0x0-2x2-1x1-0-NCHW-FP32-B=miopenConvolutionBwdDataAlgoGEMM:gemm,7.5776,1179648,rocBlas,<unused>;miopenConvolutionBwdDataAlgoWinograd:ConvBinWinogradRxS,1.45039,0,miopenConvolutionBwdDataAlgoWinograd,64x32x32x3x3x32x66x66x128xNCHWxFP32x0x0x2x2x1x1x1x0;miopenConvolutionBwdDataAlgoDirect:ConvOclDirectFwd,3.57119,0,miopenConvolutionBwdDataAlgoDirect,64x32x32x3x3x32x66x66x128xNCHWxFP32x0x0x2x2x1x1x1x0
64-32-32-3x3-32-66-66-128-0x0-2x2-1x1-0-NCHW-FP32-W=miopenConvolutionBwdWeightsAlgoWinograd:ConvWinograd3x3MultipassWrW<3-3>,3.47439,291823616,miopenConvolutionBwdWeightsAlgoWinograd,64x32x32x3x3x32x66x66x128xNCHWxFP32x0x0x2x2x1x1x1x0;miopenConvolutionBwdWeightsAlgoGEMM:gemm,20.6643,1179648,rocBlas,<unused>;miopenConvolutionBwdWeightsAlgoDirect:ConvOclBwdWrW2NonTunable,4.17246,9437184,miopenConvolutionBwdWeightsAlgoDirect,64x32x32x3x3x32x66x66x128xNCHWxFP32x0x0x2x2x1x1x1x0
32-64-64-9x9-3-72-72-128-0x0-1x1-1x1-0-NCHW-FP32-W=miopenConvolutionBwdWeightsAlgoWinograd:ConvBinWinogradRxS,63.0511,0,miopenConvolutionBwdWeightsAlgoWinograd,32x64x64x9x9x3x72x72x128xNCHWxFP32x0x0x1x1x1x1x1x0;miopenConvolutionBwdWeightsAlgoGEMM:gemm,26.8696,3981312,rocBlas,<unused>;miopenConvolutionBwdWeightsAlgoDirect:ConvOclBwdWrW2<2>,1.86735,1990656,miopenConvolutionBwdWeightsAlgoDirect,32x64x64x9x9x3x72x72x128xNCHWxFP32x0x0x1x1x1x1x1x0
3-64-64-4x4-64-32-32-128-1x1-2x2-1x1-0-NCHW-FP32-F=miopenConvolutionFwdAlgoGEMM:gemm,5.16096,196608,rocBlas,<unused>
64-32-32-4x4-128-16-16-128-1x1-2x2-1x1-0-NCHW-FP32-F=miopenConvolutionFwdAlgoWinograd:ConvBinWinogradRxS,1.11824,0,miopenConvolutionFwdAlgoWinograd,64x32x32x4x4x128x16x16x128xNCHWxFP32x1x1x2x2x1x1x1x1;miopenConvolutionFwdAlgoGEMM:gemm,8.47872,1048576,rocBlas,<unused>
128-16-16-4x4-256-8-8-128-1x1-2x2-1x1-0-NCHW-FP32-F=miopenConvolutionFwdAlgoWinograd:ConvBinWinogradRxS,1.2384,0,miopenConvolutionFwdAlgoWinograd,128x16x16x4x4x256x8x8x128xNCHWxFP32x1x1x2x2x1x1x1x1;miopenConvolutionFwdAlgoGEMM:gemm,10.5472,524288,rocBlas,<unused>
256-8-8-4x4-512-4-4-128-1x1-2x2-1x1-0-NCHW-FP32-F=miopenConvolutionFwdAlgoWinograd:ConvBinWinogradRxS,1.42576,0,miopenConvolutionFwdAlgoWinograd,256x8x8x4x4x512x4x4x128xNCHWxFP32x1x1x2x2x1x1x1x1;miopenConvolutionFwdAlgoGEMM:gemm,18.7392,262144,rocBlas,<unused>
512-4-4-4x4-1-1-1-128-0x0-1x1-1x1-0-NCHW-FP32-F=miopenConvolutionFwdAlgoWinograd:ConvBinWinogradRxSf3x2,0.42848,0,miopenConvolutionFwdAlgoWinograd,512x4x4x4x4x1x1x1x128xNCHWxFP32x0x0x1x1x1x1x1x1;miopenConvolutionFwdAlgoGEMM:gemm,11.305,32768,rocBlas,<unused>
1-1-1-4x4-512-4-4-128-0x0-1x1-1x1-0-NCHW-FP32-B=miopenConvolutionBwdDataAlgoGEMM:gemm,3.52256,32768,rocBlas,<unused>
1-1-1-4x4-512-4-4-128-0x0-1x1-1x1-0-NCHW-FP32-W=miopenConvolutionBwdWeightsAlgoWinograd:ConvBinWinogradRxS,0.11664,0,miopenConvolutionBwdWeightsAlgoWinograd,1x1x1x4x4x512x4x4x128xNCHWxFP32x0x0x1x1x1x1x1x0;miopenConvolutionBwdWeightsAlgoGEMM:gemm,3.8912,32768,rocBlas,<unused>;miopenConvolutionBwdWeightsAlgoDirect:ConvOclBwdWrW53,0.18688,4194304,miopenConvolutionBwdWeightsAlgoDirect,1x1x1x4x4x512x4x4x128xNCHWxFP32x0x0x1x1x1x1x1x0
512-4-4-4x4-256-8-8-128-1x1-2x2-1x1-0-NCHW-FP32-B=miopenConvolutionBwdDataAlgoGEMM:gemm,7.3728,262144,rocBlas,<unused>;miopenConvolutionBwdDataAlgoWinograd:ConvBinWinogradRxS,2.08528,0,miopenConvolutionBwdDataAlgoWinograd,512x4x4x4x4x256x8x8x128xNCHWxFP32x1x1x2x2x1x1x1x0
512-4-4-4x4-256-8-8-128-1x1-2x2-1x1-0-NCHW-FP32-W=miopenConvolutionBwdWeightsAlgoGEMM:gemm,8.99072,262144,rocBlas,<unused>
256-8-8-4x4-128-16-16-128-1x1-2x2-1x1-0-NCHW-FP32-B=miopenConvolutionBwdDataAlgoGEMM:gemm,9.50272,524288,rocBlas,<unused>;miopenConvolutionBwdDataAlgoWinograd:ConvBinWinogradRxS,1.76848,0,miopenConvolutionBwdDataAlgoWinograd,256x8x8x4x4x128x16x16x128xNCHWxFP32x1x1x2x2x1x1x1x0
256-8-8-4x4-128-16-16-128-1x1-2x2-1x1-0-NCHW-FP32-W=miopenConvolutionBwdWeightsAlgoDirect:ConvOclBwdWrW2<4>,8.58912,67108864,miopenConvolutionBwdWeightsAlgoDirect,256x8x8x4x4x128x16x16x128xNCHWxFP32x1x1x2x2x1x1x1x0;miopenConvolutionBwdWeightsAlgoGEMM:gemm,12.6566,524288,rocBlas,<unused>
128-16-16-4x4-64-32-32-128-1x1-2x2-1x1-0-NCHW-FP32-B=miopenConvolutionBwdDataAlgoGEMM:gemm,7.76192,1048576,rocBlas,<unused>;miopenConvolutionBwdDataAlgoWinograd:ConvBinWinogradRxS,1.24944,0,miopenConvolutionBwdDataAlgoWinograd,128x16x16x4x4x64x32x32x128xNCHWxFP32x1x1x2x2x1x1x1x0
128-16-16-4x4-64-32-32-128-1x1-2x2-1x1-0-NCHW-FP32-W=miopenConvolutionBwdWeightsAlgoDirect:ConvOclBwdWrW2<4>,5.47216,16777216,miopenConvolutionBwdWeightsAlgoDirect,128x16x16x4x4x64x32x32x128xNCHWxFP32x1x1x2x2x1x1x1x0;miopenConvolutionBwdWeightsAlgoGEMM:gemm,19.0464,1048576,rocBlas,<unused>
64-32-32-4x4-3-64-64-128-1x1-2x2-1x1-0-NCHW-FP32-W=miopenConvolutionBwdWeightsAlgoDirect:ConvOclBwdWrW2<1>,0.43232,1572864,miopenConvolutionBwdWeightsAlgoDirect,64x32x32x4x4x3x64x64x128xNCHWxFP32x1x1x2x2x1x1x1x0;miopenConvolutionBwdWeightsAlgoGEMM:gemm,9.74848,196608,rocBlas,<unused>
100-1-1-4x4-512-4-4-128-0x0-1x1-1x1-0-NCHW-FP32-B=miopenConvolutionBwdDataAlgoGEMM:gemm,4.89472,32768,rocBlas,<unused>;miopenConvolutionBwdDataAlgoWinograd:ConvBinWinogradRxSf3x2,0.49712,0,miopenConvolutionBwdDataAlgoWinograd,100x1x1x4x4x512x4x4x128xNCHWxFP32x0x0x1x1x1x1x1x0
64-32-32-4x4-3-64-64-128-1x1-2x2-1x1-0-NCHW-FP32-B=miopenConvolutionBwdDataAlgoGEMM:gemm,5.46816,196608,rocBlas,<unused>;miopenConvolutionBwdDataAlgoWinograd:ConvBinWinogradRxS,0.6752,0,miopenConvolutionBwdDataAlgoWinograd,64x32x32x4x4x3x64x64x128xNCHWxFP32x1x1x2x2x1x1x1x0
100-1-1-4x4-512-4-4-128-0x0-1x1-1x1-0-NCHW-FP32-W=miopenConvolutionBwdWeightsAlgoWinograd:ConvBinWinogradRxS,0.1872,0,miopenConvolutionBwdWeightsAlgoWinograd,100x1x1x4x4x512x4x4x128xNCHWxFP32x0x0x1x1x1x1x1x0;miopenConvolutionBwdWeightsAlgoGEMM:gemm,12.5747,32768,rocBlas,<unused>;miopenConvolutionBwdWeightsAlgoDirect:ConvOclBwdWrW53,0.24752,0,miopenConvolutionBwdWeightsAlgoDirect,100x1x1x4x4x512x4x4x128xNCHWxFP32x0x0x1x1x1x1x1x0
3-224-224-7x7-64-112-112-64-3x3-2x2-1x1-0-NCHW-FP32-F=miopenConvolutionFwdAlgoDirect:ConvAsm7x7c3h224w224k64u2v2p3q3f1,2.13936,0,miopenConvolutionFwdAlgoDirect,3x224x224x7x7x64x112x112x64xNCHWxFP32x3x3x2x2x1x1x1x1;miopenConvolutionFwdAlgoGEMM:gemm,5.67296,7375872,rocBlas,<unused>;miopenConvolutionFwdAlgoWinograd:ConvBinWinogradRxS,2.65984,0,miopenConvolutionFwdAlgoWinograd,3x224x224x7x7x64x112x112x64xNCHWxFP32x3x3x2x2x1x1x1x1
64-56-56-1x1-64-56-56-64-0x0-1x1-1x1-0-NCHW-FP32-F=miopenConvolutionFwdAlgoDirect:ConvOclDirectFwd1x1,0.21568,0,miopenConvolutionFwdAlgoDirect,64x56x56x1x1x64x56x56x64xNCHWxFP32x0x0x1x1x1x1x1x1;miopenConvolutionFwdAlgoGEMM:gemm,0.2072,0,rocBlas,<unused>;miopenConvolutionFwdAlgoStaticCompiledGEMM:ConvSCGemmFwd<SCGemmOpFGemm>,0.33888,1605632,miopenConvolutionFwdAlgoStaticCompiledGEMM,64x56x56x1x1x64x56x56x64xNCHWxFP32x0x0x1x1x1x1x1x1;miopenConvolutionFwdAlgoImplicitGEMM:ConvHipImplicitGemmV4Fwd,0.2488,0,miopenConvolutionFwdAlgoImplicitGEMM,64x56x56x1x1x64x56x56x64xNCHWxFP32x0x0x1x1x1x1x1x1;miopenConvolutionFwdAlgoWinograd:ConvBinWinogradRxSf3x2,0.48272,0,miopenConvolutionFwdAlgoWinograd,64x56x56x1x1x64x56x56x64xNCHWxFP32x0x0x1x1x1x1x1x1
64-56-56-3x3-64-56-56-64-1x1-1x1-1x1-0-NCHW-FP32-F=miopenConvolutionFwdAlgoWinograd:ConvBinWinograd3x3U,0.83664,0,miopenConvolutionFwdAlgoWinograd,64x56x56x3x3x64x56x56x64xNCHWxFP32x1x1x1x1x1x1x1x1
64-56-56-1x1-256-56-56-64-0x0-1x1-1x1-0-NCHW-FP32-F=miopenConvolutionFwdAlgoDirect:ConvAsm1x1U,0.83424,0,miopenConvolutionFwdAlgoDirect,64x56x56x1x1x256x56x56x64xNCHWxFP32x0x0x1x1x1x1x1x1;miopenConvolutionFwdAlgoGEMM:gemm,0.70752,0,rocBlas,<unused>;miopenConvolutionFwdAlgoStaticCompiledGEMM:ConvSCGemmFwd<SCGemmOpFGemm>,1.05888,1605632,miopenConvolutionFwdAlgoStaticCompiledGEMM,64x56x56x1x1x256x56x56x64xNCHWxFP32x0x0x1x1x1x1x1x1;miopenConvolutionFwdAlgoImplicitGEMM:ConvHipImplicitGemmV4Fwd,0.936,0,miopenConvolutionFwdAlgoImplicitGEMM,64x56x56x1x1x256x56x56x64xNCHWxFP32x0x0x1x1x1x1x1x1;miopenConvolutionFwdAlgoWinograd:ConvBinWinogradRxSf3x2,1.77088,0,miopenConvolutionFwdAlgoWinograd,64x56x56x1x1x256x56x56x64xNCHWxFP32x0x0x1x1x1x1x1x1
256-56-56-1x1-64-56-56-64-0x0-1x1-1x1-0-NCHW-FP32-F=miopenConvolutionFwdAlgoDirect:ConvOclDirectFwd1x1,0.80112,0,miopenConvolutionFwdAlgoDirect,256x56x56x1x1x64x56x56x64xNCHWxFP32x0x0x1x1x1x1x1x1;miopenConvolutionFwdAlgoGEMM:gemm,0.66624,0,rocBlas,<unused>;miopenConvolutionFwdAlgoStaticCompiledGEMM:ConvSCGemmFwd<SCGemmOpFGemm>,1.08704,1605632,miopenConvolutionFwdAlgoStaticCompiledGEMM,256x56x56x1x1x64x56x56x64xNCHWxFP32x0x0x1x1x1x1x1x1;miopenConvolutionFwdAlgoImplicitGEMM:ConvHipImplicitGemmV4Fwd,0.85712,0,miopenConvolutionFwdAlgoImplicitGEMM,256x56x56x1x1x64x56x56x64xNCHWxFP32x0x0x1x1x1x1x1x1;miopenConvolutionFwdAlgoWinograd:ConvBinWinogradRxSf3x2,1.51872,0,miopenConvolutionFwdAlgoWinograd,256x56x56x1x1x64x56x56x64xNCHWxFP32x0x0x1x1x1x1x1x1
256-56-56-1x1-128-56-56-64-0x0-1x1-1x1-0-NCHW-FP32-F=miopenConvolutionFwdAlgoDirect:ConvAsm1x1U,1.37888,0,miopenConvolutionFwdAlgoDirect,256x56x56x1x1x128x56x56x64xNCHWxFP32x0x0x1x1x1x1x1x1;miopenConvolutionFwdAlgoGEMM:gemm,1.13584,0,rocBlas,<unused>;miopenConvolutionFwdAlgoStaticCompiledGEMM:ConvSCGemmFwd<SCGemmOpFGemm>,1.44608,1605632,miopenConvolutionFwdAlgoStaticCompiledGEMM,256x56x56x1x1x128x56x56x64xNCHWxFP32x0x0x1x1x1x1x1x1;miopenConvolutionFwdAlgoImplicitGEMM:ConvHipImplicitGemmV4_1x1,1.5104,0,miopenConvolutionFwdAlgoImplicitGEMM,256x56x56x1x1x128x56x56x64xNCHWxFP32x0x0x1x1x1x1x1x1;miopenConvolutionFwdAlgoWinograd:ConvBinWinogradRxSf3x2,2.56256,0,miopenConvolutionFwdAlgoWinograd,256x56x56x1x1x128x56x56x64xNCHWxFP32x0x0x1x1x1x1x1x1
128-56-56-3x3-128-28-28-64-1x1-2x2-1x1-0-NCHW-FP32-F=miopenConvolutionFwdAlgoDirect:ConvOclDirectFwdGen,10.4773,0,miopenConvolutionFwdAlgoDirect,128x56x56x3x3x128x28x28x64xNCHWxFP32x1x1x2x2x1x1x1x1;miopenConvolutionFwdAlgoGEMM:gemm,8.81664,3612672,rocBlas,<unused>;miopenConvolutionFwdAlgoWinograd:ConvBinWinogradRxS,3.12432,0,miopenConvolutionFwdAlgoWinograd,128x56x56x3x3x128x28x28x64xNCHWxFP32x1x1x2x2x1x1x1x1
128-28-28-1x1-512-28-28-64-0x0-1x1-1x1-0-NCHW-FP32-F=miopenConvolutionFwdAlgoDirect:ConvAsm1x1U,1.13776,0,miopenConvolutionFwdAlgoDirect,128x28x28x1x1x512x28x28x64xNCHWxFP32x0x0x1x1x1x1x1x1;miopenConvolutionFwdAlgoGEMM:gemm,0.71024,0,rocBlas,<unused>;miopenConvolutionFwdAlgoStaticCompiledGEMM:ConvSCGemmFwd<SCGemmOpFGemm>,0.79136,401408,miopenConvolutionFwdAlgoStaticCompiledGEMM,128x28x28x1x1x512x28x28x64xNCHWxFP32x0x0x1x1x1x1x1x1;miopenConvolutionFwdAlgoImplicitGEMM:ConvHipImplicitGemmV4Fwd,0.77936,0,miopenConvolutionFwdAlgoImplicitGEMM,128x28x28x1x1x512x28x28x64xNCHWxFP32x0x0x1x1x1x1x1x1;miopenConvolutionFwdAlgoWinograd:ConvBinWinogradRxSf3x2,1.80976,0,miopenConvolutionFwdAlgoWinograd,128x28x28x1x1x512x28x28x64xNCHWxFP32x0x0x1x1x1x1x1x1
256-56-56-1x1-512-28-28-64-0x0-2x2-1x1-0-NCHW-FP32-F=miopenConvolutionFwdAlgoDirect:ConvAsm1x1U,2.17584,51380224,miopenConvolutionFwdAlgoDirect,256x56x56x1x1x512x28x28x64xNCHWxFP32x0x0x2x2x1x1x1x1;miopenConvolutionFwdAlgoGEMM:gemm,1.83936,154140672,rocBlas,<unused>;miopenConvolutionFwdAlgoImplicitGEMM:ConvHipImplicitGemmV4_1x1,1.6096,0,miopenConvolutionFwdAlgoImplicitGEMM,256x56x56x1x1x512x28x28x64xNCHWxFP32x0x0x2x2x1x1x1x1;miopenConvolutionFwdAlgoWinograd:ConvBinWinogradRxS,11.4139,0,miopenConvolutionFwdAlgoWinograd,256x56x56x1x1x512x28x28x64xNCHWxFP32x0x0x2x2x1x1x1x1
512-28-28-1x1-128-28-28-64-0x0-1x1-1x1-0-NCHW-FP32-F=miopenConvolutionFwdAlgoDirect:ConvAsm1x1U,1.02032,0,miopenConvolutionFwdAlgoDirect,512x28x28x1x1x128x28x28x64xNCHWxFP32x0x0x1x1x1x1x1x1;miopenConvolutionFwdAlgoGEMM:gemm,0.6992,0,rocBlas,<unused>;miopenConvolutionFwdAlgoStaticCompiledGEMM:ConvSCGemmFwd<SCGemmOpFGemm>,0.79584,401408,miopenConvolutionFwdAlgoStaticCompiledGEMM,512x28x28x1x1x128x28x28x64xNCHWxFP32x0x0x1x1x1x1x1x1;miopenConvolutionFwdAlgoImplicitGEMM:ConvHipImplicitGemmV4_1x1,0.90992,0,miopenConvolutionFwdAlgoImplicitGEMM,512x28x28x1x1x128x28x28x64xNCHWxFP32x0x0x1x1x1x1x1x1;miopenConvolutionFwdAlgoWinograd:ConvBinWinogradRxSf3x2,1.63872,0,miopenConvolutionFwdAlgoWinograd,512x28x28x1x1x128x28x28x64xNCHWxFP32x0x0x1x1x1x1x1x1
128-28-28-3x3-128-28-28-64-1x1-1x1-1x1-0-NCHW-FP32-F=miopenConvolutionFwdAlgoWinograd:ConvBinWinogradRxS,0.79968,0,miopenConvolutionFwdAlgoWinograd,128x28x28x3x3x128x28x28x64xNCHWxFP32x1x1x1x1x1x1x1x1
512-28-28-1x1-256-28-28-64-0x0-1x1-1x1-0-NCHW-FP32-F=miopenConvolutionFwdAlgoDirect:ConvAsm1x1U,2.24576,0,miopenConvolutionFwdAlgoDirect,512x28x28x1x1x256x28x28x64xNCHWxFP32x0x0x1x1x1x1x1x1;miopenConvolutionFwdAlgoGEMM:gemm,1.18192,0,rocBlas,<unused>;miopenConvolutionFwdAlgoStaticCompiledGEMM:ConvSCGemmFwd<SCGemmOpFGemm>,1.47568,401408,miopenConvolutionFwdAlgoStaticCompiledGEMM,512x28x28x1x1x256x28x28x64xNCHWxFP32x0x0x1x1x1x1x1x1;miopenConvolutionFwdAlgoImplicitGEMM:ConvHipImplicitGemmV4_1x1,1.58128,0,miopenConvolutionFwdAlgoImplicitGEMM,512x28x28x1x1x256x28x28x64xNCHWxFP32x0x0x1x1x1x1x1x1;miopenConvolutionFwdAlgoWinograd:ConvBinWinogradRxSf3x2,2.80656,0,miopenConvolutionFwdAlgoWinograd,512x28x28x1x1x256x28x28x64xNCHWxFP32x0x0x1x1x1x1x1x1
256-28-28-3x3-256-14-14-64-1x1-2x2-1x1-0-NCHW-FP32-F=miopenConvolutionFwdAlgoDirect:ConvOclDirectFwd,6.92048,0,miopenConvolutionFwdAlgoDirect,256x28x28x3x3x256x14x14x64xNCHWxFP32x1x1x2x2x1x1x1x1;miopenConvolutionFwdAlgoGEMM:gemm,7.17824,1806336,rocBlas,<unused>;miopenConvolutionFwdAlgoWinograd:ConvBinWinogradRxS,3.22272,0,miopenConvolutionFwdAlgoWinograd,256x28x28x3x3x256x14x14x64xNCHWxFP32x1x1x2x2x1x1x1x1
256-14-14-1x1-1024-14-14-64-0x0-1x1-1x1-0-NCHW-FP32-F=miopenConvolutionFwdAlgoDirect:ConvAsm1x1U,1.16416,0,miopenConvolutionFwdAlgoDirect,256x14x14x1x1x1024x14x14x64xNCHWxFP32x0x0x1x1x1x1x1x1;miopenConvolutionFwdAlgoGEMM:gemm,0.97968,64225280,rocBlas,<unused>;miopenConvolutionFwdAlgoStaticCompiledGEMM:ConvSCGemmFwd<SCGemmOpFGemm>,0.75936,100352,miopenConvolutionFwdAlgoStaticCompiledGEMM,256x14x14x1x1x1024x14x14x64xNCHWxFP32x0x0x1x1x1x1x1x1;miopenConvolutionFwdAlgoImplicitGEMM:ConvHipImplicitGemmV4Fwd,0.79776,0,miopenConvolutionFwdAlgoImplicitGEMM,256x14x14x1x1x1024x14x14x64xNCHWxFP32x0x0x1x1x1x1x1x1;miopenConvolutionFwdAlgoWinograd:ConvBinWinogradRxSf3x2,1.6624,0,miopenConvolutionFwdAlgoWinograd,256x14x14x1x1x1024x14x14x64xNCHWxFP32x0x0x1x1x1x1x1x1
512-28-28-1x1-1024-14-14-64-0x0-2x2-1x1-0-NCHW-FP32-F=miopenConvolutionFwdAlgoDirect:ConvAsm1x1U,2.37072,25690112,miopenConvolutionFwdAlgoDirect,512x28x28x1x1x1024x14x14x64xNCHWxFP32x0x0x2x2x1x1x1x1;miopenConvolutionFwdAlgoGEMM:gemm,1.63888,77070336,rocBlas,<unused>;miopenConvolutionFwdAlgoImplicitGEMM:ConvHipImplicitGemmV4_1x1,1.684,0,miopenConvolutionFwdAlgoImplicitGEMM,512x28x28x1x1x1024x14x14x64xNCHWxFP32x0x0x2x2x1x1x1x1;miopenConvolutionFwdAlgoWinograd:ConvBinWinogradRxS,11.3931,0,miopenConvolutionFwdAlgoWinograd,512x28x28x1x1x1024x14x14x64xNCHWxFP32x0x0x2x2x1x1x1x1
1024-14-14-1x1-256-14-14-64-0x0-1x1-1x1-0-NCHW-FP32-F=miopenConvolutionFwdAlgoDirect:ConvAsm1x1U,1.16048,0,miopenConvolutionFwdAlgoDirect,1024x14x14x1x1x256x14x14x64xNCHWxFP32x0x0x1x1x1x1x1x1;miopenConvolutionFwdAlgoGEMM:gemm,1.15216,64225280,rocBlas,<unused>;miopenConvolutionFwdAlgoStaticCompiledGEMM:ConvSCGemmFwd<SCGemmOpFGemm>,0.98896,100352,miopenConvolutionFwdAlgoStaticCompiledGEMM,1024x14x14x1x1x256x14x14x64xNCHWxFP32x0x0x1x1x1x1x1x1;miopenConvolutionFwdAlgoImplicitGEMM:ConvHipImplicitGemmV4Fwd,1.1648,0,miopenConvolutionFwdAlgoImplicitGEMM,1024x14x14x1x1x256x14x14x64xNCHWxFP32x0x0x1x1x1x1x1x1;miopenConvolutionFwdAlgoWinograd:ConvBinWinogradRxSf3x2,1.86416,0,miopenConvolutionFwdAlgoWinograd,1024x14x14x1x1x256x14x14x64xNCHWxFP32x0x0x1x1x1x1x1x1
256-14-14-3x3-256-14-14-64-1x1-1x1-1x1-0-NCHW-FP32-F=miopenConvolutionFwdAlgoWinograd:ConvBinWinogradRxS,0.79808,0,miopenConvolutionFwdAlgoWinograd,256x14x14x3x3x256x14x14x64xNCHWxFP32x1x1x1x1x1x1x1x1
1024-14-14-1x1-512-14-14-64-0x0-1x1-1x1-0-NCHW-FP32-F=miopenConvolutionFwdAlgoDirect:ConvAsm1x1U,2.10832,0,miopenConvolutionFwdAlgoDirect,1024x14x14x1x1x512x14x14x64xNCHWxFP32x0x0x1x1x1x1x1x1;miopenConvolutionFwdAlgoGEMM:gemm,1.51824,77070336,rocBlas,<unused>;miopenConvolutionFwdAlgoStaticCompiledGEMM:ConvSCGemmFwd<SCGemmOpFGemm>,1.63696,100352,miopenConvolutionFwdAlgoStaticCompiledGEMM,1024x14x14x1x1x512x14x14x64xNCHWxFP32x0x0x1x1x1x1x1x1;miopenConvolutionFwdAlgoImplicitGEMM:ConvHipImplicitGemmV4Fwd,1.81296,0,miopenConvolutionFwdAlgoImplicitGEMM,1024x14x14x1x1x512x14x14x64xNCHWxFP32x0x0x1x1x1x1x1x1;miopenConvolutionFwdAlgoWinograd:ConvBinWinogradRxSf3x2,2.92864,0,miopenConvolutionFwdAlgoWinograd,1024x14x14x1x1x512x14x14x64xNCHWxFP32x0x0x1x1x1x1x1x1
512-14-14-3x3-512-7-7-64-1x1-2x2-1x1-0-NCHW-FP32-F=miopenConvolutionFwdAlgoDirect:ConvOclDirectFwd,8.63104,0,miopenConvolutionFwdAlgoDirect,512x14x14x3x3x512x7x7x64xNCHWxFP32x1x1x2x2x1x1x1x1;miopenConvolutionFwdAlgoGEMM:gemm,24.2381,903168,rocBlas,<unused>;miopenConvolutionFwdAlgoWinograd:ConvBinWinogradRxS,4.1936,0,miopenConvolutionFwdAlgoWinograd,512x14x14x3x3x512x7x7x64xNCHWxFP32x1x1x2x2x1x1x1x1
512-7-7-1x1-2048-7-7-64-0x0-1x1-1x1-0-NCHW-FP32-F=miopenConvolutionFwdAlgoDirect:ConvAsm1x1U,1.34656,0,miopenConvolutionFwdAlgoDirect,512x7x7x1x1x2048x7x7x64xNCHWxFP32x0x0x1x1x1x1x1x1;miopenConvolutionFwdAlgoGEMM:gemm,0.80288,32112640,rocBlas,<unused>;miopenConvolutionFwdAlgoStaticCompiledGEMM:ConvSCGemmFwd<SCGemmOpFGemm>,1.07296,26624,miopenConvolutionFwdAlgoStaticCompiledGEMM,512x7x7x1x1x2048x7x7x64xNCHWxFP32x0x0x1x1x1x1x1x1;miopenConvolutionFwdAlgoImplicitGEMM:ConvHipImplicitGemmV4Fwd,1.34,0,miopenConvolutionFwdAlgoImplicitGEMM,512x7x7x1x1x2048x7x7x64xNCHWxFP32x0x0x1x1x1x1x1x1;miopenConvolutionFwdAlgoWinograd:ConvBinWinogradRxSf3x2,2.32048,0,miopenConvolutionFwdAlgoWinograd,512x7x7x1x1x2048x7x7x64xNCHWxFP32x0x0x1x1x1x1x1x1
1024-14-14-1x1-2048-7-7-64-0x0-2x2-1x1-0-NCHW-FP32-F=miopenConvolutionFwdAlgoDirect:ConvAsm1x1U,2.91856,12845056,miopenConvolutionFwdAlgoDirect,1024x14x14x1x1x2048x7x7x64xNCHWxFP32x0x0x2x2x1x1x1x1;miopenConvolutionFwdAlgoGEMM:gemm,1.64656,38535168,rocBlas,<unused>;miopenConvolutionFwdAlgoImplicitGEMM:ConvHipImplicitGemmV4Fwd,3.596,0,miopenConvolutionFwdAlgoImplicitGEMM,1024x14x14x1x1x2048x7x7x64xNCHWxFP32x0x0x2x2x1x1x1x1;miopenConvolutionFwdAlgoWinograd:ConvBinWinogradRxS,14.5565,0,miopenConvolutionFwdAlgoWinograd,1024x14x14x1x1x2048x7x7x64xNCHWxFP32x0x0x2x2x1x1x1x1
2048-7-7-1x1-512-7-7-64-0x0-1x1-1x1-0-NCHW-FP32-F=miopenConvolutionFwdAlgoDirect:ConvAsm1x1U,1.31664,0,miopenConvolutionFwdAlgoDirect,2048x7x7x1x1x512x7x7x64xNCHWxFP32x0x0x1x1x1x1x1x1;miopenConvolutionFwdAlgoGEMM:gemm,1.048,32112640,rocBlas,<unused>;miopenConvolutionFwdAlgoStaticCompiledGEMM:ConvSCGemmFwd<SCGemmOpFGemm>,1.02544,26624,miopenConvolutionFwdAlgoStaticCompiledGEMM,2048x7x7x1x1x512x7x7x64xNCHWxFP32x0x0x1x1x1x1x1x1;miopenConvolutionFwdAlgoImplicitGEMM:ConvHipImplicitGemmV4Fwd,1.04368,0,miopenConvolutionFwdAlgoImplicitGEMM,2048x7x7x1x1x512x7x7x64xNCHWxFP32x0x0x1x1x1x1x1x1;miopenConvolutionFwdAlgoWinograd:ConvBinWinogradRxSf3x2,2.2528,0,miopenConvolutionFwdAlgoWinograd,2048x7x7x1x1x512x7x7x64xNCHWxFP32x0x0x1x1x1x1x1x1
512-7-7-3x3-512-7-7-64-1x1-1x1-1x1-0-NCHW-FP32-F=miopenConvolutionFwdAlgoWinograd:ConvBinWinograd3x3U,1.01104,0,miopenConvolutionFwdAlgoWinograd,512x7x7x3x3x512x7x7x64xNCHWxFP32x1x1x1x1x1x1x1x1
2048-7-7-1x1-512-7-7-64-0x0-1x1-1x1-0-NCHW-FP32-B=miopenConvolutionBwdDataAlgoGEMM:gemm,1.2536,0,rocBlas,<unused>;miopenConvolutionBwdDataAlgoWinograd:ConvBinWinogradRxSf3x2,2.38912,0,miopenConvolutionBwdDataAlgoWinograd,2048x7x7x1x1x512x7x7x64xNCHWxFP32x0x0x1x1x1x1x1x0;miopenConvolutionBwdDataAlgoDirect:ConvAsm1x1U,1.1584,0,miopenConvolutionBwdDataAlgoDirect,2048x7x7x1x1x512x7x7x64xNCHWxFP32x0x0x1x1x1x1x1x0
2048-7-7-1x1-512-7-7-64-0x0-1x1-1x1-0-NCHW-FP32-W=miopenConvolutionBwdWeightsAlgoWinograd:ConvBinWinogradRxS,4.18,0,miopenConvolutionBwdWeightsAlgoWinograd,2048x7x7x1x1x512x7x7x64xNCHWxFP32x0x0x1x1x1x1x1x0;miopenConvolutionBwdWeightsAlgoGEMM:gemm,2.56448,0,rocBlas,<unused>;miopenConvolutionBwdWeightsAlgoDirect:ConvAsmBwdWrW1x1,1.18768,0,miopenConvolutionBwdWeightsAlgoDirect,2048x7x7x1x1x512x7x7x64xNCHWxFP32x0x0x1x1x1x1x1x0
512-7-7-3x3-512-7-7-64-1x1-1x1-1x1-0-NCHW-FP32-B=miopenConvolutionBwdDataAlgoWinograd:ConvBinWinogradRxS,0.999999,0,miopenConvolutionBwdDataAlgoWinograd,512x7x7x3x3x512x7x7x64xNCHWxFP32x1x1x1x1x1x1x1x0
512-7-7-3x3-512-7-7-64-1x1-1x1-1x1-0-NCHW-FP32-W=miopenConvolutionBwdWeightsAlgoWinograd:ConvBinWinogradRxS,1.03296,0,miopenConvolutionBwdWeightsAlgoWinograd,512x7x7x3x3x512x7x7x64xNCHWxFP32x1x1x1x1x1x1x1x0;miopenConvolutionBwdWeightsAlgoGEMM:gemm,9.18528,903168,rocBlas,<unused>;miopenConvolutionBwdWeightsAlgoDirect:ConvAsmBwdWrW3x3,1.62192,0,miopenConvolutionBwdWeightsAlgoDirect,512x7x7x3x3x512x7x7x64xNCHWxFP32x1x1x1x1x1x1x1x0
512-7-7-1x1-2048-7-7-64-0x0-1x1-1x1-0-NCHW-FP32-B=miopenConvolutionBwdDataAlgoGEMM:gemm,0.896,0,rocBlas,<unused>;miopenConvolutionBwdDataAlgoWinograd:ConvBinWinogradRxSf3x2,2.48368,0,miopenConvolutionBwdDataAlgoWinograd,512x7x7x1x1x2048x7x7x64xNCHWxFP32x0x0x1x1x1x1x1x0;miopenConvolutionBwdDataAlgoDirect:ConvAsm1x1U,0.84128,0,miopenConvolutionBwdDataAlgoDirect,512x7x7x1x1x2048x7x7x64xNCHWxFP32x0x0x1x1x1x1x1x0
512-7-7-1x1-2048-7-7-64-0x0-1x1-1x1-0-NCHW-FP32-W=miopenConvolutionBwdWeightsAlgoWinograd:ConvBinWinogradRxS,4.18608,0,miopenConvolutionBwdWeightsAlgoWinograd,512x7x7x1x1x2048x7x7x64xNCHWxFP32x0x0x1x1x1x1x1x0;miopenConvolutionBwdWeightsAlgoGEMM:gemm,2.71712,0,rocBlas,<unused>;miopenConvolutionBwdWeightsAlgoDirect:ConvAsmBwdWrW1x1,1.08256,0,miopenConvolutionBwdWeightsAlgoDirect,512x7x7x1x1x2048x7x7x64xNCHWxFP32x0x0x1x1x1x1x1x0
2048-7-7-1x1-1024-14-14-64-0x0-2x2-1x1-0-NCHW-FP32-B=miopenConvolutionBwdDataAlgoGEMM:gemm,1.76032,38535168,rocBlas,<unused>;miopenConvolutionBwdDataAlgoDirect:ConvAsm1x1UV2,1.94256,0,miopenConvolutionBwdDataAlgoDirect,2048x7x7x1x1x1024x14x14x64xNCHWxFP32x0x0x2x2x1x1x1x0
2048-7-7-1x1-1024-14-14-64-0x0-2x2-1x1-0-NCHW-FP32-W=miopenConvolutionBwdWeightsAlgoDirect:ConvAsmBwdWrW1x1,2.336,12845056,miopenConvolutionBwdWeightsAlgoDirect,2048x7x7x1x1x1024x14x14x64xNCHWxFP32x0x0x2x2x1x1x1x0;miopenConvolutionBwdWeightsAlgoGEMM:gemm,9.28768,200704,rocBlas,<unused>
512-7-7-3x3-512-14-14-64-1x1-2x2-1x1-0-NCHW-FP32-B=miopenConvolutionBwdDataAlgoGEMM:gemm,6.52288,903168,rocBlas,<unused>;miopenConvolutionBwdDataAlgoWinograd:ConvBinWinogradRxS,4.10736,0,miopenConvolutionBwdDataAlgoWinograd,512x7x7x3x3x512x14x14x64xNCHWxFP32x1x1x2x2x1x1x1x0;miopenConvolutionBwdDataAlgoDirect:ConvOclDirectFwd,5.84415,0,miopenConvolutionBwdDataAlgoDirect,512x7x7x3x3x512x14x14x64xNCHWxFP32x1x1x2x2x1x1x1x0
512-7-7-3x3-512-14-14-64-1x1-2x2-1x1-0-NCHW-FP32-W=miopenConvolutionBwdWeightsAlgoWinograd:ConvWinograd3x3MultipassWrW<3-4>,3.51824,169869312,miopenConvolutionBwdWeightsAlgoWinograd,512x7x7x3x3x512x14x14x64xNCHWxFP32x1x1x2x2x1x1x1x0;miopenConvolutionBwdWeightsAlgoGEMM:gemm,6.0928,903168,rocBlas,<unused>;miopenConvolutionBwdWeightsAlgoDirect:ConvAsmBwdWrW3x3,2.58224,0,miopenConvolutionBwdWeightsAlgoDirect,512x7x7x3x3x512x14x14x64xNCHWxFP32x1x1x2x2x1x1x1x0
512-14-14-1x1-1024-14-14-64-0x0-1x1-1x1-0-NCHW-FP32-B=miopenConvolutionBwdDataAlgoGEMM:gemm,1.77056,0,rocBlas,<unused>;miopenConvolutionBwdDataAlgoImplicitGEMM:ConvHipImplicitGemmV4_1x1,1.69328,0,miopenConvolutionBwdDataAlgoImplicitGEMM,512x14x14x1x1x1024x14x14x64xNCHWxFP32x0x0x1x1x1x1x1x0;miopenConvolutionBwdDataAlgoWinograd:ConvBinWinogradRxSf3x2,3.19168,0,miopenConvolutionBwdDataAlgoWinograd,512x14x14x1x1x1024x14x14x64xNCHWxFP32x0x0x1x1x1x1x1x0;miopenConvolutionBwdDataAlgoDirect:ConvAsm1x1U,1.43856,0,miopenConvolutionBwdDataAlgoDirect,512x14x14x1x1x1024x14x14x64xNCHWxFP32x0x0x1x1x1x1x1x0
512-14-14-1x1-1024-14-14-64-0x0-1x1-1x1-0-NCHW-FP32-W=miopenConvolutionBwdWeightsAlgoWinograd:ConvBinWinogradRxS,10.7477,0,miopenConvolutionBwdWeightsAlgoWinograd,512x14x14x1x1x1024x14x14x64xNCHWxFP32x0x0x1x1x1x1x1x0;miopenConvolutionBwdWeightsAlgoGEMM:gemm,3.748,0,rocBlas,<unused>;miopenConvolutionBwdWeightsAlgoDirect:ConvAsmBwdWrW1x1,1.98208,0,miopenConvolutionBwdWeightsAlgoDirect,512x14x14x1x1x1024x14x14x64xNCHWxFP32x0x0x1x1x1x1x1x0
1024-14-14-1x1-256-14-14-64-0x0-1x1-1x1-0-NCHW-FP32-B=miopenConvolutionBwdDataAlgoGEMM:gemm,0.84624,0,rocBlas,<unused>;miopenConvolutionBwdDataAlgoImplicitGEMM:ConvHipImplicitGemmV4_1x1,0.89008,0,miopenConvolutionBwdDataAlgoImplicitGEMM,1024x14x14x1x1x256x14x14x64xNCHWxFP32x0x0x1x1x1x1x1x0;miopenConvolutionBwdDataAlgoWinograd:ConvBinWinogradRxSf3x2,1.8472,0,miopenConvolutionBwdDataAlgoWinograd,1024x14x14x1x1x256x14x14x64xNCHWxFP32x0x0x1x1x1x1x1x0;miopenConvolutionBwdDataAlgoDirect:ConvAsm1x1U,0.97616,0,miopenConvolutionBwdDataAlgoDirect,1024x14x14x1x1x256x14x14x64xNCHWxFP32x0x0x1x1x1x1x1x0
1024-14-14-1x1-256-14-14-64-0x0-1x1-1x1-0-NCHW-FP32-W=miopenConvolutionBwdWeightsAlgoWinograd:ConvBinWinogradRxS,4.98736,0,miopenConvolutionBwdWeightsAlgoWinograd,1024x14x14x1x1x256x14x14x64xNCHWxFP32x0x0x1x1x1x1x1x0;miopenConvolutionBwdWeightsAlgoGEMM:gemm,2.21696,0,rocBlas,<unused>;miopenConvolutionBwdWeightsAlgoDirect:ConvAsmBwdWrW1x1,1.15712,0,miopenConvolutionBwdWeightsAlgoDirect,1024x14x14x1x1x256x14x14x64xNCHWxFP32x0x0x1x1x1x1x1x0
256-14-14-3x3-256-14-14-64-1x1-1x1-1x1-0-NCHW-FP32-B=miopenConvolutionBwdDataAlgoWinograd:ConvBinWinograd3x3U,0.78784,0,miopenConvolutionBwdDataAlgoWinograd,256x14x14x3x3x256x14x14x64xNCHWxFP32x1x1x1x1x1x1x1x0
256-14-14-3x3-256-14-14-64-1x1-1x1-1x1-0-NCHW-FP32-W=miopenConvolutionBwdWeightsAlgoWinograd:ConvWinograd3x3MultipassWrW<3-5>,1.02464,70647808,miopenConvolutionBwdWeightsAlgoWinograd,256x14x14x3x3x256x14x14x64xNCHWxFP32x1x1x1x1x1x1x1x0;miopenConvolutionBwdWeightsAlgoGEMM:gemm,4.608,1806336,rocBlas,<unused>;miopenConvolutionBwdWeightsAlgoDirect:ConvAsmBwdWrW3x3,2.05952,0,miopenConvolutionBwdWeightsAlgoDirect,256x14x14x3x3x256x14x14x64xNCHWxFP32x1x1x1x1x1x1x1x0
256-14-14-1x1-1024-14-14-64-0x0-1x1-1x1-0-NCHW-FP32-B=miopenConvolutionBwdDataAlgoGEMM:gemm,0.83792,0,rocBlas,<unused>;miopenConvolutionBwdDataAlgoImplicitGEMM:ConvHipImplicitGemmV4_1x1,0.81952,0,miopenConvolutionBwdDataAlgoImplicitGEMM,256x14x14x1x1x1024x14x14x64xNCHWxFP32x0x0x1x1x1x1x1x0;miopenConvolutionBwdDataAlgoWinograd:ConvBinWinogradRxSf3x2,1.69184,0,miopenConvolutionBwdDataAlgoWinograd,256x14x14x1x1x1024x14x14x64xNCHWxFP32x0x0x1x1x1x1x1x0;miopenConvolutionBwdDataAlgoDirect:ConvAsm1x1U,0.76224,0,miopenConvolutionBwdDataAlgoDirect,256x14x14x1x1x1024x14x14x64xNCHWxFP32x0x0x1x1x1x1x1x0
256-14-14-1x1-1024-14-14-64-0x0-1x1-1x1-0-NCHW-FP32-W=miopenConvolutionBwdWeightsAlgoWinograd:ConvBinWinogradRxS,5.5464,0,miopenConvolutionBwdWeightsAlgoWinograd,256x14x14x1x1x1024x14x14x64xNCHWxFP32x0x0x1x1x1x1x1x0;miopenConvolutionBwdWeightsAlgoGEMM:gemm,2.50176,0,rocBlas,<unused>;miopenConvolutionBwdWeightsAlgoDirect:ConvAsmBwdWrW1x1,1.2648,0,miopenConvolutionBwdWeightsAlgoDirect,256x14x14x1x1x1024x14x14x64xNCHWxFP32x0x0x1x1x1x1x1x0
1024-14-14-1x1-512-28-28-64-0x0-2x2-1x1-0-NCHW-FP32-B=miopenConvolutionBwdDataAlgoDirect:ConvAsm1x1U,2.0304,25690112,miopenConvolutionBwdDataAlgoDirect,1024x14x14x1x1x512x28x28x64xNCHWxFP32x0x0x2x2x1x1x1x0;miopenConvolutionBwdDataAlgoGEMM:gemm,2.17472,77070336,rocBlas,<unused>;miopenConvolutionBwdDataAlgoImplicitGEMM:ConvHipImplicitGemmV4_1x1,2.29088,0,miopenConvolutionBwdDataAlgoImplicitGEMM,1024x14x14x1x1x512x28x28x64xNCHWxFP32x0x0x2x2x1x1x1x0
1024-14-14-1x1-512-28-28-64-0x0-2x2-1x1-0-NCHW-FP32-W=miopenConvolutionBwdWeightsAlgoDirect:ConvAsmBwdWrW1x1,2.27248,25690112,miopenConvolutionBwdWeightsAlgoDirect,1024x14x14x1x1x512x28x28x64xNCHWxFP32x0x0x2x2x1x1x1x0;miopenConvolutionBwdWeightsAlgoGEMM:gemm,5.26336,401408,rocBlas,<unused>
256-14-14-3x3-256-28-28-64-1x1-2x2-1x1-0-NCHW-FP32-B=miopenConvolutionBwdDataAlgoGEMM:gemm,6.63552,1806336,rocBlas,<unused>;miopenConvolutionBwdDataAlgoWinograd:ConvBinWinogradRxS,3.37552,0,miopenConvolutionBwdDataAlgoWinograd,256x14x14x3x3x256x28x28x64xNCHWxFP32x1x1x2x2x1x1x1x0;miopenConvolutionBwdDataAlgoDirect:ConvOclDirectFwd,4.85456,0,miopenConvolutionBwdDataAlgoDirect,256x14x14x3x3x256x28x28x64xNCHWxFP32x1x1x2x2x1x1x1x0
256-14-14-3x3-256-28-28-64-1x1-2x2-1x1-0-NCHW-FP32-W=miopenConvolutionBwdWeightsAlgoWinograd:ConvWinograd3x3MultipassWrW<3-2>,3.23072,167116800,miopenConvolutionBwdWeightsAlgoWinograd,256x14x14x3x3x256x28x28x64xNCHWxFP32x1x1x2x2x1x1x1x0;miopenConvolutionBwdWeightsAlgoGEMM:gemm,4.83328,1806336,rocBlas,<unused>;miopenConvolutionBwdWeightsAlgoDirect:ConvAsmBwdWrW3x3,2.2888,0,miopenConvolutionBwdWeightsAlgoDirect,256x14x14x3x3x256x28x28x64xNCHWxFP32x1x1x2x2x1x1x1x0
256-28-28-1x1-512-28-28-64-0x0-1x1-1x1-0-NCHW-FP32-B=miopenConvolutionBwdDataAlgoGEMM:gemm,1.38864,0,rocBlas,<unused>;miopenConvolutionBwdDataAlgoImplicitGEMM:ConvHipImplicitGemmV4_1x1,1.496,0,miopenConvolutionBwdDataAlgoImplicitGEMM,256x28x28x1x1x512x28x28x64xNCHWxFP32x0x0x1x1x1x1x1x0;miopenConvolutionBwdDataAlgoWinograd:ConvBinWinogradRxSf3x2,3.26192,0,miopenConvolutionBwdDataAlgoWinograd,256x28x28x1x1x512x28x28x64xNCHWxFP32x0x0x1x1x1x1x1x0;miopenConvolutionBwdDataAlgoDirect:ConvAsm1x1U,1.79536,0,miopenConvolutionBwdDataAlgoDirect,256x28x28x1x1x512x28x28x64xNCHWxFP32x0x0x1x1x1x1x1x0
256-28-28-1x1-512-28-28-64-0x0-1x1-1x1-0-NCHW-FP32-W=miopenConvolutionBwdWeightsAlgoWinograd:ConvBinWinogradRxS,12.6528,0,miopenConvolutionBwdWeightsAlgoWinograd,256x28x28x1x1x512x28x28x64xNCHWxFP32x0x0x1x1x1x1x1x0;miopenConvolutionBwdWeightsAlgoGEMM:gemm,4.77504,0,rocBlas,<unused>;miopenConvolutionBwdWeightsAlgoDirect:ConvAsmBwdWrW1x1,2.1176,0,miopenConvolutionBwdWeightsAlgoDirect,256x28x28x1x1x512x28x28x64xNCHWxFP32x0x0x1x1x1x1x1x0
512-28-28-1x1-128-28-28-64-0x0-1x1-1x1-0-NCHW-FP32-B=miopenConvolutionBwdDataAlgoGEMM:gemm,0.73552,0,rocBlas,<unused>;miopenConvolutionBwdDataAlgoImplicitGEMM:ConvHipImplicitGemmV4_1x1,0.77232,0,miopenConvolutionBwdDataAlgoImplicitGEMM,512x28x28x1x1x128x28x28x64xNCHWxFP32x0x0x1x1x1x1x1x0;miopenConvolutionBwdDataAlgoWinograd:ConvBinWinogradRxSf3x2,1.64336,0,miopenConvolutionBwdDataAlgoWinograd,512x28x28x1x1x128x28x28x64xNCHWxFP32x0x0x1x1x1x1x1x0;miopenConvolutionBwdDataAlgoDirect:ConvAsm1x1U,0.69504,0,miopenConvolutionBwdDataAlgoDirect,512x28x28x1x1x128x28x28x64xNCHWxFP32x0x0x1x1x1x1x1x0
512-28-28-1x1-128-28-28-64-0x0-1x1-1x1-0-NCHW-FP32-W=miopenConvolutionBwdWeightsAlgoWinograd:ConvBinWinogradRxS,6.48784,0,miopenConvolutionBwdWeightsAlgoWinograd,512x28x28x1x1x128x28x28x64xNCHWxFP32x0x0x1x1x1x1x1x0;miopenConvolutionBwdWeightsAlgoGEMM:gemm,3.46752,0,rocBlas,<unused>;miopenConvolutionBwdWeightsAlgoDirect:ConvAsmBwdWrW1x1,1.1112,0,miopenConvolutionBwdWeightsAlgoDirect,512x28x28x1x1x128x28x28x64xNCHWxFP32x0x0x1x1x1x1x1x0
128-28-28-3x3-128-28-28-64-1x1-1x1-1x1-0-NCHW-FP32-B=miopenConvolutionBwdDataAlgoWinograd:ConvBinWinograd3x3U,0.79056,0,miopenConvolutionBwdDataAlgoWinograd,128x28x28x3x3x128x28x28x64xNCHWxFP32x1x1x1x1x1x1x1x0
128-28-28-3x3-128-28-28-64-1x1-1x1-1x1-0-NCHW-FP32-W=miopenConvolutionBwdWeightsAlgoWinograd:ConvWinograd3x3MultipassWrW<3-4>,1.32288,117964800,miopenConvolutionBwdWeightsAlgoWinograd,128x28x28x3x3x128x28x28x64xNCHWxFP32x1x1x1x1x1x1x1x0;miopenConvolutionBwdWeightsAlgoGEMM:gemm,6.38976,3612672,rocBlas,<unused>;miopenConvolutionBwdWeightsAlgoDirect:ConvAsmBwdWrW3x3,1.75984,0,miopenConvolutionBwdWeightsAlgoDirect,128x28x28x3x3x128x28x28x64xNCHWxFP32x1x1x1x1x1x1x1x0
128-28-28-1x1-512-28-28-64-0x0-1x1-1x1-0-NCHW-FP32-B=miopenConvolutionBwdDataAlgoGEMM:gemm,0.69824,0,rocBlas,<unused>;miopenConvolutionBwdDataAlgoImplicitGEMM:ConvHipImplicitGemmV4_1x1,1.62224,0,miopenConvolutionBwdDataAlgoImplicitGEMM,128x28x28x1x1x512x28x28x64xNCHWxFP32x0x0x1x1x1x1x1x0;miopenConvolutionBwdDataAlgoWinograd:ConvBinWinogradRxSf3x2,2.09264,0,miopenConvolutionBwdDataAlgoWinograd,128x28x28x1x1x512x28x28x64xNCHWxFP32x0x0x1x1x1x1x1x0;miopenConvolutionBwdDataAlgoDirect:ConvAsm1x1U,0.65984,0,miopenConvolutionBwdDataAlgoDirect,128x28x28x1x1x512x28x28x64xNCHWxFP32x0x0x1x1x1x1x1x0
128-28-28-1x1-512-28-28-64-0x0-1x1-1x1-0-NCHW-FP32-W=miopenConvolutionBwdWeightsAlgoWinograd:ConvBinWinogradRxS,6.476,0,miopenConvolutionBwdWeightsAlgoWinograd,128x28x28x1x1x512x28x28x64xNCHWxFP32x0x0x1x1x1x1x1x0;miopenConvolutionBwdWeightsAlgoGEMM:gemm,3.05744,0,rocBlas,<unused>;miopenConvolutionBwdWeightsAlgoDirect:ConvAsmBwdWrW1x1,1.16784,0,miopenConvolutionBwdWeightsAlgoDirect,128x28x28x1x1x512x28x28x64xNCHWxFP32x0x0x1x1x1x1x1x0
512-28-28-1x1-256-56-56-64-0x0-2x2-1x1-0-NCHW-FP32-B=miopenConvolutionBwdDataAlgoDirect:ConvAsm1x1UV2,1.60496,0,miopenConvolutionBwdDataAlgoDirect,512x28x28x1x1x256x56x56x64xNCHWxFP32x0x0x2x2x1x1x1x0;miopenConvolutionBwdDataAlgoGEMM:gemm,3.004,154140672,rocBlas,<unused>;miopenConvolutionBwdDataAlgoImplicitGEMM:ConvHipImplicitGemmV4_1x1,2.00864,0,miopenConvolutionBwdDataAlgoImplicitGEMM,512x28x28x1x1x256x56x56x64xNCHWxFP32x0x0x2x2x1x1x1x0
512-28-28-1x1-256-56-56-64-0x0-2x2-1x1-0-NCHW-FP32-W=miopenConvolutionBwdWeightsAlgoDirect:ConvAsmBwdWrW1x1,2.77936,51380224,miopenConvolutionBwdWeightsAlgoDirect,512x28x28x1x1x256x56x56x64xNCHWxFP32x0x0x2x2x1x1x1x0;miopenConvolutionBwdWeightsAlgoGEMM:gemm,6.4512,802816,rocBlas,<unused>
128-28-28-3x3-128-56-56-64-1x1-2x2-1x1-0-NCHW-FP32-B=miopenConvolutionBwdDataAlgoGEMM:gemm,7.44448,3612672,rocBlas,<unused>;miopenConvolutionBwdDataAlgoWinograd:ConvBinWinogradRxS,3.72896,0,miopenConvolutionBwdDataAlgoWinograd,128x28x28x3x3x128x56x56x64xNCHWxFP32x1x1x2x2x1x1x1x0;miopenConvolutionBwdDataAlgoDirect:ConvOclDirectFwd,6.27056,0,miopenConvolutionBwdDataAlgoDirect,128x28x28x3x3x128x56x56x64xNCHWxFP32x1x1x2x2x1x1x1x0
128-28-28-3x3-128-56-56-64-1x1-2x2-1x1-0-NCHW-FP32-W=miopenConvolutionBwdWeightsAlgoWinograd:ConvWinograd3x3MultipassWrW<3-2>,4.91056,322764800,miopenConvolutionBwdWeightsAlgoWinograd,128x28x28x3x3x128x56x56x64xNCHWxFP32x1x1x2x2x1x1x1x0;miopenConvolutionBwdWeightsAlgoGEMM:gemm,7.0144,3612672,rocBlas,<unused>;miopenConvolutionBwdWeightsAlgoDirect:ConvAsmBwdWrW3x3,2.792,0,miopenConvolutionBwdWeightsAlgoDirect,128x28x28x3x3x128x56x56x64xNCHWxFP32x1x1x2x2x1x1x1x0
128-56-56-1x1-256-56-56-64-0x0-1x1-1x1-0-NCHW-FP32-B=miopenConvolutionBwdDataAlgoGEMM:gemm,1.27088,0,rocBlas,<unused>;miopenConvolutionBwdDataAlgoImplicitGEMM:ConvHipImplicitGemmV4_1x1,2.42288,0,miopenConvolutionBwdDataAlgoImplicitGEMM,128x56x56x1x1x256x56x56x64xNCHWxFP32x0x0x1x1x1x1x1x0;miopenConvolutionBwdDataAlgoWinograd:ConvBinWinogradRxSf3x2,3.3944,0,miopenConvolutionBwdDataAlgoWinograd,128x56x56x1x1x256x56x56x64xNCHWxFP32x0x0x1x1x1x1x1x0;miopenConvolutionBwdDataAlgoDirect:ConvAsm1x1U,1.7264,0,miopenConvolutionBwdDataAlgoDirect,128x56x56x1x1x256x56x56x64xNCHWxFP32x0x0x1x1x1x1x1x0
128-56-56-1x1-256-56-56-64-0x0-1x1-1x1-0-NCHW-FP32-W=miopenConvolutionBwdWeightsAlgoWinograd:ConvBinWinogradRxS,15.5198,0,miopenConvolutionBwdWeightsAlgoWinograd,128x56x56x1x1x256x56x56x64xNCHWxFP32x0x0x1x1x1x1x1x0;miopenConvolutionBwdWeightsAlgoGEMM:gemm,5.38912,0,rocBlas,<unused>;miopenConvolutionBwdWeightsAlgoDirect:ConvAsmBwdWrW1x1,3.05248,0,miopenConvolutionBwdWeightsAlgoDirect,128x56x56x1x1x256x56x56x64xNCHWxFP32x0x0x1x1x1x1x1x0
256-56-56-1x1-64-56-56-64-0x0-1x1-1x1-0-NCHW-FP32-B=miopenConvolutionBwdDataAlgoGEMM:gemm,0.65568,0,rocBlas,<unused>;miopenConvolutionBwdDataAlgoWinograd:ConvBinWinogradRxSf3x2,1.50784,0,miopenConvolutionBwdDataAlgoWinograd,256x56x56x1x1x64x56x56x64xNCHWxFP32x0x0x1x1x1x1x1x0;miopenConvolutionBwdDataAlgoDirect:ConvAsm1x1U,0.64848,0,miopenConvolutionBwdDataAlgoDirect,256x56x56x1x1x64x56x56x64xNCHWxFP32x0x0x1x1x1x1x1x0
256-56-56-1x1-64-56-56-64-0x0-1x1-1x1-0-NCHW-FP32-W=miopenConvolutionBwdWeightsAlgoWinograd:ConvBinWinogradRxS,13.6297,0,miopenConvolutionBwdWeightsAlgoWinograd,256x56x56x1x1x64x56x56x64xNCHWxFP32x0x0x1x1x1x1x1x0;miopenConvolutionBwdWeightsAlgoGEMM:gemm,3.87248,0,rocBlas,<unused>;miopenConvolutionBwdWeightsAlgoDirect:ConvAsmBwdWrW1x1,1.65904,0,miopenConvolutionBwdWeightsAlgoDirect,256x56x56x1x1x64x56x56x64xNCHWxFP32x0x0x1x1x1x1x1x0
64-56-56-3x3-64-56-56-64-1x1-1x1-1x1-0-NCHW-FP32-B=miopenConvolutionBwdDataAlgoWinograd:ConvBinWinograd3x3U,0.83136,0,miopenConvolutionBwdDataAlgoWinograd,64x56x56x3x3x64x56x56x64xNCHWxFP32x1x1x1x1x1x1x1x0
64-56-56-3x3-64-56-56-64-1x1-1x1-1x1-0-NCHW-FP32-W=miopenConvolutionBwdWeightsAlgoWinograd:ConvWinograd3x3MultipassWrW<3-4>,2.18336,231800832,miopenConvolutionBwdWeightsAlgoWinograd,64x56x56x3x3x64x56x56x64xNCHWxFP32x1x1x1x1x1x1x1x0;miopenConvolutionBwdWeightsAlgoGEMM:gemm,9.48224,7225344,rocBlas,<unused>;miopenConvolutionBwdWeightsAlgoDirect:ConvAsmBwdWrW3x3,2.1056,0,miopenConvolutionBwdWeightsAlgoDirect,64x56x56x3x3x64x56x56x64xNCHWxFP32x1x1x1x1x1x1x1x0
64-56-56-1x1-256-56-56-64-0x0-1x1-1x1-0-NCHW-FP32-B=miopenConvolutionBwdDataAlgoGEMM:gemm,0.67664,0,rocBlas,<unused>;miopenConvolutionBwdDataAlgoImplicitGEMM:ConvHipImplicitGemmV4_1x1,1.24544,0,miopenConvolutionBwdDataAlgoImplicitGEMM,64x56x56x1x1x256x56x56x64xNCHWxFP32x0x0x1x1x1x1x1x0;miopenConvolutionBwdDataAlgoWinograd:ConvBinWinogradRxSf3x2,1.7576,0,miopenConvolutionBwdDataAlgoWinograd,64x56x56x1x1x256x56x56x64xNCHWxFP32x0x0x1x1x1x1x1x0;miopenConvolutionBwdDataAlgoDirect:ConvAsm1x1U,0.71328,0,miopenConvolutionBwdDataAlgoDirect,64x56x56x1x1x256x56x56x64xNCHWxFP32x0x0x1x1x1x1x1x0
64-56-56-1x1-256-56-56-64-0x0-1x1-1x1-0-NCHW-FP32-W=miopenConvolutionBwdWeightsAlgoWinograd:ConvBinWinogradRxS,14.9973,0,miopenConvolutionBwdWeightsAlgoWinograd,64x56x56x1x1x256x56x56x64xNCHWxFP32x0x0x1x1x1x1x1x0;miopenConvolutionBwdWeightsAlgoGEMM:gemm,4.35984,0,rocBlas,<unused>;miopenConvolutionBwdWeightsAlgoDirect:ConvAsmBwdWrW1x1,1.87888,0,miopenConvolutionBwdWeightsAlgoDirect,64x56x56x1x1x256x56x56x64xNCHWxFP32x0x0x1x1x1x1x1x0
64-56-56-1x1-64-56-56-64-0x0-1x1-1x1-0-NCHW-FP32-B=miopenConvolutionBwdDataAlgoGEMM:gemm,0.42752,0,rocBlas,<unused>;miopenConvolutionBwdDataAlgoWinograd:ConvBinWinogradRxSf3x2,0.41968,0,miopenConvolutionBwdDataAlgoWinograd,64x56x56x1x1x64x56x56x64xNCHWxFP32x0x0x1x1x1x1x1x0;miopenConvolutionBwdDataAlgoDirect:ConvAsm1x1U,0.2064,0,miopenConvolutionBwdDataAlgoDirect,64x56x56x1x1x64x56x56x64xNCHWxFP32x0x0x1x1x1x1x1x0
64-56-56-1x1-64-56-56-64-0x0-1x1-1x1-0-NCHW-FP32-W=miopenConvolutionBwdWeightsAlgoWinograd:ConvBinWinogradRxS,14.0678,0,miopenConvolutionBwdWeightsAlgoWinograd,64x56x56x1x1x64x56x56x64xNCHWxFP32x0x0x1x1x1x1x1x0;miopenConvolutionBwdWeightsAlgoGEMM:gemm,2.90912,0,rocBlas,<unused>;miopenConvolutionBwdWeightsAlgoDirect:ConvAsmBwdWrW1x1,0.61632,0,miopenConvolutionBwdWeightsAlgoDirect,64x56x56x1x1x64x56x56x64xNCHWxFP32x0x0x1x1x1x1x1x0
64-112-112-7x7-3-224-224-64-3x3-2x2-1x1-0-NCHW-FP32-W=miopenConvolutionBwdWeightsAlgoDirect:ConvOclBwdWrW2<1>,4.56575,2408448,miopenConvolutionBwdWeightsAlgoDirect,64x112x112x7x7x3x224x224x64xNCHWxFP32x3x3x2x2x1x1x1x0;miopenConvolutionBwdWeightsAlgoGEMM:gemm,7.24992,7375872,rocBlas,<unused>
3-300-300-7x7-64-150-150-128-3x3-2x2-1x1-0-NCHW-FP32-F=miopenConvolutionFwdAlgoDirect:ConvOclDirectFwdGen,11.9333,0,miopenConvolutionFwdAlgoDirect,3x300x300x7x7x64x150x150x128xNCHWxFP32x3x3x2x2x1x1x1x1;miopenConvolutionFwdAlgoGEMM:gemm,18.5754,13230000,rocBlas,<unused>;miopenConvolutionFwdAlgoWinograd:ConvBinWinogradRxS,9.15313,0,miopenConvolutionFwdAlgoWinograd,3x300x300x7x7x64x150x150x128xNCHWxFP32x3x3x2x2x1x1x1x1
64-75-75-3x3-64-75-75-128-1x1-1x1-1x1-0-NCHW-FP32-F=miopenConvolutionFwdAlgoWinograd:ConvBinWinograd3x3U,2.61088,0,miopenConvolutionFwdAlgoWinograd,64x75x75x3x3x64x75x75x128xNCHWxFP32x1x1x1x1x1x1x1x1
64-75-75-3x3-128-38-38-128-1x1-2x2-1x1-0-NCHW-FP32-F=miopenConvolutionFwdAlgoDirect:ConvOclDirectFwdGen,19.9672,0,miopenConvolutionFwdAlgoDirect,64x75x75x3x3x128x38x38x128xNCHWxFP32x1x1x2x2x1x1x1x1;miopenConvolutionFwdAlgoGEMM:gemm,8.76544,3326976,rocBlas,<unused>;miopenConvolutionFwdAlgoWinograd:ConvBinWinogradRxS,5.1816,0,miopenConvolutionFwdAlgoWinograd,64x75x75x3x3x128x38x38x128xNCHWxFP32x1x1x2x2x1x1x1x1
128-38-38-3x3-128-38-38-128-1x1-1x1-1x1-0-NCHW-FP32-F=miopenConvolutionFwdAlgoWinograd:ConvBinWinograd3x3U,2.39024,0,miopenConvolutionFwdAlgoWinograd,128x38x38x3x3x128x38x38x128xNCHWxFP32x1x1x1x1x1x1x1x1
64-75-75-1x1-128-38-38-128-0x0-2x2-1x1-0-NCHW-FP32-F=miopenConvolutionFwdAlgoDirect:ConvOclDirectFwd1x1,0.5192,0,miopenConvolutionFwdAlgoDirect,64x75x75x1x1x128x38x38x128xNCHWxFP32x0x0x2x2x1x1x1x1;miopenConvolutionFwdAlgoGEMM:gemm,0.82304,141950976,rocBlas,<unused>;miopenConvolutionFwdAlgoImplicitGEMM:ConvHipImplicitGemmV4_1x1,0.5656,0,miopenConvolutionFwdAlgoImplicitGEMM,64x75x75x1x1x128x38x38x128xNCHWxFP32x0x0x2x2x1x1x1x1;miopenConvolutionFwdAlgoWinograd:ConvBinWinogradRxS,2.88624,0,miopenConvolutionFwdAlgoWinograd,64x75x75x1x1x128x38x38x128xNCHWxFP32x0x0x2x2x1x1x1x1
128-38-38-3x3-256-38-38-128-1x1-1x1-1x1-0-NCHW-FP32-F=miopenConvolutionFwdAlgoWinograd:ConvBinWinograd3x3U,4.9128,0,miopenConvolutionFwdAlgoWinograd,128x38x38x3x3x256x38x38x128xNCHWxFP32x1x1x1x1x1x1x1x1
256-38-38-3x3-256-38-38-128-1x1-1x1-1x1-0-NCHW-FP32-F=miopenConvolutionFwdAlgoWinograd:ConvBinWinograd3x3U,10.1504,0,miopenConvolutionFwdAlgoWinograd,256x38x38x3x3x256x38x38x128xNCHWxFP32x1x1x1x1x1x1x1x1
128-38-38-1x1-256-38-38-128-0x0-1x1-1x1-0-NCHW-FP32-F=miopenConvolutionFwdAlgoDirect:ConvOclDirectFwd1x1,2.1504,0,miopenConvolutionFwdAlgoDirect,128x38x38x1x1x256x38x38x128xNCHWxFP32x0x0x1x1x1x1x1x1;miopenConvolutionFwdAlgoGEMM:gemm,2.29136,0,rocBlas,<unused>;miopenConvolutionFwdAlgoStaticCompiledGEMM:ConvSCGemmFwd<SCGemmOpFGemm>,1.53328,1478656,miopenConvolutionFwdAlgoStaticCompiledGEMM,128x38x38x1x1x256x38x38x128xNCHWxFP32x0x0x1x1x1x1x1x1;miopenConvolutionFwdAlgoImplicitGEMM:ConvHipImplicitGemmV4Fwd,1.70928,0,miopenConvolutionFwdAlgoImplicitGEMM,128x38x38x1x1x256x38x38x128xNCHWxFP32x0x0x1x1x1x1x1x1;miopenConvolutionFwdAlgoWinograd:ConvBinWinogradRxSf3x2,2.96704,0,miopenConvolutionFwdAlgoWinograd,128x38x38x1x1x256x38x38x128xNCHWxFP32x0x0x1x1x1x1x1x1
256-38-38-1x1-256-38-38-128-0x0-1x1-1x1-0-NCHW-FP32-F=miopenConvolutionFwdAlgoDirect:ConvAsm1x1U,5.41168,0,miopenConvolutionFwdAlgoDirect,256x38x38x1x1x256x38x38x128xNCHWxFP32x0x0x1x1x1x1x1x1;miopenConvolutionFwdAlgoGEMM:gemm,2.43968,0,rocBlas,<unused>;miopenConvolutionFwdAlgoStaticCompiledGEMM:ConvSCGemmFwd<SCGemmOpFGemm>,2.6792,1478656,miopenConvolutionFwdAlgoStaticCompiledGEMM,256x38x38x1x1x256x38x38x128xNCHWxFP32x0x0x1x1x1x1x1x1;miopenConvolutionFwdAlgoImplicitGEMM:ConvHipImplicitGemmV4_1x1,2.79504,0,miopenConvolutionFwdAlgoImplicitGEMM,256x38x38x1x1x256x38x38x128xNCHWxFP32x0x0x1x1x1x1x1x1;miopenConvolutionFwdAlgoWinograd:ConvBinWinogradRxSf3x2,5.23072,0,miopenConvolutionFwdAlgoWinograd,256x38x38x1x1x256x38x38x128xNCHWxFP32x0x0x1x1x1x1x1x1
256-38-38-3x3-512-19-19-128-1x1-2x2-1x1-0-NCHW-FP32-F=miopenConvolutionFwdAlgoDirect:ConvOclDirectFwdGen,102.223,0,miopenConvolutionFwdAlgoDirect,256x38x38x3x3x512x19x19x128xNCHWxFP32x1x1x2x2x1x1x1x1;miopenConvolutionFwdAlgoGEMM:gemm,22.2618,3326976,rocBlas,<unused>;miopenConvolutionFwdAlgoWinograd:ConvBinWinogradRxS,22.5046,0,miopenConvolutionFwdAlgoWinograd,256x38x38x3x3x512x19x19x128xNCHWxFP32x1x1x2x2x1x1x1x1
512-19-19-1x1-256-19-19-128-0x0-1x1-1x1-0-NCHW-FP32-F=miopenConvolutionFwdAlgoDirect:ConvAsm1x1U,2.25024,0,miopenConvolutionFwdAlgoDirect,512x19x19x1x1x256x19x19x128xNCHWxFP32x0x0x1x1x1x1x1x1;miopenConvolutionFwdAlgoGEMM:gemm,1.25728,0,rocBlas,<unused>;miopenConvolutionFwdAlgoStaticCompiledGEMM:ConvSCGemmFwd<SCGemmOpFGemm>,1.39984,370688,miopenConvolutionFwdAlgoStaticCompiledGEMM,512x19x19x1x1x256x19x19x128xNCHWxFP32x0x0x1x1x1x1x1x1;miopenConvolutionFwdAlgoImplicitGEMM:ConvHipImplicitGemmV4_1x1,1.54816,0,miopenConvolutionFwdAlgoImplicitGEMM,512x19x19x1x1x256x19x19x128xNCHWxFP32x0x0x1x1x1x1x1x1;miopenConvolutionFwdAlgoWinograd:ConvBinWinogradRxSf3x2,2.87264,0,miopenConvolutionFwdAlgoWinograd,512x19x19x1x1x256x19x19x128xNCHWxFP32x0x0x1x1x1x1x1x1
256-19-19-3x3-512-10-10-128-1x1-2x2-1x1-0-NCHW-FP32-F=miopenConvolutionFwdAlgoDirect:ConvOclDirectFwdGen,31.5874,0,miopenConvolutionFwdAlgoDirect,256x19x19x3x3x512x10x10x128xNCHWxFP32x1x1x2x2x1x1x1x1;miopenConvolutionFwdAlgoGEMM:gemm,15.0118,921600,rocBlas,<unused>;miopenConvolutionFwdAlgoWinograd:ConvBinWinogradRxS,6.30864,0,miopenConvolutionFwdAlgoWinograd,256x19x19x3x3x512x10x10x128xNCHWxFP32x1x1x2x2x1x1x1x1
512-10-10-1x1-128-10-10-128-0x0-1x1-1x1-0-NCHW-FP32-F=miopenConvolutionFwdAlgoDirect:ConvOclDirectFwd1x1,0.45296,0,miopenConvolutionFwdAlgoDirect,512x10x10x1x1x128x10x10x128xNCHWxFP32x0x0x1x1x1x1x1x1;miopenConvolutionFwdAlgoGEMM:gemm,0.45104,32768000,rocBlas,<unused>;miopenConvolutionFwdAlgoStaticCompiledGEMM:ConvSCGemmFwd<SCGemmOpFGemm>,0.268,102400,miopenConvolutionFwdAlgoStaticCompiledGEMM,512x10x10x1x1x128x10x10x128xNCHWxFP32x0x0x1x1x1x1x1x1;miopenConvolutionFwdAlgoImplicitGEMM:ConvHipImplicitGemmV4_1x1,0.28304,0,miopenConvolutionFwdAlgoImplicitGEMM,512x10x10x1x1x128x10x10x128xNCHWxFP32x0x0x1x1x1x1x1x1;miopenConvolutionFwdAlgoWinograd:ConvBinWinogradRxSf3x2,0.60976,0,miopenConvolutionFwdAlgoWinograd,512x10x10x1x1x128x10x10x128xNCHWxFP32x0x0x1x1x1x1x1x1
128-10-10-3x3-256-5-5-128-1x1-2x2-1x1-0-NCHW-FP32-F=miopenConvolutionFwdAlgoDirect:ConvOclDirectFwdGen,6.3728,0,miopenConvolutionFwdAlgoDirect,128x10x10x3x3x256x5x5x128xNCHWxFP32x1x1x2x2x1x1x1x1;miopenConvolutionFwdAlgoGEMM:gemm,6.57408,115200,rocBlas,<unused>;miopenConvolutionFwdAlgoWinograd:ConvBinWinogradRxS,0.55056,0,miopenConvolutionFwdAlgoWinograd,128x10x10x3x3x256x5x5x128xNCHWxFP32x1x1x2x2x1x1x1x1
256-5-5-1x1-128-5-5-128-0x0-1x1-1x1-0-NCHW-FP32-F=miopenConvolutionFwdAlgoDirect:ConvOclDirectFwd1x1,0.11648,0,miopenConvolutionFwdAlgoDirect,256x5x5x1x1x128x5x5x128xNCHWxFP32x0x0x1x1x1x1x1x1;miopenConvolutionFwdAlgoGEMM:gemm,0.12816,4915200,rocBlas,<unused>;miopenConvolutionFwdAlgoStaticCompiledGEMM:ConvSCGemmFwd<SCGemmOpFGemm>,0.072,26624,miopenConvolutionFwdAlgoStaticCompiledGEMM,256x5x5x1x1x128x5x5x128xNCHWxFP32x0x0x1x1x1x1x1x1;miopenConvolutionFwdAlgoImplicitGEMM:ConvHipImplicitGemmV4_1x1,0.08768,0,miopenConvolutionFwdAlgoImplicitGEMM,256x5x5x1x1x128x5x5x128xNCHWxFP32x0x0x1x1x1x1x1x1;miopenConvolutionFwdAlgoWinograd:ConvBinWinogradRxSf3x2,0.14624,0,miopenConvolutionFwdAlgoWinograd,256x5x5x1x1x128x5x5x128xNCHWxFP32x0x0x1x1x1x1x1x1
128-5-5-3x3-256-3-3-128-0x0-1x1-1x1-0-NCHW-FP32-F=miopenConvolutionFwdAlgoDirect:ConvOclDirectFwd,1.27984,0,miopenConvolutionFwdAlgoDirect,128x5x5x3x3x256x3x3x128xNCHWxFP32x0x0x1x1x1x1x1x1;miopenConvolutionFwdAlgoGEMM:gemm,16.384,41472,rocBlas,<unused>;miopenConvolutionFwdAlgoImplicitGEMM:ConvHipImplicitGemmV4Fwd,0.32432,0,miopenConvolutionFwdAlgoImplicitGEMM,128x5x5x3x3x256x3x3x128xNCHWxFP32x0x0x1x1x1x1x1x1;miopenConvolutionFwdAlgoWinograd:ConvBinWinogradRxS,0.10624,0,miopenConvolutionFwdAlgoWinograd,128x5x5x3x3x256x3x3x128xNCHWxFP32x0x0x1x1x1x1x1x1
256-3-3-1x1-128-3-3-128-0x0-1x1-1x1-0-NCHW-FP32-F=miopenConvolutionFwdAlgoDirect:ConvOclDirectFwd1x1,0.10768,0,miopenConvolutionFwdAlgoDirect,256x3x3x1x1x128x3x3x128xNCHWxFP32x0x0x1x1x1x1x1x1;miopenConvolutionFwdAlgoGEMM:gemm,0.1144,1769472,rocBlas,<unused>;miopenConvolutionFwdAlgoStaticCompiledGEMM:ConvSCGemmFwd<SCGemmOpFGemm>,0.068,10240,miopenConvolutionFwdAlgoStaticCompiledGEMM,256x3x3x1x1x128x3x3x128xNCHWxFP32x0x0x1x1x1x1x1x1;miopenConvolutionFwdAlgoImplicitGEMM:ConvHipImplicitGemmV4Fwd,0.08288,0,miopenConvolutionFwdAlgoImplicitGEMM,256x3x3x1x1x128x3x3x128xNCHWxFP32x0x0x1x1x1x1x1x1;miopenConvolutionFwdAlgoWinograd:ConvBinWinogradRxSf3x2,0.11216,0,miopenConvolutionFwdAlgoWinograd,256x3x3x1x1x128x3x3x128xNCHWxFP32x0x0x1x1x1x1x1x1
128-3-3-3x3-256-1-1-128-0x0-1x1-1x1-0-NCHW-FP32-F=miopenConvolutionFwdAlgoDirect:ConvOclDirectFwd,1.27216,0,miopenConvolutionFwdAlgoDirect,128x3x3x3x3x256x1x1x128xNCHWxFP32x0x0x1x1x1x1x1x1;miopenConvolutionFwdAlgoGEMM:gemm,22.8762,4608,rocBlas,<unused>;miopenConvolutionFwdAlgoImplicitGEMM:ConvHipImplicitGemmV4Fwd,0.49536,0,miopenConvolutionFwdAlgoImplicitGEMM,128x3x3x3x3x256x1x1x128xNCHWxFP32x0x0x1x1x1x1x1x1;miopenConvolutionFwdAlgoWinograd:ConvBinWinogradRxS,0.05888,0,miopenConvolutionFwdAlgoWinograd,128x3x3x3x3x256x1x1x128xNCHWxFP32x0x0x1x1x1x1x1x1
256-38-38-3x3-16-38-38-128-1x1-1x1-1x1-0-NCHW-FP32-F=miopenConvolutionFwdAlgoWinograd:ConvBinWinogradRxS,1.40816,0,miopenConvolutionFwdAlgoWinograd,256x38x38x3x3x16x38x38x128xNCHWxFP32x1x1x1x1x1x1x1x1
256-38-38-3x3-324-38-38-128-1x1-1x1-1x1-0-NCHW-FP32-F=miopenConvolutionFwdAlgoWinograd:ConvBinWinograd3x3U,13.647,0,miopenConvolutionFwdAlgoWinograd,256x38x38x3x3x324x38x38x128xNCHWxFP32x1x1x1x1x1x1x1x1
512-19-19-3x3-24-19-19-128-1x1-1x1-1x1-0-NCHW-FP32-F=miopenConvolutionFwdAlgoWinograd:ConvBinWinograd3x3U,0.710559,0,miopenConvolutionFwdAlgoWinograd,512x19x19x3x3x24x19x19x128xNCHWxFP32x1x1x1x1x1x1x1x1
512-19-19-3x3-486-19-19-128-1x1-1x1-1x1-0-NCHW-FP32-F=miopenConvolutionFwdAlgoWinograd:ConvBinWinograd3x3U,11.3891,0,miopenConvolutionFwdAlgoWinograd,512x19x19x3x3x486x19x19x128xNCHWxFP32x1x1x1x1x1x1x1x1
512-10-10-3x3-24-10-10-128-1x1-1x1-1x1-0-NCHW-FP32-F=miopenConvolutionFwdAlgoWinograd:ConvBinWinogradRxS,0.23408,0,miopenConvolutionFwdAlgoWinograd,512x10x10x3x3x24x10x10x128xNCHWxFP32x1x1x1x1x1x1x1x1
512-10-10-3x3-486-10-10-128-1x1-1x1-1x1-0-NCHW-FP32-F=miopenConvolutionFwdAlgoWinograd:ConvBinWinogradRxS,3.00688,0,miopenConvolutionFwdAlgoWinograd,512x10x10x3x3x486x10x10x128xNCHWxFP32x1x1x1x1x1x1x1x1
256-5-5-3x3-24-5-5-128-1x1-1x1-1x1-0-NCHW-FP32-F=miopenConvolutionFwdAlgoWinograd:ConvBinWinogradRxS,0.06704,0,miopenConvolutionFwdAlgoWinograd,256x5x5x3x3x24x5x5x128xNCHWxFP32x1x1x1x1x1x1x1x1
256-5-5-3x3-486-5-5-128-1x1-1x1-1x1-0-NCHW-FP32-F=miopenConvolutionFwdAlgoWinograd:ConvBinWinogradRxS,0.49376,0,miopenConvolutionFwdAlgoWinograd,256x5x5x3x3x486x5x5x128xNCHWxFP32x1x1x1x1x1x1x1x1
256-3-3-3x3-16-3-3-128-1x1-1x1-1x1-0-NCHW-FP32-F=miopenConvolutionFwdAlgoWinograd:ConvBinWinograd3x3U,0.07088,0,miopenConvolutionFwdAlgoWinograd,256x3x3x3x3x16x3x3x128xNCHWxFP32x1x1x1x1x1x1x1x1
256-3-3-3x3-324-3-3-128-1x1-1x1-1x1-0-NCHW-FP32-F=miopenConvolutionFwdAlgoWinograd:ConvBinWinograd3x3U,0.23744,0,miopenConvolutionFwdAlgoWinograd,256x3x3x3x3x324x3x3x128xNCHWxFP32x1x1x1x1x1x1x1x1
256-1-1-3x3-16-1-1-128-1x1-1x1-1x1-0-NCHW-FP32-F=miopenConvolutionFwdAlgoWinograd:ConvBinWinograd3x3U,0.06704,0,miopenConvolutionFwdAlgoWinograd,256x1x1x3x3x16x1x1x128xNCHWxFP32x1x1x1x1x1x1x1x1
256-1-1-3x3-324-1-1-128-1x1-1x1-1x1-0-NCHW-FP32-F=miopenConvolutionFwdAlgoWinograd:ConvBinWinogradRxS,0.0752,0,miopenConvolutionFwdAlgoWinograd,256x1x1x3x3x324x1x1x128xNCHWxFP32x1x1x1x1x1x1x1x1
324-1-1-3x3-256-1-1-128-1x1-1x1-1x1-0-NCHW-FP32-B=miopenConvolutionBwdDataAlgoWinograd:ConvBinWinograd3x3U,0.07824,0,miopenConvolutionBwdDataAlgoWinograd,324x1x1x3x3x256x1x1x128xNCHWxFP32x1x1x1x1x1x1x1x0
324-1-1-3x3-256-1-1-128-1x1-1x1-1x1-0-NCHW-FP32-W=miopenConvolutionBwdWeightsAlgoWinograd:ConvBinWinogradRxS,0.09152,0,miopenConvolutionBwdWeightsAlgoWinograd,324x1x1x3x3x256x1x1x128xNCHWxFP32x1x1x1x1x1x1x1x0;miopenConvolutionBwdWeightsAlgoGEMM:gemm,10.1786,9216,rocBlas,<unused>;miopenConvolutionBwdWeightsAlgoDirect:ConvOclBwdWrW53,0.14256,0,miopenConvolutionBwdWeightsAlgoDirect,324x1x1x3x3x256x1x1x128xNCHWxFP32x1x1x1x1x1x1x1x0
16-1-1-3x3-256-1-1-128-1x1-1x1-1x1-0-NCHW-FP32-B=miopenConvolutionBwdDataAlgoGEMM:gemm,3.56352,9216,rocBlas,<unused>;miopenConvolutionBwdDataAlgoWinograd:ConvBinWinogradRxSf3x2,0.06144,0,miopenConvolutionBwdDataAlgoWinograd,16x1x1x3x3x256x1x1x128xNCHWxFP32x1x1x1x1x1x1x1x0;miopenConvolutionBwdDataAlgoDirect:ConvOclDirectFwd,0.17296,0,miopenConvolutionBwdDataAlgoDirect,16x1x1x3x3x256x1x1x128xNCHWxFP32x1x1x1x1x1x1x1x0
16-1-1-3x3-256-1-1-128-1x1-1x1-1x1-0-NCHW-FP32-W=miopenConvolutionBwdWeightsAlgoWinograd:ConvBinWinogradRxS,0.07696,0,miopenConvolutionBwdWeightsAlgoWinograd,16x1x1x3x3x256x1x1x128xNCHWxFP32x1x1x1x1x1x1x1x0;miopenConvolutionBwdWeightsAlgoGEMM:gemm,6.49216,9216,rocBlas,<unused>;miopenConvolutionBwdWeightsAlgoDirect:ConvAsmBwdWrW3x3,0.03568,0,miopenConvolutionBwdWeightsAlgoDirect,16x1x1x3x3x256x1x1x128xNCHWxFP32x1x1x1x1x1x1x1x0
324-3-3-3x3-256-3-3-128-1x1-1x1-1x1-0-NCHW-FP32-B=miopenConvolutionBwdDataAlgoWinograd:ConvBinWinograd3x3U,0.22368,0,miopenConvolutionBwdDataAlgoWinograd,324x3x3x3x3x256x3x3x128xNCHWxFP32x1x1x1x1x1x1x1x0
324-3-3-3x3-256-3-3-128-1x1-1x1-1x1-0-NCHW-FP32-W=miopenConvolutionBwdWeightsAlgoWinograd:ConvBinWinogradRxS,0.256,0,miopenConvolutionBwdWeightsAlgoWinograd,324x3x3x3x3x256x3x3x128xNCHWxFP32x1x1x1x1x1x1x1x0;miopenConvolutionBwdWeightsAlgoGEMM:gemm,15.7696,82944,rocBlas,<unused>;miopenConvolutionBwdWeightsAlgoDirect:ConvOclBwdWrW53,0.30352,0,miopenConvolutionBwdWeightsAlgoDirect,324x3x3x3x3x256x3x3x128xNCHWxFP32x1x1x1x1x1x1x1x0
16-3-3-3x3-256-3-3-128-1x1-1x1-1x1-0-NCHW-FP32-B=miopenConvolutionBwdDataAlgoGEMM:gemm,4.05504,82944,rocBlas,<unused>;miopenConvolutionBwdDataAlgoWinograd:ConvBinWinogradRxSf3x2,0.06816,0,miopenConvolutionBwdDataAlgoWinograd,16x3x3x3x3x256x3x3x128xNCHWxFP32x1x1x1x1x1x1x1x0;miopenConvolutionBwdDataAlgoDirect:ConvOclDirectFwd,0.17648,0,miopenConvolutionBwdDataAlgoDirect,16x3x3x3x3x256x3x3x128xNCHWxFP32x1x1x1x1x1x1x1x0
16-3-3-3x3-256-3-3-128-1x1-1x1-1x1-0-NCHW-FP32-W=miopenConvolutionBwdWeightsAlgoWinograd:ConvWinograd3x3MultipassWrW<3-4>,0.13152,5603328,miopenConvolutionBwdWeightsAlgoWinograd,16x3x3x3x3x256x3x3x128xNCHWxFP32x1x1x1x1x1x1x1x0;miopenConvolutionBwdWeightsAlgoGEMM:gemm,4.9152,82944,rocBlas,<unused>;miopenConvolutionBwdWeightsAlgoDirect:ConvAsmBwdWrW3x3,0.04976,0,miopenConvolutionBwdWeightsAlgoDirect,16x3x3x3x3x256x3x3x128xNCHWxFP32x1x1x1x1x1x1x1x0
486-5-5-3x3-256-5-5-128-1x1-1x1-1x1-0-NCHW-FP32-B=miopenConvolutionBwdDataAlgoWinograd:ConvBinWinograd3x3U,0.524959,0,miopenConvolutionBwdDataAlgoWinograd,486x5x5x3x3x256x5x5x128xNCHWxFP32x1x1x1x1x1x1x1x0
486-5-5-3x3-256-5-5-128-1x1-1x1-1x1-0-NCHW-FP32-W=miopenConvolutionBwdWeightsAlgoWinograd:ConvWinograd3x3MultipassWrW<3-4>,0.89024,72622080,miopenConvolutionBwdWeightsAlgoWinograd,486x5x5x3x3x256x5x5x128xNCHWxFP32x1x1x1x1x1x1x1x0;miopenConvolutionBwdWeightsAlgoGEMM:gemm,13.0253,230400,rocBlas,<unused>;miopenConvolutionBwdWeightsAlgoDirect:ConvOclBwdWrW53,1.52544,0,miopenConvolutionBwdWeightsAlgoDirect,486x5x5x3x3x256x5x5x128xNCHWxFP32x1x1x1x1x1x1x1x0
24-5-5-3x3-256-5-5-128-1x1-1x1-1x1-0-NCHW-FP32-B=miopenConvolutionBwdDataAlgoWinograd:ConvBinWinograd3x3U,0.05504,0,miopenConvolutionBwdDataAlgoWinograd,24x5x5x3x3x256x5x5x128xNCHWxFP32x1x1x1x1x1x1x1x0
24-5-5-3x3-256-5-5-128-1x1-1x1-1x1-0-NCHW-FP32-W=miopenConvolutionBwdWeightsAlgoWinograd:ConvWinograd3x3MultipassWrW<3-5>,0.19376,8228864,miopenConvolutionBwdWeightsAlgoWinograd,24x5x5x3x3x256x5x5x128xNCHWxFP32x1x1x1x1x1x1x1x0;miopenConvolutionBwdWeightsAlgoGEMM:gemm,15.2371,230400,rocBlas,<unused>;miopenConvolutionBwdWeightsAlgoDirect:ConvAsmBwdWrW3x3,0.08736,0,miopenConvolutionBwdWeightsAlgoDirect,24x5x5x3x3x256x5x5x128xNCHWxFP32x1x1x1x1x1x1x1x0
486-10-10-3x3-512-10-10-128-1x1-1x1-1x1-0-NCHW-FP32-B=miopenConvolutionBwdDataAlgoWinograd:ConvBinWinogradRxS,2.38528,0,miopenConvolutionBwdDataAlgoWinograd,486x10x10x3x3x512x10x10x128xNCHWxFP32x1x1x1x1x1x1x1x0
486-10-10-3x3-512-10-10-128-1x1-1x1-1x1-0-NCHW-FP32-W=miopenConvolutionBwdWeightsAlgoWinograd:ConvWinograd3x3MultipassWrW<3-5>,2.24528,148922368,miopenConvolutionBwdWeightsAlgoWinograd,486x10x10x3x3x512x10x10x128xNCHWxFP32x1x1x1x1x1x1x1x0;miopenConvolutionBwdWeightsAlgoGEMM:gemm,16.5274,1843200,rocBlas,<unused>;miopenConvolutionBwdWeightsAlgoDirect:ConvOclBwdWrW53,7.49807,0,miopenConvolutionBwdWeightsAlgoDirect,486x10x10x3x3x512x10x10x128xNCHWxFP32x1x1x1x1x1x1x1x0
24-10-10-3x3-512-10-10-128-1x1-1x1-1x1-0-NCHW-FP32-B=miopenConvolutionBwdDataAlgoWinograd:ConvBinWinograd3x3U,0.1992,0,miopenConvolutionBwdDataAlgoWinograd,24x10x10x3x3x512x10x10x128xNCHWxFP32x1x1x1x1x1x1x1x0
24-10-10-3x3-512-10-10-128-1x1-1x1-1x1-0-NCHW-FP32-W=miopenConvolutionBwdWeightsAlgoWinograd:ConvBinWinogradRxS,0.852319,0,miopenConvolutionBwdWeightsAlgoWinograd,24x10x10x3x3x512x10x10x128xNCHWxFP32x1x1x1x1x1x1x1x0;miopenConvolutionBwdWeightsAlgoGEMM:gemm,6.61504,1843200,rocBlas,<unused>;miopenConvolutionBwdWeightsAlgoDirect:ConvAsmBwdWrW3x3,0.640799,0,miopenConvolutionBwdWeightsAlgoDirect,24x10x10x3x3x512x10x10x128xNCHWxFP32x1x1x1x1x1x1x1x0
486-19-19-3x3-512-19-19-128-1x1-1x1-1x1-0-NCHW-FP32-B=miopenConvolutionBwdDataAlgoWinograd:ConvBinWinogradRxS,9.68494,0,miopenConvolutionBwdDataAlgoWinograd,486x19x19x3x3x512x19x19x128xNCHWxFP32x1x1x1x1x1x1x1x0
486-19-19-3x3-512-19-19-128-1x1-1x1-1x1-0-NCHW-FP32-W=miopenConvolutionBwdWeightsAlgoWinograd:ConvWinograd3x3MultipassWrW<3-4>,20.4803,495710208,miopenConvolutionBwdWeightsAlgoWinograd,486x19x19x3x3x512x19x19x128xNCHWxFP32x1x1x1x1x1x1x1x0;miopenConvolutionBwdWeightsAlgoGEMM:gemm,42.1683,6653952,rocBlas,<unused>;miopenConvolutionBwdWeightsAlgoDirect:ConvAsmBwdWrW3x3,40.4366,0,miopenConvolutionBwdWeightsAlgoDirect,486x19x19x3x3x512x19x19x128xNCHWxFP32x1x1x1x1x1x1x1x0
24-19-19-3x3-512-19-19-128-1x1-1x1-1x1-0-NCHW-FP32-B=miopenConvolutionBwdDataAlgoWinograd:ConvBinWinograd3x3U,0.744963,0,miopenConvolutionBwdDataAlgoWinograd,24x19x19x3x3x512x19x19x128xNCHWxFP32x1x1x1x1x1x1x1x0
24-19-19-3x3-512-19-19-128-1x1-1x1-1x1-0-NCHW-FP32-W=miopenConvolutionBwdWeightsAlgoWinograd:ConvBinWinogradRxS,2.40576,0,miopenConvolutionBwdWeightsAlgoWinograd,24x19x19x3x3x512x19x19x128xNCHWxFP32x1x1x1x1x1x1x1x0;miopenConvolutionBwdWeightsAlgoGEMM:gemm,15.6467,6653952,rocBlas,<unused>;miopenConvolutionBwdWeightsAlgoDirect:ConvAsmBwdWrW3x3,2.60592,0,miopenConvolutionBwdWeightsAlgoDirect,24x19x19x3x3x512x19x19x128xNCHWxFP32x1x1x1x1x1x1x1x0
324-38-38-3x3-256-38-38-128-1x1-1x1-1x1-0-NCHW-FP32-B=miopenConvolutionBwdDataAlgoWinograd:ConvBinWinograd3x3U,11.9691,0,miopenConvolutionBwdDataAlgoWinograd,324x38x38x3x3x256x38x38x128xNCHWxFP32x1x1x1x1x1x1x1x0
324-38-38-3x3-256-38-38-128-1x1-1x1-1x1-0-NCHW-FP32-W=miopenConvolutionBwdWeightsAlgoWinograd:ConvWinograd3x3MultipassWrW<3-6>,12.8597,952500224,miopenConvolutionBwdWeightsAlgoWinograd,324x38x38x3x3x256x38x38x128xNCHWxFP32x1x1x1x1x1x1x1x0;miopenConvolutionBwdWeightsAlgoGEMM:gemm,58.3681,13307904,rocBlas,<unused>;miopenConvolutionBwdWeightsAlgoDirect:ConvAsmBwdWrW3x3,76.2493,0,miopenConvolutionBwdWeightsAlgoDirect,324x38x38x3x3x256x38x38x128xNCHWxFP32x1x1x1x1x1x1x1x0
16-38-38-3x3-256-38-38-128-1x1-1x1-1x1-0-NCHW-FP32-B=miopenConvolutionBwdDataAlgoGEMM:gemm,18.2272,13307904,rocBlas,<unused>;miopenConvolutionBwdDataAlgoWinograd:ConvBinWinogradRxSf3x2,1.78272,0,miopenConvolutionBwdDataAlgoWinograd,16x38x38x3x3x256x38x38x128xNCHWxFP32x1x1x1x1x1x1x1x0;miopenConvolutionBwdDataAlgoDirect:ConvAsm3x3U,2.64161,0,miopenConvolutionBwdDataAlgoDirect,16x38x38x3x3x256x38x38x128xNCHWxFP32x1x1x1x1x1x1x1x0
16-38-38-3x3-256-38-38-128-1x1-1x1-1x1-0-NCHW-FP32-W=miopenConvolutionBwdWeightsAlgoWinograd:ConvWinograd3x3MultipassWrW<3-6>,3.73183,437780480,miopenConvolutionBwdWeightsAlgoWinograd,16x38x38x3x3x256x38x38x128xNCHWxFP32x1x1x1x1x1x1x1x0;miopenConvolutionBwdWeightsAlgoGEMM:gemm,19.8246,13307904,rocBlas,<unused>;miopenConvolutionBwdWeightsAlgoDirect:ConvAsmBwdWrW3x3,3.26431,0,miopenConvolutionBwdWeightsAlgoDirect,16x38x38x3x3x256x38x38x128xNCHWxFP32x1x1x1x1x1x1x1x0
256-1-1-3x3-128-3-3-128-0x0-1x1-1x1-0-NCHW-FP32-B=miopenConvolutionBwdDataAlgoGEMM:gemm,6.69696,4608,rocBlas,<unused>;miopenConvolutionBwdDataAlgoWinograd:ConvBinWinogradRxS,0.13168,0,miopenConvolutionBwdDataAlgoWinograd,256x1x1x3x3x128x3x3x128xNCHWxFP32x0x0x1x1x1x1x1x0;miopenConvolutionBwdDataAlgoDirect:ConvOclDirectFwd,1.3616,0,miopenConvolutionBwdDataAlgoDirect,256x1x1x3x3x128x3x3x128xNCHWxFP32x0x0x1x1x1x1x1x0
256-1-1-3x3-128-3-3-128-0x0-1x1-1x1-0-NCHW-FP32-W=miopenConvolutionBwdWeightsAlgoWinograd:ConvBinWinogradRxS,0.07824,0,miopenConvolutionBwdWeightsAlgoWinograd,256x1x1x3x3x128x3x3x128xNCHWxFP32x0x0x1x1x1x1x1x0;miopenConvolutionBwdWeightsAlgoGEMM:gemm,3.80928,4608,rocBlas,<unused>;miopenConvolutionBwdWeightsAlgoDirect:ConvOclBwdWrW53,0.18224,0,miopenConvolutionBwdWeightsAlgoDirect,256x1x1x3x3x128x3x3x128xNCHWxFP32x0x0x1x1x1x1x1x0
128-3-3-1x1-256-3-3-128-0x0-1x1-1x1-0-NCHW-FP32-B=miopenConvolutionBwdDataAlgoGEMM:gemm,0.09488,0,rocBlas,<unused>;miopenConvolutionBwdDataAlgoImplicitGEMM:ConvHipImplicitGemmV4_1x1,0.16,0,miopenConvolutionBwdDataAlgoImplicitGEMM,128x3x3x1x1x256x3x3x128xNCHWxFP32x0x0x1x1x1x1x1x0;miopenConvolutionBwdDataAlgoWinograd:ConvBinWinogradRxSf3x2,0.07136,0,miopenConvolutionBwdDataAlgoWinograd,128x3x3x1x1x256x3x3x128xNCHWxFP32x0x0x1x1x1x1x1x0;miopenConvolutionBwdDataAlgoDirect:ConvOclDirectFwd1x1,0.07232,0,miopenConvolutionBwdDataAlgoDirect,128x3x3x1x1x256x3x3x128xNCHWxFP32x0x0x1x1x1x1x1x0
128-3-3-1x1-256-3-3-128-0x0-1x1-1x1-0-NCHW-FP32-W=miopenConvolutionBwdWeightsAlgoWinograd:ConvBinWinogradRxS,0.15632,0,miopenConvolutionBwdWeightsAlgoWinograd,128x3x3x1x1x256x3x3x128xNCHWxFP32x0x0x1x1x1x1x1x0;miopenConvolutionBwdWeightsAlgoGEMM:gemm,3.14624,0,rocBlas,<unused>;miopenConvolutionBwdWeightsAlgoDirect:ConvAsmBwdWrW1x1,0.06944,0,miopenConvolutionBwdWeightsAlgoDirect,128x3x3x1x1x256x3x3x128xNCHWxFP32x0x0x1x1x1x1x1x0
256-3-3-3x3-128-5-5-128-0x0-1x1-1x1-0-NCHW-FP32-B=miopenConvolutionBwdDataAlgoGEMM:gemm,5.632,41472,rocBlas,<unused>;miopenConvolutionBwdDataAlgoWinograd:ConvBinWinogradRxS,0.18576,0,miopenConvolutionBwdDataAlgoWinograd,256x3x3x3x3x128x5x5x128xNCHWxFP32x0x0x1x1x1x1x1x0;miopenConvolutionBwdDataAlgoDirect:ConvOclDirectFwd,1.40832,0,miopenConvolutionBwdDataAlgoDirect,256x3x3x3x3x128x5x5x128xNCHWxFP32x0x0x1x1x1x1x1x0
256-3-3-3x3-128-5-5-128-0x0-1x1-1x1-0-NCHW-FP32-W=miopenConvolutionBwdWeightsAlgoWinograd:ConvBinWinogradRxS,0.16464,0,miopenConvolutionBwdWeightsAlgoWinograd,256x3x3x3x3x128x5x5x128xNCHWxFP32x0x0x1x1x1x1x1x0;miopenConvolutionBwdWeightsAlgoGEMM:gemm,4.73088,41472,rocBlas,<unused>;miopenConvolutionBwdWeightsAlgoDirect:ConvOclBwdWrW53,0.41664,0,miopenConvolutionBwdWeightsAlgoDirect,256x3x3x3x3x128x5x5x128xNCHWxFP32x0x0x1x1x1x1x1x0
128-5-5-1x1-256-5-5-128-0x0-1x1-1x1-0-NCHW-FP32-B=miopenConvolutionBwdDataAlgoGEMM:gemm,0.09104,0,rocBlas,<unused>;miopenConvolutionBwdDataAlgoImplicitGEMM:ConvHipImplicitGemmV4_1x1,0.11808,0,miopenConvolutionBwdDataAlgoImplicitGEMM,128x5x5x1x1x256x5x5x128xNCHWxFP32x0x0x1x1x1x1x1x0;miopenConvolutionBwdDataAlgoWinograd:ConvBinWinogradRxSf3x2,0.12368,0,miopenConvolutionBwdDataAlgoWinograd,128x5x5x1x1x256x5x5x128xNCHWxFP32x0x0x1x1x1x1x1x0;miopenConvolutionBwdDataAlgoDirect:ConvOclDirectFwd1x1,0.06912,0,miopenConvolutionBwdDataAlgoDirect,128x5x5x1x1x256x5x5x128xNCHWxFP32x0x0x1x1x1x1x1x0
128-5-5-1x1-256-5-5-128-0x0-1x1-1x1-0-NCHW-FP32-W=miopenConvolutionBwdWeightsAlgoWinograd:ConvBinWinogradRxS,0.38352,0,miopenConvolutionBwdWeightsAlgoWinograd,128x5x5x1x1x256x5x5x128xNCHWxFP32x0x0x1x1x1x1x1x0;miopenConvolutionBwdWeightsAlgoGEMM:gemm,3.1224,0,rocBlas,<unused>;miopenConvolutionBwdWeightsAlgoDirect:ConvAsmBwdWrW1x1,0.09792,0,miopenConvolutionBwdWeightsAlgoDirect,128x5x5x1x1x256x5x5x128xNCHWxFP32x0x0x1x1x1x1x1x0
256-5-5-3x3-128-10-10-128-1x1-2x2-1x1-0-NCHW-FP32-B=miopenConvolutionBwdDataAlgoGEMM:gemm,15.2166,115200,rocBlas,<unused>;miopenConvolutionBwdDataAlgoWinograd:ConvBinWinogradRxS,0.59568,0,miopenConvolutionBwdDataAlgoWinograd,256x5x5x3x3x128x10x10x128xNCHWxFP32x1x1x2x2x1x1x1x0;miopenConvolutionBwdDataAlgoDirect:ConvOclDirectFwd,1.63888,0,miopenConvolutionBwdDataAlgoDirect,256x5x5x3x3x128x10x10x128xNCHWxFP32x1x1x2x2x1x1x1x0
256-5-5-3x3-128-10-10-128-1x1-2x2-1x1-0-NCHW-FP32-W=miopenConvolutionBwdWeightsAlgoWinograd:ConvWinograd3x3MultipassWrW<3-2>,0.87408,47513600,miopenConvolutionBwdWeightsAlgoWinograd,256x5x5x3x3x128x10x10x128xNCHWxFP32x1x1x2x2x1x1x1x0;miopenConvolutionBwdWeightsAlgoGEMM:gemm,14.295,115200,rocBlas,<unused>;miopenConvolutionBwdWeightsAlgoDirect:ConvAsmBwdWrW3x3,1.17024,0,miopenConvolutionBwdWeightsAlgoDirect,256x5x5x3x3x128x10x10x128xNCHWxFP32x1x1x2x2x1x1x1x0
128-10-10-1x1-512-10-10-128-0x0-1x1-1x1-0-NCHW-FP32-B=miopenConvolutionBwdDataAlgoGEMM:gemm,0.25664,0,rocBlas,<unused>;miopenConvolutionBwdDataAlgoImplicitGEMM:ConvHipImplicitGemmV4_1x1,0.33488,0,miopenConvolutionBwdDataAlgoImplicitGEMM,128x10x10x1x1x512x10x10x128xNCHWxFP32x0x0x1x1x1x1x1x0;miopenConvolutionBwdDataAlgoWinograd:ConvBinWinogradRxSf3x2,0.60768,0,miopenConvolutionBwdDataAlgoWinograd,128x10x10x1x1x512x10x10x128xNCHWxFP32x0x0x1x1x1x1x1x0;miopenConvolutionBwdDataAlgoDirect:ConvAsm1x1U,0.44992,0,miopenConvolutionBwdDataAlgoDirect,128x10x10x1x1x512x10x10x128xNCHWxFP32x0x0x1x1x1x1x1x0
128-10-10-1x1-512-10-10-128-0x0-1x1-1x1-0-NCHW-FP32-W=miopenConvolutionBwdWeightsAlgoWinograd:ConvBinWinogradRxS,1.68736,0,miopenConvolutionBwdWeightsAlgoWinograd,128x10x10x1x1x512x10x10x128xNCHWxFP32x0x0x1x1x1x1x1x0;miopenConvolutionBwdWeightsAlgoGEMM:gemm,2.96592,0,rocBlas,<unused>;miopenConvolutionBwdWeightsAlgoDirect:ConvOclBwdWrW1x1,0.7968,0,miopenConvolutionBwdWeightsAlgoDirect,128x10x10x1x1x512x10x10x128xNCHWxFP32x0x0x1x1x1x1x1x0
512-10-10-3x3-256-19-19-128-1x1-2x2-1x1-0-NCHW-FP32-B=miopenConvolutionBwdDataAlgoGEMM:gemm,11.1411,921600,rocBlas,<unused>;miopenConvolutionBwdDataAlgoWinograd:ConvBinWinogradRxS,9.17391,0,miopenConvolutionBwdDataAlgoWinograd,512x10x10x3x3x256x19x19x128xNCHWxFP32x1x1x2x2x1x1x1x0;miopenConvolutionBwdDataAlgoDirect:ConvOclDirectFwd,27.0317,0,miopenConvolutionBwdDataAlgoDirect,512x10x10x3x3x256x19x19x128xNCHWxFP32x1x1x2x2x1x1x1x0
512-10-10-3x3-256-19-19-128-1x1-2x2-1x1-0-NCHW-FP32-W=miopenConvolutionBwdWeightsAlgoWinograd:ConvWinograd3x3MultipassWrW<3-2>,4.82784,258867200,miopenConvolutionBwdWeightsAlgoWinograd,512x10x10x3x3x256x19x19x128xNCHWxFP32x1x1x2x2x1x1x1x0;miopenConvolutionBwdWeightsAlgoGEMM:gemm,30.208,921600,rocBlas,<unused>;miopenConvolutionBwdWeightsAlgoDirect:ConvAsmBwdWrW3x3,16.9845,0,miopenConvolutionBwdWeightsAlgoDirect,512x10x10x3x3x256x19x19x128xNCHWxFP32x1x1x2x2x1x1x1x0
256-19-19-1x1-512-19-19-128-0x0-1x1-1x1-0-NCHW-FP32-B=miopenConvolutionBwdDataAlgoGEMM:gemm,1.31472,0,rocBlas,<unused>;miopenConvolutionBwdDataAlgoImplicitGEMM:ConvHipImplicitGemmV4_1x1,1.3696,0,miopenConvolutionBwdDataAlgoImplicitGEMM,256x19x19x1x1x512x19x19x128xNCHWxFP32x0x0x1x1x1x1x1x0;miopenConvolutionBwdDataAlgoWinograd:ConvBinWinogradRxSf3x2,3.50047,0,miopenConvolutionBwdDataAlgoWinograd,256x19x19x1x1x512x19x19x128xNCHWxFP32x0x0x1x1x1x1x1x0;miopenConvolutionBwdDataAlgoDirect:ConvAsm1x1U,2.40704,0,miopenConvolutionBwdDataAlgoDirect,256x19x19x1x1x512x19x19x128xNCHWxFP32x0x0x1x1x1x1x1x0
256-19-19-1x1-512-19-19-128-0x0-1x1-1x1-0-NCHW-FP32-W=miopenConvolutionBwdWeightsAlgoWinograd:ConvBinWinogradRxS,10.8765,0,miopenConvolutionBwdWeightsAlgoWinograd,256x19x19x1x1x512x19x19x128xNCHWxFP32x0x0x1x1x1x1x1x0;miopenConvolutionBwdWeightsAlgoGEMM:gemm,5.10975,0,rocBlas,<unused>;miopenConvolutionBwdWeightsAlgoDirect:ConvOclBwdWrW1x1,4.23024,0,miopenConvolutionBwdWeightsAlgoDirect,256x19x19x1x1x512x19x19x128xNCHWxFP32x0x0x1x1x1x1x1x0
512-19-19-3x3-256-38-38-128-1x1-2x2-1x1-0-NCHW-FP32-B=miopenConvolutionBwdDataAlgoGEMM:gemm,19.6608,3326976,rocBlas,<unused>;miopenConvolutionBwdDataAlgoWinograd:ConvBinWinogradRxS,21.7797,0,miopenConvolutionBwdDataAlgoWinograd,512x19x19x3x3x256x38x38x128xNCHWxFP32x1x1x2x2x1x1x1x0;miopenConvolutionBwdDataAlgoDirect:ConvOclDirectFwd,88.8087,0,miopenConvolutionBwdDataAlgoDirect,512x19x19x3x3x256x38x38x128xNCHWxFP32x1x1x2x2x1x1x1x0
512-19-19-3x3-256-38-38-128-1x1-2x2-1x1-0-NCHW-FP32-W=miopenConvolutionBwdWeightsAlgoWinograd:ConvWinograd3x3MultipassWrW<3-3>,21.6472,969801728,miopenConvolutionBwdWeightsAlgoWinograd,512x19x19x3x3x256x38x38x128xNCHWxFP32x1x1x2x2x1x1x1x0;miopenConvolutionBwdWeightsAlgoGEMM:gemm,17.5104,3326976,rocBlas,<unused>;miopenConvolutionBwdWeightsAlgoDirect:ConvAsmBwdWrW3x3,68.0561,0,miopenConvolutionBwdWeightsAlgoDirect,512x19x19x3x3x256x38x38x128xNCHWxFP32x1x1x2x2x1x1x1x0
256-38-38-1x1-256-38-38-128-0x0-1x1-1x1-0-NCHW-FP32-B=miopenConvolutionBwdDataAlgoGEMM:gemm,2.44032,0,rocBlas,<unused>;miopenConvolutionBwdDataAlgoImplicitGEMM:ConvHipImplicitGemmV4_1x1,2.70736,0,miopenConvolutionBwdDataAlgoImplicitGEMM,256x38x38x1x1x256x38x38x128xNCHWxFP32x0x0x1x1x1x1x1x0;miopenConvolutionBwdDataAlgoWinograd:ConvBinWinogradRxSf3x2,5.45936,0,miopenConvolutionBwdDataAlgoWinograd,256x38x38x1x1x256x38x38x128xNCHWxFP32x0x0x1x1x1x1x1x0;miopenConvolutionBwdDataAlgoDirect:ConvAsm1x1U,4.96608,0,miopenConvolutionBwdDataAlgoDirect,256x38x38x1x1x256x38x38x128xNCHWxFP32x0x0x1x1x1x1x1x0
256-38-38-1x1-256-38-38-128-0x0-1x1-1x1-0-NCHW-FP32-W=miopenConvolutionBwdWeightsAlgoWinograd:ConvBinWinogradRxS,23.0425,0,miopenConvolutionBwdWeightsAlgoWinograd,256x38x38x1x1x256x38x38x128xNCHWxFP32x0x0x1x1x1x1x1x0;miopenConvolutionBwdWeightsAlgoGEMM:gemm,10.4865,0,rocBlas,<unused>;miopenConvolutionBwdWeightsAlgoDirect:ConvOclBwdWrW1x1,11.4145,0,miopenConvolutionBwdWeightsAlgoDirect,256x38x38x1x1x256x38x38x128xNCHWxFP32x0x0x1x1x1x1x1x0
256-38-38-3x3-256-38-38-128-1x1-1x1-1x1-0-NCHW-FP32-B=miopenConvolutionBwdDataAlgoWinograd:ConvBinWinograd3x3U,9.98911,0,miopenConvolutionBwdDataAlgoWinograd,256x38x38x3x3x256x38x38x128xNCHWxFP32x1x1x1x1x1x1x1x0
256-38-38-3x3-256-38-38-128-1x1-1x1-1x1-0-NCHW-FP32-W=miopenConvolutionBwdWeightsAlgoWinograd:ConvWinograd3x3MultipassWrW<3-6>,10.0974,838860800,miopenConvolutionBwdWeightsAlgoWinograd,256x38x38x3x3x256x38x38x128xNCHWxFP32x1x1x1x1x1x1x1x0;miopenConvolutionBwdWeightsAlgoGEMM:gemm,44.8307,13307904,rocBlas,<unused>;miopenConvolutionBwdWeightsAlgoDirect:ConvAsmBwdWrW3x3,37.7622,0,miopenConvolutionBwdWeightsAlgoDirect,256x38x38x3x3x256x38x38x128xNCHWxFP32x1x1x1x1x1x1x1x0
256-38-38-1x1-128-38-38-128-0x0-1x1-1x1-0-NCHW-FP32-B=miopenConvolutionBwdDataAlgoGEMM:gemm,1.2768,0,rocBlas,<unused>;miopenConvolutionBwdDataAlgoImplicitGEMM:ConvHipImplicitGemmV4_1x1,1.47104,0,miopenConvolutionBwdDataAlgoImplicitGEMM,256x38x38x1x1x128x38x38x128xNCHWxFP32x0x0x1x1x1x1x1x0;miopenConvolutionBwdDataAlgoWinograd:ConvBinWinogradRxSf3x2,2.5912,0,miopenConvolutionBwdDataAlgoWinograd,256x38x38x1x1x128x38x38x128xNCHWxFP32x0x0x1x1x1x1x1x0;miopenConvolutionBwdDataAlgoDirect:ConvAsm1x1U,2.42848,0,miopenConvolutionBwdDataAlgoDirect,256x38x38x1x1x128x38x38x128xNCHWxFP32x0x0x1x1x1x1x1x0
256-38-38-1x1-128-38-38-128-0x0-1x1-1x1-0-NCHW-FP32-W=miopenConvolutionBwdWeightsAlgoWinograd:ConvBinWinogradRxS,11.2283,0,miopenConvolutionBwdWeightsAlgoWinograd,256x38x38x1x1x128x38x38x128xNCHWxFP32x0x0x1x1x1x1x1x0;miopenConvolutionBwdWeightsAlgoGEMM:gemm,9.08607,0,rocBlas,<unused>;miopenConvolutionBwdWeightsAlgoDirect:ConvOclBwdWrW1x1,6.69711,0,miopenConvolutionBwdWeightsAlgoDirect,256x38x38x1x1x128x38x38x128xNCHWxFP32x0x0x1x1x1x1x1x0
256-38-38-3x3-128-38-38-128-1x1-1x1-1x1-0-NCHW-FP32-B=miopenConvolutionBwdDataAlgoWinograd:ConvBinWinograd3x3U,4.98864,0,miopenConvolutionBwdDataAlgoWinograd,256x38x38x3x3x128x38x38x128xNCHWxFP32x1x1x1x1x1x1x1x0
256-38-38-3x3-128-38-38-128-1x1-1x1-1x1-0-NCHW-FP32-W=miopenConvolutionBwdWeightsAlgoWinograd:ConvWinograd3x3MultipassWrW<3-6>,5.95808,624951296,miopenConvolutionBwdWeightsAlgoWinograd,256x38x38x3x3x128x38x38x128xNCHWxFP32x1x1x1x1x1x1x1x0;miopenConvolutionBwdWeightsAlgoGEMM:gemm,25.8662,6653952,rocBlas,<unused>;miopenConvolutionBwdWeightsAlgoDirect:ConvAsmBwdWrW3x3,17.7832,0,miopenConvolutionBwdWeightsAlgoDirect,256x38x38x3x3x128x38x38x128xNCHWxFP32x1x1x1x1x1x1x1x0
128-38-38-3x3-128-38-38-128-1x1-1x1-1x1-0-NCHW-FP32-B=miopenConvolutionBwdDataAlgoWinograd:ConvBinWinogradRxS,2.41984,0,miopenConvolutionBwdDataAlgoWinograd,128x38x38x3x3x128x38x38x128xNCHWxFP32x1x1x1x1x1x1x1x0
128-38-38-3x3-128-38-38-128-1x1-1x1-1x1-0-NCHW-FP32-W=miopenConvolutionBwdWeightsAlgoWinograd:ConvWinograd3x3MultipassWrW<3-6>,3.5096,415236096,miopenConvolutionBwdWeightsAlgoWinograd,128x38x38x3x3x128x38x38x128xNCHWxFP32x1x1x1x1x1x1x1x0;miopenConvolutionBwdWeightsAlgoGEMM:gemm,22.016,6653952,rocBlas,<unused>;miopenConvolutionBwdWeightsAlgoDirect:ConvAsmBwdWrW3x3,9.13311,0,miopenConvolutionBwdWeightsAlgoDirect,128x38x38x3x3x128x38x38x128xNCHWxFP32x1x1x1x1x1x1x1x0
128-38-38-1x1-64-75-75-128-0x0-2x2-1x1-0-NCHW-FP32-B=miopenConvolutionBwdDataAlgoGEMM:gemm,2.14336,141950976,rocBlas,<unused>;miopenConvolutionBwdDataAlgoDirect:ConvOclDirectFwd1x1,1.18016,0,miopenConvolutionBwdDataAlgoDirect,128x38x38x1x1x64x75x75x128xNCHWxFP32x0x0x2x2x1x1x1x0
128-38-38-1x1-64-75-75-128-0x0-2x2-1x1-0-NCHW-FP32-W=miopenConvolutionBwdWeightsAlgoDirect:ConvOclBwdWrW1x1,2.32528,47316992,miopenConvolutionBwdWeightsAlgoDirect,128x38x38x1x1x64x75x75x128xNCHWxFP32x0x0x2x2x1x1x1x0;miopenConvolutionBwdWeightsAlgoGEMM:gemm,19.6403,369664,rocBlas,<unused>
128-38-38-3x3-64-75-75-128-1x1-2x2-1x1-0-NCHW-FP32-B=miopenConvolutionBwdDataAlgoGEMM:gemm,12.6157,3326976,rocBlas,<unused>;miopenConvolutionBwdDataAlgoWinograd:ConvBinWinogradRxS,5.04,0,miopenConvolutionBwdDataAlgoWinograd,128x38x38x3x3x64x75x75x128xNCHWxFP32x1x1x2x2x1x1x1x0;miopenConvolutionBwdDataAlgoDirect:ConvOclDirectFwd,13.1885,0,miopenConvolutionBwdDataAlgoDirect,128x38x38x3x3x64x75x75x128xNCHWxFP32x1x1x2x2x1x1x1x0
128-38-38-3x3-64-75-75-128-1x1-2x2-1x1-0-NCHW-FP32-W=miopenConvolutionBwdWeightsAlgoWinograd:ConvWinograd3x3MultipassWrW<3-2>,9.78079,888012800,miopenConvolutionBwdWeightsAlgoWinograd,128x38x38x3x3x64x75x75x128xNCHWxFP32x1x1x2x2x1x1x1x0;miopenConvolutionBwdWeightsAlgoGEMM:gemm,17.5718,3326976,rocBlas,<unused>;miopenConvolutionBwdWeightsAlgoDirect:ConvAsmBwdWrW3x3,16.0293,0,miopenConvolutionBwdWeightsAlgoDirect,128x38x38x3x3x64x75x75x128xNCHWxFP32x1x1x2x2x1x1x1x0
64-75-75-3x3-64-75-75-128-1x1-1x1-1x1-0-NCHW-FP32-B=miopenConvolutionBwdDataAlgoWinograd:ConvBinWinogradRxS,2.6712,0,miopenConvolutionBwdDataAlgoWinograd,64x75x75x3x3x64x75x75x128xNCHWxFP32x1x1x1x1x1x1x1x0
64-75-75-3x3-64-75-75-128-1x1-1x1-1x1-0-NCHW-FP32-W=miopenConvolutionBwdWeightsAlgoWinograd:ConvWinograd3x3MultipassWrW<3-6>,7.78047,709885952,miopenConvolutionBwdWeightsAlgoWinograd,64x75x75x3x3x64x75x75x128xNCHWxFP32x1x1x1x1x1x1x1x0;miopenConvolutionBwdWeightsAlgoGEMM:gemm,25.1699,12960000,rocBlas,<unused>;miopenConvolutionBwdWeightsAlgoDirect:ConvAsmBwdWrW3x3,10.9525,0,miopenConvolutionBwdWeightsAlgoDirect,64x75x75x3x3x64x75x75x128xNCHWxFP32x1x1x1x1x1x1x1x0
64-150-150-7x7-3-300-300-128-3x3-2x2-1x1-0-NCHW-FP32-B=miopenConvolutionBwdDataAlgoGEMM:gemm,18.0634,13230000,rocBlas,<unused>;miopenConvolutionBwdDataAlgoWinograd:ConvBinWinogradRxS,29.1916,0,miopenConvolutionBwdDataAlgoWinograd,64x150x150x7x7x3x300x300x128xNCHWxFP32x3x3x2x2x1x1x1x0;miopenConvolutionBwdDataAlgoDirect:ConvOclDirectFwd,15.0201,0,miopenConvolutionBwdDataAlgoDirect,64x150x150x7x7x3x300x300x128xNCHWxFP32x3x3x2x2x1x1x1x0
64-150-150-7x7-3-300-300-128-3x3-2x2-1x1-0-NCHW-FP32-W=miopenConvolutionBwdWeightsAlgoDirect:ConvOclBwdWrW2<4>,34.9779,1204224,miopenConvolutionBwdWeightsAlgoDirect,64x150x150x7x7x3x300x300x128xNCHWxFP32x3x3x2x2x1x1x1x0;miopenConvolutionBwdWeightsAlgoGEMM:gemm,28.0371,13230000,rocBlas,<unused>
